,date,titre,budget,recette,duree,genres,synopsis,tagline,realisateur,casting,compagnies_production,suite,production_countries,langues,imdb_id,vote_average,vote_count,status
0,2013-10-25,The Counselor,25000000,71009334,117,"['Thriller', 'Crime', 'Drama']",A lawyer finds himself in far over his head when he attempts to get involved in drug trafficking.,Sin is a choice.,['Ridley Scott'],"['Michael Fassbender', 'Penélope Cruz', 'Cameron Diaz', 'Javier Bardem', 'Brad Pitt', 'Bruno Ganz', 'Rosie Perez', 'Sam Spruell', 'Toby Kebbell', 'Edgar Ramírez', 'Rubén Blades', 'Natalie Dormer', 'Goran Visnjic', 'Daniel Holguín', 'Chris Obi', 'Richard Cabral', 'Provence Maydew', 'Paris Jefferson', 'Dar Dash', 'Alex Hafner', 'Andrea Deck', 'Emma Rigby', 'Eben Young', 'Richard Brake', 'Barbara Durkin', 'Giannina Facio', 'Velibor Topic', 'Juan José Rodríguez', 'Alexander Biggie', 'Pablo Paredes', 'Cavassa Ventura', 'Frank Spano', 'Alejandro Marzal', 'Gerard Monaco', 'Fernando Cayo', 'Dean Norris', 'John Leguizamo', 'Carlos Julio Molina', 'Donna Air', 'Marco Tulio Luna', 'Lidia Cardona', 'Roger Dalmases', 'Julien Vialon']","['Ingenious Media', 'Fox 2000 Pictures', 'Scott Free Productions', 'Kanzaman', 'Nick Wechsler Productions', 'Big Screen Productions', 'Chockstone Pictures', 'TSG Entertainment']",1,"['US', 'GB']","['en', 'es']",tt2193215,5.245,1606,Released
1,2012-09-07,Passion,20000000,713616,100,"['Thriller', 'Drama', 'Crime', 'Mystery']",The rivalry between the manipulative boss of an advertising agency and her talented protégée escalates from stealing credit to public humiliation to murder.,No backstabbing. Just business,['Brian De Palma'],"['Rachel McAdams', 'Noomi Rapace', 'Karoline Herfurth', 'Paul Anderson', 'Dominic Raacke', 'Rainer Bock', 'Benjamin Sadler', 'Michael Rotschopf', 'Max Urlacher', 'Jörg Pintsch', 'Trystan Pütter', 'Patrick Heyn', 'Carlos Castro', 'Melissa Holroyd', 'Ian T. Dickinson', 'Frank Witter', 'Leila Rozario', 'Alexander Yassin', 'Gernot Kunert', 'Katrin Pollitt', 'Polina Semionova']","['France 2 Cinéma', 'Integral Film', 'SBS Productions']",1,"['DE', 'ES', 'FR', 'GB']","['en', 'de']",tt1829012,5.292,348,Released
2,1981-04-03,This Is Elvis,5000000,2028612,110,"['Drama', 'Music', 'Documentary']","Though several actors portray Elvis Presley at different stages of his life, this documentary is comprised mostly of actual performance footage and interviews with Elvis, his fans and those close to him. This biographical docu-drama features rare footage of Elvis and dramatically recreated scenes from Elvis' life.",This is the sound he created and performed. The rare personal films never before seen by the public. The private moments. The public triumphs. Intimate memories and reflections in his own words.,['Malcolm Leo'],"['Linda Thompson', 'David Scott', 'Paul Boensch III', 'Dana MacKay', 'Johnny Harra', 'Lawrence Koller', 'Rhonda Lyn', 'Debbie Edge', 'Larry Raspberry', 'Furry Lewis', 'Liz Robinson', 'Knox Phillips', 'Cheryl Needham', 'Andrea Cyrill', 'Jerry Phillips', 'Emory Smith', 'Ral Donner', 'Joe Esposito', 'Lisha Sweetnam', 'Virginia Kiser', 'Greg LeMay', 'Elvis Presley', 'Priscilla Presley', 'Tom Parker', 'Ginger Alden', 'Lisa Marie Presley', 'Gladys Presley', 'Vernon Presley', 'Bill Black', 'Frank Sinatra', 'Nancy Sinatra', 'Ed Sullivan', 'Milton Berle', 'Joey Bishop', 'Sammy Davis Jr.', 'Jimmy Dorsey', 'Tommy Dorsey', 'Charlie Hodge', 'Groucho Marx', 'John Lennon', 'Paul McCartney', 'Ringo Starr', 'George Harrison', 'Dolores Hart', 'Barbara Stanwyck', 'Debra Paget', 'Richard Egan']","['Warner Bros. Pictures', 'David L. Wolper Productions']",1,[],['en'],tt0083193,6.763,18,Released
3,2013-04-12,42,40000000,95020213,128,['Drama'],"The powerful story of Jackie Robinson, the legendary baseball player who broke Major League Baseball’s color barrier when he joined the roster of the Brooklyn Dodgers. The film follows the innovative Dodgers’ general manager Branch Rickey, the MLB executive who first signed Robinson to the minors and then helped to bring him up to the show.",The True Story of an American Legend,[],"['Chadwick Boseman', 'Harrison Ford', 'Nicole Beharie', 'Christopher Meloni', 'Ryan Merriman', 'Lucas Black', 'André Holland', 'Alan Tudyk', 'Hamish Linklater', 'T.R. Knight', 'John C. McGinley', 'Toby Huss', 'Max Gail', 'Brad Beyer', 'James Pickens Jr.', 'Gino Anthony Pesi', 'Brett Cullen', 'Jesse Luken', 'Jamey Holliday', 'Derek Phillips', 'Jamie Ruehling', 'Blake Sanders', 'Johnny Knight', ""Clint O'Brien"", 'Dusan Brown', 'Cherise Boothe', 'Friedel Pinkston', 'Linc Hand', 'Thomas Helgeland', 'Matt Clark', 'Peter MacKenzie', 'Joe Inscoe', 'Monnae Michaell', 'Karole Foreman', 'C.J. Nitkowski', 'Scott Callaway', 'James Rackley', 'Aaron Farb', 'Anthony S. Goolsby', 'Lou Criscuolo', 'Ross Hughes', 'Joe Knezevich', 'Mark Harelik', 'Kenny Cook', 'David Sweeney', 'Rhoda Griffis', 'Daniel Fenlon', 'Maury Covington', 'Henry Friedman', 'Holden Hansen', 'Dan Mengini', 'Jon Kohler', 'Marc Gowan', 'Jackson Walker', 'Danny Vinson', 'Ari Blinder', 'William Flaman', 'Denise Moyé', 'Peter Jurasik', 'Michael H. Cole', 'Janet Metzger', 'Dax Griffin', 'Jayson Warner Smith', 'Jeremy Ray Taylor', 'Christopher Harvey', 'Kelley Jakle', 'Jud Tylor', 'Tobias Michael Finn', 'Ercell A. Grimes Jr.', 'Dwight Houser', 'Barry Suttle', 'Andrew B. Roberts', 'Jimmie L. Coleman', 'Steve Hicks', 'Wayne Hickey', 'Andrew C. Mullins', 'Dennis A. Spears', 'Gary Miller', 'Todd Wilson', 'David Thoms', 'Hunter Clowdus']","['Warner Bros. Pictures', 'Legendary Pictures']",1,['US'],['en'],tt0453562,7.127,1530,Released
4,2013-06-12,This Is the End,32000000,126041322,107,"['Action', 'Comedy']","While attending a party at James Franco's house, Seth Rogen, Jay Baruchel and many other celebrities are faced with the apocalypse.",Nothing ruins a party like the end of the world.,[],"['James Franco', 'Jonah Hill', 'Seth Rogen', 'Jay Baruchel', 'Danny McBride', 'Craig Robinson', 'Michael Cera', 'Emma Watson', 'Mindy Kaling', 'David Krumholtz', 'Christopher Mintz-Plasse', 'Rihanna', 'Martin Starr', 'Paul Rudd', 'Channing Tatum', 'Kevin Hart', 'Aziz Ansari', 'Samantha Ressler', 'Douglas M. Griffin', 'Lo Graham', 'Carol Sutton', 'Yohance Myles', 'Richard Holden', 'Brian Huskey', 'Randy Rousseau', 'Travers Mackel', 'Amber Carew', 'Dallas West', 'David Jensen', 'Carey Jones', 'Ricky Mabe', 'Jason Cox', 'Nick Carter', 'Howie Dorough', 'Brian Littrell', 'AJ McLean', 'Kevin Richardson', 'Edward J. Clare', 'Dwight V Coleman', 'Ashleigh Dejon', 'Michelle DeVito', 'Z. Dieterich', 'Tammy Dugen', 'Damian Gomez', 'Steffie Grote', 'Devin Hennessy', 'Chi Muoi Lo', 'Brittany Perry-Russell', 'Erin Rementer', 'Candice Richardson', 'Met Salih', 'Jason Segel', 'Jordan Sudduth', 'Jason Trost', 'Joseph Uzzell', 'Syd Wilder']","['Columbia Pictures', 'Sony Pictures', 'Mandate Pictures', 'Point Grey Pictures']",1,['US'],['en'],tt1245492,6.22,5576,Released
5,2013-09-21,Battle of the Year,20000000,16549477,110,"['Music', 'Drama']","A down-on-his-luck coach is hired to prepare a team of the best American dancers for an international tournament that attracts all the best crews from around the world, but the Americans haven't won in fifteen years.",The World is watching,['Benson Lee'],"['Josh Holloway', 'Josh Peck', 'Chris Brown', 'Laz Alonso', 'Caity Lotz', 'Terrence Jenkins', 'Weronika Rosati', ""Ivan 'Flipz' Velez"", 'Jesse Erwin', 'Steve Terada', 'Joshua Lee Ayers', 'Luis Rosado', 'Richard Maguire']",['Screen Gems'],1,['US'],['en'],tt1532958,6.969,287,Released
6,2013-07-11,Grown Ups 2,80000000,247022278,101,['Comedy'],"Lenny has relocated his family back to the small town where he and his friends grew up. This time around, the grown ups are the ones learning lessons from their kids on a day notoriously full of surprises—the last day of school.",Just because they're a little older doesn't mean they've grown up.,[],"['Adam Sandler', 'Kevin James', 'Chris Rock', 'David Spade', 'Salma Hayek', 'Maya Rudolph', 'Maria Bello', 'Steve Buscemi', 'Colin Quinn', 'Tim Meadows', ""Shaquille O'Neal"", 'Jon Lovitz', 'Georgia Engel', 'Alexander Ludwig', 'Peter Dante', 'Oliver Hudson', 'Allen Covert', 'Steve Austin', 'Milo Ventimiglia', 'Jake Goldberg', 'Cameron Boyce', 'Alexys Nycole Sanchez', 'Ada-Nicole Sanger', 'Frank Gingerich', 'Morgan Gingerich', 'Nadji Jeter', 'China Anne McClain', 'Kaleo Elam', 'Cheri Oteri', 'Ellen Cleghorne', 'April Rose', 'Dan Patrick', 'Halston Sage', 'Ebony Jo-Ann', 'Norm Crosby', 'Melanie Hutsell', 'Dennis Dugan', 'Jonathan Loughran', 'Jackie Sandler', 'Sadie Sandler', 'Sunny Sandler', 'Chris Berman', 'Michael Kay', 'Richie Minervini', 'Kris Murrell', 'Patty Ross', 'Aly Michalka', 'Paulina Gretzky', 'Kamil McFadden', 'Alex Poncio', 'Andy Samberg', 'Jorma Taccone', 'Bobby Moynihan', 'Taran Killam', 'Paul Brittain', 'Erin Heatherton', 'Patrick Schwarzenegger', 'David Henrie', 'Jared Sandler', 'Chris Titone', 'Jimmy Tatro', 'Brad Grunberg', 'Valerie Gervickas', 'Lisa Garcia', 'Lizet Garcia', 'Tanya Akim', 'Robert Harvey', 'Billy Concha', 'Celeste Capasso', 'Peter Wolf', 'Seth Justman', 'Taylor Lautner', 'Will Forte']","['Columbia Pictures', 'Sony Pictures', 'Happy Madison Productions']",2,['US'],['en'],tt2191701,6.107,3580,Released
7,2013-02-07,Side Effects,30000000,63372757,106,"['Thriller', 'Crime', 'Drama']",A woman turns to prescription medication as a way of handling her anxiety concerning her husband's upcoming release from prison.,One pill can change your life.,['Steven Soderbergh'],"['Rooney Mara', 'Jude Law', 'Catherine Zeta-Jones', 'Channing Tatum', 'Vinessa Shaw', 'Ann Dowd', 'Polly Draper', 'David Costabile', 'Mamie Gummer', 'Scott Shepherd', 'Marin Ireland', 'Elizabeth Rodriguez', 'Craig muMs Grant', 'Carmen Pelaez', 'Peter Friedman', 'Laila Robins', 'Haraldo Alvarez', 'James Martinez', 'Vladimir Versailles', 'Jacqueline Antaramian', 'Michelle Vergara Moore', 'Katie Lowes', 'Steven Platt', 'Victor Cruz', 'Andrea Bogart', 'Mitchell Michaeliszyn', 'Elizabeth Rich', 'Roderick Rodriguez', 'Mark Weekes', 'Michael Nathanson', 'Timothy Klein', 'Sheila Tapia', 'Josh Elliott', 'Sasha Bardey', 'Ashley Morrison', 'Steve Lacy', 'Ken Marks', 'Devin Ratray', 'Russell G. Jones', 'Munro M. Bonnell', 'Susan Gross', 'Debbie Friedlander', 'Ilyana Kadushin', 'Johnny Sanchez', 'Nicole Ansari-Cox', 'LaChanze', 'Alice Niedermair', 'Davenia McFadden', 'Ray DeBenedictis', 'J. Claude Deering', 'Heather Capuano', 'Chevy Lamont Cofield', 'Laurence Covington', 'Barbara Ann Davison', 'Onika Day', 'Brian Distance', 'John Farrer', 'David Fierro', 'Rosemary Howard', 'Peter Iasillo Jr.', 'Zivile Kaminskaite', 'Peter Y. Kim', 'Larissa Laurel', 'Lucinda Lewis', 'Sean Marrinan', 'Dylan Clark Marshall', 'Elliott Mayer', 'Mario Moise Fontaine', 'Nancy Nagrant', ""Gil O'Brien"", ""Kerry O'Malley"", 'Greg Paul', 'Anthony J. Ribustello', 'Alan R. Rodriguez', 'Hollie K. Seidel', 'Kenneth Simmons', 'Blago Simon', 'Nikky Smedley', 'Carol Stanzione', 'Erica Faye Watson', 'Aaron Roman Weiner']","['Di Bonaventura Pictures', 'Endgame Entertainment']",1,['US'],"['en', 'fr']",tt2053463,6.58,2697,Released
8,2013-10-10,Captain Phillips,55000000,218791811,134,"['Action', 'Drama', 'Thriller']","The true story of Captain Richard Phillips and the 2009 hijacking by Somali pirates of the US-flagged MV Maersk Alabama, the first American cargo ship to be hijacked in two hundred years.",Out here survival is everything.,['Paul Greengrass'],"['Tom Hanks', 'Catherine Keener', 'Barkhad Abdi', 'Barkhad Abdirahman', 'Faysal  Ahmed', 'Mahat M. Ali', 'Michael Chernus', 'David Warshofsky', 'Corey Johnson', 'Chris Mulkey', 'Yul Vazquez', 'Max Martini', 'Omar Berdouni', 'Mohamed Ali', 'Issak Farah Samatar', 'Thomas Grube', 'Mark Holden', 'San Shella', 'Terence Anderson', 'Marc Anwar', 'David Webber', 'Amr El-Bayoumi', 'Vincenzo Nicoli', 'Kapil Arun', 'Louis Mahoney', 'Peter Landi', 'Angus MacInnes', 'Ian Ralph', 'Kristian Hjordt Beck', 'Kurt Larsen', 'Bader Choukouko', 'Idurus Shiish', 'Azeez Mohammed', 'Abdurazak Ahmed Adan', 'Duran Mohamed Hassan', 'Nasir Jama', 'Kadz Souleiman', 'Scott Oates', 'David B. Meadows', 'Shad Jason Hamilton', 'Adam Wendling', 'Billy Jenkins', 'Dean Franchuk', 'Rey Hernandez', 'Christopher Stadulis', 'Roger Edwards', 'John Patrick Barry', 'Raleigh Morse', 'Dale McClellan', 'Hugh Middleton', 'Raymond Care', 'Stacha Hicks', 'Will Bowden', 'Len Anderson IV', 'Giovanni Alabiso', 'Devon Black', 'Joshua Brown', 'Steve Campbell', 'Bob Dio', 'Maria Dizzia', 'Herman Gambhir', 'Georgia Goodman']",['Columbia Pictures'],1,['US'],"['en', 'so']",tt1535109,7.558,5983,Released
9,2013-04-05,Evil Dead,17000000,97542952,96,['Horror'],"Mia, a young woman struggling with sobriety, heads to a remote cabin with a group of friends where the discovery of a Book of the Dead unwittingly summon up dormant demons which possess the youngsters one-by-one.",The Most Terrifying Film You Will Ever Experience.,['Fede Álvarez'],"['Jane Levy', 'Shiloh Fernandez', 'Lou Taylor Pucci', 'Jessica Lucas', 'Elizabeth Blackmore', 'Phoenix Connolly', 'Jim McLarty', 'Sian Davis', 'Stephen Butterworth', 'Karl Willetts', 'Randal Wilson', 'Rupert Degas', 'Bob Dorian', 'Ellen Sandweiss', 'Jack Walley', 'Bruce Campbell']","['TriStar Pictures', 'Ghost House Pictures', 'FilmDistrict']",4,['US'],['en'],tt1288558,6.465,3774,Released
10,2013-02-07,Identity Thief,35000000,173965010,111,"['Comedy', 'Crime']","When a mild-mannered businessman learns his identity has been stolen, he hits the road in an attempt to foil the thief -- a trip that puts him in the path of a deceptively harmless-looking woman.",She's having the time of his life,['Seth Gordon'],"['Jason Bateman', 'Melissa McCarthy', 'Amanda Peet', 'Génesis Rodríguez', 'T.I.', 'Robert Patrick', 'John Cho', 'Maggie Elizabeth Jones', 'Mary-Charles Jones', 'Morris Chestnut', 'Jon Favreau', 'Eric Stonestreet', 'Jonathan Banks', 'Ryan Gaul', 'Brett Baker', 'Steve Mallory', 'Steve Little', 'Andrew Friedman', 'Antwan Mills', 'Ian Quinn', 'Diva Tyler', 'Sope Aluko', 'Nevaina Graves Rhodes', 'Diolita Arnold', 'Jamie Moore', 'Brenda Gonzales', 'Nelson Bonilla', 'Angelyn Pass', 'Lori Beth Sikes', 'Ben Falcone', 'Kate Graham', 'Deacon Dawson', 'Geordie White', 'Steve Witting', 'Tim Andrews', 'Gary Weeks', 'Ellie Kemper']","['Universal Pictures', 'Stuber Productions', 'Aggregate Films', 'DumbDumb']",1,['US'],['en'],tt2024432,5.838,2998,Released
11,2013-05-23,The Hangover Part III,103000000,362000072,100,['Comedy'],"This time, there's no wedding. No bachelor party. What could go wrong, right? But when the Wolfpack hits the road, all bets are off.",It all ends.,['Todd Phillips'],"['Bradley Cooper', 'Ed Helms', 'Zach Galifianakis', 'Justin Bartha', 'Ken Jeong', 'John Goodman', 'Mike Epps', 'Jeffrey Tambor', 'Melissa McCarthy', 'Heather Graham', 'Sasha Barrese', 'Jamie Chung', 'Sondra Currie', 'Gillian Vigman', 'Oliver Cooper', 'Mike Vallely', 'Grant Holmquist', 'Harrison Forsyth', 'Betty Murphy', 'Oscar Torre', 'Lela Loren', 'Jim Lau', 'Jonny Coyne', 'Silvia Curiel', 'Roger Schueller', 'Jenny Ladner', 'Scott Anthony Leet', 'Tim Sitarz', 'Danny Le Boyer', 'Damion Poitier', 'Lewis Tan', 'Tiffany Tynes']","['Legendary Pictures', 'Green Hat Films', 'BenderSpink']",1,['US'],['en'],tt1951261,6.209,7602,Released
12,2013-12-18,Anchorman 2: The Legend Continues,50000000,173649015,119,['Comedy'],"With the 70s behind him, San Diego's top rated newsman, Ron Burgundy, returns to take New York's first 24-hour news channel by storm.",It's kind of a big deal,['Adam McKay'],"['Will Ferrell', 'Steve Carell', 'Paul Rudd', 'David Koechner', 'Christina Applegate', 'Dylan Baker', 'Meagan Good', 'Harrison Ford', 'James Marsden', 'Greg Kinnear', 'Judah Nelson', 'Josh Lawson', 'Kristen Wiig', 'Fred Willard', 'Chris Parnell', 'Bill Kurtis', 'June Diane Raphael', 'Tom Clark', 'Drake', 'Eliza Coupe', 'Brian F. Durkin', 'Zoe Myers', 'Clark Sarullo', 'Matthew Cornwell', 'Dane Davenport', 'Dan Triandiflou', 'David Marshall Silverman', 'Jayson Warner Smith', 'David Dwyer', 'Courtney Patterson', 'Kelly Tippens', 'Jon Hayden', 'Ron Prather', 'Gary Weeks', 'L. Warren Young', 'Darlene French', 'E. Roger Mitchell', 'Patricia French', 'Paula Pell', 'Wilbur Fitzgerald', 'Karen Beyer', 'Brian Steele', 'Sacha Baron Cohen', 'Marion Cotillard', 'Will Smith', 'Sarah E. Spencer', 'Kirsten Dunst', 'Brian Patrick Butler', 'Jim Carrey', 'Steve Coulter', 'Tina Fey', 'Kimberly Dawn Guerrero', 'Liam Neeson', 'Amy Poehler', 'John C. Reilly', 'Richard Saxton', 'Lori Beth Sikes', 'Vince Vaughn', 'Kanye West', 'Nickolas Wolf']","['Paramount', 'Gary Sanchez Productions', 'Apatow Productions']",3,['US'],['en'],tt1229340,6.13,2189,Released
13,2013-11-20,Frozen,150000000,1274219009,102,"['Animation', 'Family', 'Adventure', 'Fantasy']","Young princess Anna of Arendelle dreams about finding true love at her sister Elsa’s coronation. Fate takes her on a dangerous journey in an attempt to end the eternal winter that has fallen over the kingdom. She's accompanied by ice delivery man Kristoff, his reindeer Sven, and snowman Olaf. On an adventure where she will find out what friendship, courage, family, and true love really means.",Only the act of true love will thaw a frozen heart.,['Chris Buck'],"['Kristen Bell', 'Idina Menzel', 'Jonathan Groff', 'Frank Welker', 'Josh Gad', 'Santino Fontana', 'Alan Tudyk', 'Ciarán Hinds', 'Maia Wilson', 'Robert Pine', 'Maurice LaMarche', 'Spencer Lacey Ganus', 'Livvy Stubenrauch', 'Eva Bella', 'Jesse Corti', 'Jeffrey Marcus', 'Tucker Gilmore', 'Ava Acres', 'Stephen Apostolina', 'Annaleigh Ashford', 'Kirk Baily', 'Jenica Bergere', 'David Boat', 'Paul Briggs', 'Tyree Brown', 'Woody Buck', 'June Christopher', 'Lewis Cleale', 'Wendy Cutler', 'Eddie Frierson', 'Jean Gilpin', 'Jackie Gonneau', 'Nicholas Guest', 'Bridget Hoffman', 'Nick Jameson', 'Daniel Kaz', 'John Lavelle', 'Patricia Lentz', 'Annie Lopez', 'Katie Lowes', 'Mona Marshall', 'Dara McGarry', 'Scott Menville', 'Adam Overett', 'Paul Pape', 'Courtney Peldon', 'Jennifer Perry', 'Raymond S. Persi', 'Jean-Michel Richaud', 'Lynwood Robinson', 'Carter Sand', 'Jadon Sand', 'Katie Silverman', 'Pepper Sweeney', 'Fred Tatasciore', 'Jack Whitehall']","['Walt Disney Pictures', 'Walt Disney Animation Studios']",1,['US'],['en'],tt2294629,7.252,14632,Released
14,2013-09-26,Cloudy with a Chance of Meatballs 2,78000000,248384621,95,"['Animation', 'Family', 'Comedy']","After the disastrous food storm in the first film, Flint and his friends are forced to leave the town. Flint accepts the invitation from his idol Chester V to join The Live Corp Company, which has been tasked to clean the island, and where the best inventors in the world create technologies for the betterment of mankind. When Flint discovers that his machine still operates and now creates mutant food beasts like living pickles, hungry tacodiles, shrimpanzees and apple pie-thons, he and his friends must return to save the world.",Something big was leftover.,[],"['Bill Hader', 'Anna Faris', 'James Caan', 'Will Forte', 'Andy Samberg', 'Benjamin Bratt', 'Neil Patrick Harris', 'Terry Crews', 'Kristen Schaal', 'Cody Cameron', 'Melissa Sturm', 'Khamani Griffin', 'Bridget Hoffman', 'Al Roker', 'Steve Alterman', 'David Cowgill', 'Eddie Frierson', 'Elisa Gabrielli', 'Jackie Gonneau', 'Tania Gunadi', 'Wendy Hoffmann', 'Walter Jones', 'Scott Menville', 'David Sheinkopf', 'Peter Siragusa', 'Marina Squerciati', 'Kelly Stables', 'Shane Sweet', 'Maddie Taylor', 'June Christopher']","['Columbia Pictures', 'Sony Pictures Animation']",2,['US'],['en'],tt1985966,6.435,2673,Released
15,2013-02-13,Beautiful Creatures,60000000,60052138,124,"['Fantasy', 'Drama', 'Romance']","Ethan Wate just wants to get to know Lena Duchannes better, but unbeknownst to him, Lena has strange powers.  As Lena's 16th birthday approaches she might decide her fate, to be good or evil.  A choice which will impact her relationship forever.",Dark secrets will come to light.,[],"['Alden Ehrenreich', 'Alice Englert', 'Jeremy Irons', 'Viola Davis', 'Emmy Rossum', 'Thomas Mann', 'Emma Thompson', 'Eileen Atkins', 'Margo Martindale', 'Zoey Deutch', 'Tiffany Boone', 'Rachel Brosnahan', 'Kyle Gallner', 'Pruitt Taylor Vince', 'Robin Skye', 'Randy Redd', 'Lance E. Nichols', 'Leslie Castay', 'Sam Gilroy', 'Cindy Hogan', 'Gwendolyn Mulamba', 'Cole Burden', 'Billy Wheelan', 'Christopher Darby', 'Jackie Tuttle', 'Camille Balsamo', 'Lindsay Clift', 'Lucy Faust', 'Justine Wachsberger', 'Teri Wyble', 'Julia Faye West', 'Bryan Adrian', 'J.D. Evermore', 'Andrea Frankle', 'Kay Smith', 'Russ Skains', 'Rachel G. Whittle', 'Erika Erica', 'Beau Brasseaux', 'Cameron M. Brown', 'Tim Bell', 'Jim Sojka', 'Jordan Sudduth', 'Edward J. Clare', 'John C. Klein', 'Elton LeBlanc']","['Warner Bros. Pictures', '3 Arts Entertainment', 'Alcon Entertainment', 'Belle Pictures']",1,['US'],['en'],tt1559547,5.985,2609,Released
16,2012-08-22,Hit & Run,2000000,14400000,100,"['Action', 'Comedy', 'Romance']","When former getaway driver, Charlie Bronson jeopardises his Witness Protection Plan identity in order to help his girlfriend get to Los Angeles, the feds and Charlie's former gang chase them on the road.",A Comedy That Never Takes Its Foot Off The Gas,['David Palmer'],"['Kristen Bell', 'Dax Shepard', 'Tom Arnold', 'Kristin Chenoweth', 'Michael Rosenbaum', 'Jess Rowland', 'Carly Hatter', 'Bradley Cooper', 'Joy Bryant', 'Kal Bennett', 'John Duff', 'David Koechner', 'Ryan Hansen', 'Beau Bridges', 'Jason Bateman', 'Sean Hayes', 'Steve Agee', 'Graham Mackie', 'Todd Conant', 'Valentina Arizo', 'Virginia Briscoe', 'Gloria Sue Holmes', 'Bob Noss']","['Primate Pictures', 'Kim and Jim Productions', 'Panay Films', 'Exclusive Media']",1,['US'],"['en', 'fr', 'pl']",tt2097307,5.668,457,Released
17,2013-07-29,The Canyons,250000,56825,99,"['Thriller', 'Drama']","The discovery of an illicit love affair leads two young Angelenos on a violent, sexually charged tour through the dark side of human nature.",It's not the hills.,[],"['Lindsay Lohan', 'James Deen', 'Nolan Gerard Funk', 'Amanda Brooks', 'Tenille Houston', 'Jarod Einsohn', 'Chris Zeischegg', 'Victor of Aquitaine', 'Jim Boeven', 'Philip Pavel', 'Lily LaBeau', 'Thomas Trussell', 'Alex Ashbaugh', 'Chris Schellenger', 'Lauren Schacher', 'Diana Gitelman', 'Andres De La Fuente', 'Lucy Donovan', 'Michelle LaRue', 'Sandra Rosko', 'Ashli Haynes', 'Annette Grubin', 'Melissa Goette', 'Amanda Gaulick', 'Catherine Castillo']","['Filmworks/FX', 'Prettybird', 'Post Empire Films', 'Sodium Fox']",1,['US'],['en'],tt2292959,4.526,211,Released
18,1929-09-08,Our Modern Maidens,283000,857000,76,"['Drama', 'Comedy']","Young vivacious Billie uses her charms on influential businessman Glenn Abbott in hopes of getting her secret fiancée Gil a diplomatic appointment. Meanwhile Gil's affections meander to beautiful ingenue Kentucky, Billie's best friend.","""Our Dancing Daughters"" was marvelous–here is its thrilling successor!",['Jack Conway'],"['Joan Crawford', 'Rod La Rocque', 'Douglas Fairbanks Jr.', 'Anita Page', 'Edward Nugent', 'Josephine Dunn', 'Albert Gran', 'Edwina Booth', ""Adrienne D'Ambricourt""]",['Metro-Goldwyn-Mayer'],2,['US'],['xx'],tt0020247,6.5,10,Released
19,2012-04-20,Hate Story,1300000,2300000,140,"['Drama', 'Thriller']",Journalist Kavya Krishna loves tycoon Siddharth - who uses and abuses her. How far will Kavya go to get revenge?,"Love Killed Her Soul, Her Body Seeks Revenge...",['Vivek Agnihotri'],"['Paoli Dam', 'Gulshan Devaiah', 'Saurabh Dubey', 'Nikhil Dwivedi', 'Bhairavi Goswami', 'Iravati Harshe', 'Mohan Kapur', 'Joy Sengupta', 'Gopal Singh']",['BVG Films'],1,['IN'],['hi'],tt2309987,5.5,32,Released
20,2012-04-19,Svidaniye,3000000,849776,83,"['Comedy', 'Romance']","Young, unmarried, a successful surgeon, Dmitry Gorin, on the advice of his sister invites a friend for a date. Attractive teacher, beautiful creation Ana Svetlova loses control of herself under the influence of alcohol and the date turns into a nightmare.",,[],"['Vladimir Krestovskiy', 'Ekaterina Klimova', 'Sergei Badyuk', 'Alena Babenko', 'Olga Karpovich', 'Andrey Kaykov', 'Aleksey Malashkin', 'Nelli Nevedina', 'Aleksey Panin', 'Grigorij Sijatvinda', 'Gennadi Vengerov', 'Olga Yurasova', 'Konstantin Murzenko', 'Yusup Bakhshiev']",['Central Partnership'],1,['RU'],['ru'],tt2321541,6.2,3,Released
21,,Sweet Sweetback's Baad Asssss Song,50,4,97,[],"After saving a Black Panther from some racist cops, a black male prostitute goes on the run from ""the man"" with the help of the ghetto community and some disillusioned Hells Angels.",,[],[],[],1,[],[],,0.0,0,Released
