,date,titre,budget,recette,duree,genres,synopsis,tagline,realisateur,casting,compagnies_production,suite,production_countries,langues,imdb_id,vote_average,vote_count,status
0,2005-02-04,Hank Williams First Nation,300000,166000,92,"['Drama', 'Comedy']","An elderly Cree man decides that before he dies he must travel via Greyhound from his remote Indian Reservation in Northern Canada, into the southern United States to visit the grave of Hank Williams. Along the way he and his traveling companion, a 17 yr old nephew, are picked up as a regional human-interest story in the US press. News of their growing celebrity causes a stir back home among an eclectic cast of locals; including a chief running desperately for re-election, a young girl trying desperately to find a prom date, a teacher trying desperately to help, and a social worker trying desperately to get a transfer.",,[],['Gordon Tootoosis'],[],1,[],[],tt0417736,0.0,0,Released
1,2013-04-03,Adore,16000000,1575749,100,['Drama'],"Lil and Roz are two lifelong friends, having grown up together as neighbors in an idyllic beach town. As adults, their sons have developed a friendship as strong as that which binds their mothers. One summer, all four are confronted by simmering emotions that have been mounting between them, and each find unexpected happiness in relationships that cross the bounds of convention.",,['Anne Fontaine'],"['Naomi Watts', 'Robin Wright', 'Xavier Samuel', 'James Frecheville', 'Ben Mendelsohn', 'Sophie Lowe', 'Gary Sweet', 'Jessica Tovey', 'Alyson Standen', 'Charlee Thomas', 'Scott Pirlo', 'Drew Fairley', 'Rowan Witt', 'Sally Cahill', 'Richard Huggett', 'Katrina Norman', 'Genevieve Hegney', 'Maya Stange', 'James McFay', 'Matt Levett', 'Bianca Bateman', 'Skye Sutherland', 'Sarah Henderson', 'Isaac Cocking', 'Brody Mathers']","['Gaumont', 'France 2 Cinéma', 'Canal+', 'Ciné@', 'France Télévisions', 'Screen Australia', 'Screen NSW', 'Hopscotch Features', 'Mon Voisin Productions']",1,"['FR', 'AU']",['en'],tt2103267,6.116,842,Released
2,2012-05-03,Белый тигр,11000000,7200000,105,"['Action', 'Adventure', 'Fantasy', 'War']","Great Patriotic War, 1945. After barely surviving a battle with a mysterious, ghostly-white German Tiger tank, Red Army Sergeant Ivan Naydenov becomes obsessed with its destruction.",Spring 1945. A legend is born,['Karen Shakhnazarov'],"['Aleksey Vertkov', 'Vitaly Kishchenko', 'Valeriy Grishko', 'Dmitri Bykovsky', 'Gerasim Arkhipov', 'Aleksandr Vakhov', 'Vitaliy Dordzhiev', 'Vladimir Ilin', 'Karl Kranzkowski', 'Christian Redl', 'Klaus Grünberg', 'Vilmar Bieri', 'Mariya Shashlova', 'Andrey Myasnikov', 'Rodion Tolokonnikov']","['First Channel', 'Mosfilm']",1,['RU'],"['ru', 'de']",tt2318405,5.694,72,Released
3,1926-12-23,Tell It to the Marines,433000,1250000,103,"['Action', 'Comedy', 'Drama']","U.S. Marine Sergeant O'Hara has his hands full training raw recruits, one of whom, 'Skeets' Burns, is a particular thorn in his side. If Burns's lackadaisical approach to the military were not bad enough, he also makes advances on nurse Nora Dale, whom Sergeant O'Hara secretly loves. Nora is oblivious to O'Hara's feelings and is attracted to the handsome 'Skeet.' But an indiscretion turns her against him, and it takes an expedition to China and a battle with a warlord's bandit brigade to sort things out among the nurse and her two Marines.",,['George W. Hill'],"['Lon Chaney', 'William Haines', 'Eleanor Boardman', 'Eddie Gribbon', 'Carmel Myers', 'Warner Oland', 'Mitchell Lewis', 'Frank Currier', 'Maurice E. Kains', 'Lori Bara', 'Dick Curtis', 'Nola Luxford', 'Ray Erlenborn', 'Willie Fung', 'H.H. Hopple', 'Sgt. Jiggs', 'Tetsu Komai', 'Bud Rae', 'Daniel G. Tomlinson', 'Millard K. Wilson', 'Mrs. Wong Wing']",['Metro-Goldwyn-Mayer'],1,['US'],[],tt0018471,6.1,15,Released
4,2013-10-11,CBGB,5000000,40400,101,"['Drama', 'Music']",A look at New York's dynamic punk rock scene through the lens of the ground-breaking Lower East Side club started by eccentric Hilly Kristal in 1973 which launched thousands of bands.,"50,000 bands and 1 disgusting bathroom.",['Randall Miller'],"['Alan Rickman', 'Rupert Grint', 'Malin Åkerman', 'Johnny Galecki', 'Stana Katic', 'Ashley Greene', 'Justin Bartha', 'Ryan Hurst', 'Kyle Gallner', 'Taylor Hawkins', 'Josh Zuckerman', 'Peter Vack', 'Parker Grant', 'Arthur Bridgers', 'Danielle Shaw', 'Holly Hubbell', 'B. Todd Johnson', 'Freddy Rodríguez', 'Tom Nowicki', 'Estelle Harris', 'Donal Logue', 'Max Reindhardsen', 'Luke Dressler', 'Richard de Klerk', 'Evan Alex Cole', ""Ahna O'Reilly"", 'Bradley Whitford', 'Joel David Moore', 'Steven Schub', 'Julian Acosta', 'Caleb McCotter', 'Bronson Adams', 'Vincenzo Hinckley', 'Cheetah Chrome', 'Keene McRae', 'Mickey Sumner', 'Dominic Bogart', 'Jared Carter', 'Kamille Dawkins', 'Katherine DuBois', 'James Edwards', 'Darin Heames', 'Abby Leigh Huffstetler', 'Bob Lipka', 'Michael Massee', 'Aaron Munoz', 'Juan Piedrahita', 'Richard Marrero', 'Benjamin Frankenberg']","['Rampart Films', 'Unclaimed Freight Productions']",1,['US'],['en'],tt1786751,6.379,125,Released
5,2012-05-11,గబ్బర్ సింగ్,7000000,16000000,153,"['Action', 'Comedy']","A boy runs away from home, angry with his stepfather and half-brother. Years later, he becomes a police inspector and fights a notorious criminal.",He is Special,['Harish Shankar'],"['Pawan Kalyan', 'Shruti Haasan', 'Ali Basha', 'Kota Srinivasa Rao', 'Abhimanyu Singh', 'Tanikella Bharani', 'Brahmanandam', 'Rao Ramesh', 'Malaika Arora', 'Ajay', 'Prabhakar', 'Akash Puri', 'Satyam Rajesh', 'Suhasini Maniratnam', 'Jayaprakash Reddy', 'Prabhakar', 'Prabhas Sreenu', 'Hari Teja', 'Prudhviraj', 'Saptagiri', 'Dhanraj Sukhram', 'Praveen', 'Fish Venkat', 'Chammak Chandra', 'Satya', 'Gayathri Rao']",['Parameswara Art Productions'],1,['IN'],['te'],tt2304655,5.6,15,Released
6,1948-04-06,Miranda,784170,834332,80,"['Comedy', 'Fantasy', 'Romance']","A young married physician discovers a mermaid, and gives into her request to be taken to see London. Comedy and romantic entanglements ensue soon after.",Miranda Has Everything!,['Ken Annakin'],"['Glynis Johns', 'Googie Withers', 'Griffith Jones', 'John McCallum', 'Margaret Rutherford', 'David Tomlinson', 'Yvonne Owen', 'Sonia Holm', 'Brian Oulton', 'Zena Marshall', 'Lyn Evans', 'Joan Ingram', 'Stringer Davis', 'Hal Osmond', 'Maurice Denham', 'Gerald Campion', 'Howard Douglas', 'Tonie MacMillan', 'Charles Paton', 'Philip Ray', 'Charles Rolfe', 'Frank Webster']","['Gainsborough Pictures', 'Sydney Box Productions']",1,['GB'],['en'],tt0040597,6.3,15,Released
