,date,titre,budget,recette,duree,genres,synopsis,tagline,realisateur,casting,compagnies_production,suite,production_countries,langues,imdb_id,vote_average,vote_count,status
0,2013-09-13,The Family,30000000,36894225,111,"['Crime', 'Comedy', 'Action']","The Manzoni family, a notorious mafia clan, is relocated to Normandy, France under the witness protection program, where fitting in soon becomes challenging as their old habits die hard.",Some call it organized crime. Others call it family.,['Luc Besson'],"['Robert De Niro', 'Michelle Pfeiffer', 'Tommy Lee Jones', ""John D'Leo"", 'Dianna Agron', 'Jon Freda', 'David Belle', 'Domenick Lombardozzi', 'Jimmy Palumbo', 'Ted Arcidi', 'Vincent Pastore', 'Paul Borghese', 'Stan Carp', 'Anthony Desio', 'Michael J. Panichelli Jr.', 'Oisín Stack', 'Jonas Bloquet', 'Christopher Craig', 'Kresh Novakovic', 'Gaëlle Jeantet', 'Dominic Chianese', 'Louis Arcella', 'Thierry Piétra', 'Steven Lyon', 'Paul Bandey', 'Dominique Serrand', 'Sophie Froissard', 'Dan Cade', 'Régis Royer', 'Matthew Luret', 'Sissi Duparc', 'Lou Patane', 'Gino Cafarelli', 'Anthony Mangano', 'Vincent Riviezzo', 'Anthoula Katsimatides', 'Elba Sette-Camara', 'Ricardo Cordero', 'Florence Muller', 'Matthew L. Imparato', 'Peter Falcetti', 'Stosh Zona', 'Charles Di Leo', 'Virginia Di Leo', 'Emmanuelle Moreau', 'Nathan Rippy', 'Giovanni Cirfiera', 'François Rabette', 'David Salles', 'Patrick Médioni', 'Dante Bruzzese', 'Mark E. Phillips', 'Kevin Kolack', 'Dave Bobb', 'Mike Bocchetti', 'Steven Rattazzi', 'Steven Randazzo', 'Joe Perrino', 'Abdelaziz Doukali', 'Mour', 'Moussa Maaskri', 'Samira Sedira', 'Lorenzo Montalbanc', 'Alice Allwright', 'Marie Guillard', 'Peter Hudson', 'Marie-Anne Mestre', 'Cortez Nance Jr.', 'Terron Jones', 'Raphaël Boshart', 'Frédéric Dockès', 'Jim Schachmes', 'Solal Forte', 'Charles Derondel', 'Catherine Schaub-Abkarian', 'Bruno Cadillon', 'Léo-Paul Salmain', 'Jimmy Loehler', 'Robin Rafoni', 'Vincent Claude', 'Camille Gigot', 'Côme Levin', 'Jérémy Jean', 'Victoire Du Bois', 'Rebecca Shang', 'Martin Goutry', 'Simon Krel', 'Annie Mercier', 'Jean-Claude Bohbote', 'Nicolas Wanczycki', 'Xavier Brossard', 'Jacques Fontanel', 'Leslie Menu', 'Abigail Boucher', 'Bruno Fleury', 'Christophe Reymond', 'Bernadette Paviot', 'Mario Pecqueur', 'Chloé Oliver', 'Laurent Claret', 'Florent Guyot', 'Michel Aymard', 'Patrick Sueur', 'Caroline Arrouas', 'Serge Tranvouez', 'Christophe Kourotchkine', 'Tonio Descanvelle', 'Cédric Zimmerlin', 'Claudine Acs', 'Paulette Frantz', 'Jan Hammenecker', 'Barbara Bolotner', 'Raymond Franza', 'Eric Malo', 'Franck Neckebrock', 'Tom Hudson']","['Canal+', 'TF1 Films Production', 'Grive Productions', 'EuropaCorp', 'Relativity Media', 'TF1', 'Malavita']",1,"['FR', 'US']",['en'],tt2404311,6.352,2599,Released
1,1936-08-28,The Gorgeous Hussy,1119000,2019000,103,"['Drama', 'History']","It's the early nineteenth century Washington. Young adult Margaret O'Neal, Peggy to most that know her, is the daughter of Major William O'Neal, who is the innkeeper of the establishment where most out-of-town politicians and military men stay when they're in Washington. Peggy is pretty and politically aware. She is courted by several of those politicians and military men who all want to marry her, except for the one with who she is truly in love.",She swayed a nation..ruled the hearts of men...and spent her life trying to win the one she really loved!,['Clarence Brown'],"['Joan Crawford', 'Robert Taylor', 'Lionel Barrymore', 'Franchot Tone', 'Melvyn Douglas', 'James Stewart', 'Beulah Bondi', 'Alison Skipworth', 'Louis Calhern', 'Melville Cooper', 'Sidney Toler', 'Gene Lockhart', 'Clara Blandick', 'Frank Conroy', 'Nydia Westman', 'Willard Robertson', 'Charles Trowbridge', 'Rubye De Remer', 'Betty Blythe', 'Zeffie Tilbury', 'Harry C. Bradley', ""Allen 'Farina' Hoskins"", 'William Orlamond', 'Frank Reicher', ""Fred 'Snowflake' Toones""]",['Metro-Goldwyn-Mayer'],1,['US'],['en'],tt0027690,4.3,7,Released
2,2012-11-22,Hitchcock,15700000,23570541,98,['Drama'],"Following his great success with ""North by Northwest,"" director Alfred Hitchcock makes a daring choice for his next project: an adaptation of Robert Bloch's novel ""Psycho."" When the studio refuses to back the picture, Hitchcock decides to pay for it himself in exchange for a percentage of the profits. His wife, Alma Reville, has serious reservations about the film but supports him nonetheless. Still, the production strains the couple's marriage.",Behind every Psycho is a great woman.,[],"['Anthony Hopkins', 'Helen Mirren', 'Scarlett Johansson', 'Danny Huston', 'Toni Collette', 'Michael Stuhlbarg', 'Michael Wincott', 'Jessica Biel', ""James D'Arcy"", 'Richard Portnow', 'Kurtwood Smith', 'Ralph Macchio', 'Kai Lennox', 'Tara Summers', 'Wallace Langham', 'Paul Shackman', 'Currie Graham', 'Spencer Garrett', 'Terry Rhoads', 'Tom Virtue', 'Karina Deyko', 'Steven Lee Allen', 'Richard Chassler', 'Frank Collison', 'Melinda Chilton', 'Mary Anne McGarry', 'Jon Abrahams', 'Gil McKinney', 'Emma Jacobs', 'Spencer Leigh', 'Sean MacPherson', 'Gerald V. Casale', 'Tara Arroyave', 'Josh Yeo', 'Judith Hoag', 'Danielle Burgio', 'John Lacy', 'Howard Gibson', 'Josette Prevost', 'Lauren Stewart', 'Jaehne Moebius', 'Ana Matallana', 'Lindsey Ginter', 'Brett Chapin', 'Paul Henderson', 'Kay Henderson', 'Richard Burns', 'Meredith Claire', 'Alexia DuBasso', 'Jonn Faircrest', 'Gina Fricchione', 'James R. Gavio', 'Bruce Holman', 'Dion W.H. Holt', 'Jeremiah Hundley', 'Michael Kurtz', 'Joseph Martino', 'Jeremy S. Miles', 'Jon Renfield', 'Linda Sans', 'James Tappan', 'Jon Thibault', 'Sebastian Vale', 'Jason Wingo', 'Cynthia Youngblood', 'Bill Blair']","['Cold Spring Pictures', 'The Montecito Picture Company']",1,['US'],['en'],tt0975645,6.525,1297,Released
3,1936-07-10,The Bride Walks Out,289000,670000,75,"['Comedy', 'Romance']","Carolyn Martin is a fashion model who hastily marries her boyfriend, engineer Michael Martin. But part of the marriage arrangement requires that Carolyn quit her $50-per-week modeling job to be a full-time housewife; the couple will instead live on Michael’s $35-per-week job.",A Love Pirate-Two Lovers.. and a Pair of Chislers!,['Leigh Jason'],"['Barbara Stanwyck', 'Gene Raymond', 'Robert Young', 'Ned Sparks', 'Helen Broderick', 'Willie Best', 'Robert Warwick', 'Billy Gilbert', 'Wade Boteler', 'Hattie McDaniel', 'Ward Bond', 'Spencer Charters']",['RKO Radio Pictures'],1,['US'],['en'],tt0027395,5.2,10,Released
4,1998-07-24,తొలిప్రేమ,70000,180000,136,"['Romance', 'Drama', 'Comedy']","Balu falls in love with Anu who has come to her grandfather's house from the US. He even saves her life during an accident, but he is still not able to express his love to her.",,['A. Karunakaran'],"['Pawan Kalyan', 'Keerthi Reddy', 'Ali Basha', 'Ravi Babu', 'Venu Madhav', 'Narra Venkateswara Rao', 'Nagesh']",[],1,['IN'],['te'],tt0248547,4.8,11,Released
5,1937-10-08,The Bride Wore Red,960000,1200000,103,"['Comedy', 'Drama', 'Romance']",A poor singer in a bar masquerades as a rich society woman thanks to a rich benefactor.,"2 weeks to be a lady! 2 weeks to feather her nest! 2 weeks to make one man say ""I do!""",['Dorothy Arzner'],"['Joan Crawford', 'Franchot Tone', 'Robert Young', 'Billie Burke', 'Reginald Owen', 'Lynne Carver', 'George Zucco', 'Mary Philips', 'Paul Porcasi', 'Dickie Moore', 'Frank Puglia', 'Rafael Alcayde', 'Nino Bellini', 'Agostino Borgato', 'Adriana Caselotti', 'Robert Cauterio', 'Irene Coleman', 'Gino Corrado', 'Franco Corsaro', 'Rita Gould', 'Geneva Hall', 'Charles Judels', 'Jean Lewis', 'Fred Malatesta', 'Francisco Marán', 'Alphonse Martell', 'Eric Mayne', 'Ann Rutherford', 'Mike Tellegen', 'Harry Wilson']",['Metro-Goldwyn-Mayer'],1,['US'],['en'],tt0028661,6.7,16,Released
6,2012-07-06,Bol Bachchan,12,17,155,"['Comedy', 'Action']","Abbas Ali (Abhishek Bachchan) lives in Chandni Chowk, New Delhi with his sister Sania (Asin Thottumkal). They are legally fighting for an ancestral property— land case. But the odds turn against them and they lose. Their well wisher, Shastri Chacha, advises and convinces them to migrate to his village Ranakpur where he assures Abbas that he will get him a job at his owner's place. The owner being none other than the powerful Prithviraj Raghuvanshi (Ajay Devgn). Abbas enters Ranakpur village and while saving a child trapped inside a temple, he breaks open the lock of an ancestral temple but fate plays an important twist in Abbas' life as the whole village including Prithviraj's step-brother Vikrant opposes Abbas' actions but Prithviraj arrives and handles the situation.",,['Rohit Shetty'],"['Ajay Devgn', 'Asin Thottumkal', 'Abhishek Bachchan', 'Prachi Desai', 'Archana Puran Singh', 'Asrani', 'Krishna Abhishek', 'Jeetu Verma']",[],1,['IN'],['hi'],tt1728986,6.02,50,Released
7,2013-02-07,Safe Haven,28000000,97594140,115,"['Romance', 'Thriller']","A young woman with a mysterious past lands in Southport, North Carolina where her bond with a widower forces her to confront the dark secret that haunts her.",You know it when you find it,['Lasse Hallström'],"['Julianne Hough', 'Josh Duhamel', 'Cobie Smulders', 'David Lyons', 'Mimi Kirkland', 'Noah Lomax', 'Irene Ziegler', 'Robin Mullins', 'Red West', 'Juan Piedrahita', 'Cullen Moss', 'Mike Pniewski', 'Jon Kohler', 'Tim Parati', 'Giulia Pagano', 'Jasper Grey', 'Tora Hallström', 'Wendy Wilmot', 'Ric Reitz', 'Nick Basta', 'Mary DeFlavio', 'James Nalitz', 'Jan Hartsell', 'Martin Coleman Bowen', 'Cameron Penrose', 'Ora Ogden', 'David McKethan', 'Jody Harker', 'Daniel Cochran Donovan', 'Jerad Swain', 'Ryan T. Boldt', 'Dyer Scott Lumpkin', 'Tyler Gene']","['Relativity Media', 'Temple Hill Entertainment']",1,['US'],"['en', 'pt']",tt1702439,7.254,2097,Released
