,date,titre,budget,recette,duree,genres,synopsis,tagline,realisateur,casting,compagnies_production,suite,production_countries,langues,imdb_id,vote_average,vote_count,status
0,2012-09-12,Aftershock,2000000,58510,89,"['Horror', 'Thriller']",Mayhem and death follow when an earthquake traps a group of tourists in a Chilean town.,The only thing more terrifying than Mother Nature is human nature.,[],"['Eli Roth', 'Andrea Osvárt', 'Ariel Levy', 'Lorenza Izzo', 'Nicolás Martínez', 'Natasha Yarovenko', 'Selena Gomez', 'Ramón Llao', 'Ignacia Allamand', 'Marcial Tagle', 'Paz Bascuñan', 'Matías López', 'Dayana Amigo', 'Eduardo Domínguez', 'Edgardo Bruna', 'Patricio Strahovsky', 'Adrián Salgado', 'Orlando Alfaro', 'Gabriela Hernández', 'Benito Quercia', 'Francisca Concha', 'Carlos Martínez', 'Ignacio Verdugo']","['Cross Creek Pictures', 'Dragonfly Entertainment', 'Vertebra Films', 'Sobras Producciones']",1,"['CL', 'US']","['en', 'es']",tt1780762,5.095,268,Released
1,2013-03-09,No One Lives,2900000,74918,86,"['Horror', 'Thriller']",A gang of ruthless highway killers kidnap a wealthy couple traveling cross country only to shockingly discover that things are not what they seem.,No one runs. No one escapes.,['Ryûhei Kitamura'],"['Luke Evans', 'Adelaide Clemens', 'Lee Tergesen', 'Derek Magyar', 'America Olivo', 'Beau Knapp', 'Lindsey Shaw', 'Lenore Banks', 'George Murdoch', 'Laura Ramsey', 'Gary Grubbs', 'Andrea Frankle', 'Robert Steinberg', 'Michael Harrity']","['Pathe', 'WWE Studios', 'Milk & Media', 'Constance Media']",1,['US'],['en'],tt1763264,5.878,499,Released
2,2012-09-05,피에타,103000,6616296,104,['Drama'],A loan shark is forced to reconsider his violent lifestyle after the arrival of a mysterious woman claiming to be his long-lost mother.,The truth of the heart is born only from sacrifice.,['Kim Ki-duk'],"['Cho Min-soo', 'Lee Jung-jin', 'Woo Ki-hong', 'Kang Eun-jin', 'Heo Joon-seok', 'Kwon Yul', 'Jin Yong-uk', 'Yoo Ha-bok', 'Kim Jae-rok']","['Kim Ki Duk Film', 'Next Entertainment World']",1,['KR'],['ko'],tt2299842,7.13,289,Released
3,2013-08-21,The Mortal Instruments: City of Bones,60000000,95396573,130,"['Fantasy', 'Action', 'Mystery']","In New York City, Clary Fray, a seemingly ordinary teenager, learns that she is descended from a line of Shadowhunters — half-angel warriors who protect humanity from evil forces. After her mother disappears, Clary joins forces with a group of Shadowhunters and enters Downworld, an alternate realm filled with demons, vampires, and a host of other creatures. Clary and her companions must find and protect an ancient cup that holds the key to her mother's future.",You have been chosen,['Harald Zwart'],"['Lily Collins', 'Jamie Campbell Bower', 'Robert Sheehan', 'Kevin Zegers', 'Jemima West', 'Lena Headey', 'Aidan Turner', 'Jared Harris', 'Jonathan Rhys Meyers', 'Kevin Durand', 'Harry Van Gorkum', 'Godfrey Gao', 'CCH Pounder', 'Robert Maillet', 'Stephen R. Hart', 'Chad Connell', 'Chris Ratz', ""Elyas M'Barek"", 'Pedro Miguel Arce', 'Matthew Cheng', 'Carlos Gonzalez-Vio', 'Melantha Blackthorne', 'Adam Bogen', 'Andre Givogue', 'Jonathan Seinen', 'Bonnie Siu', 'Gregory Terlecki', 'Christopher Maleki', 'Jerry A. Ziler']","['Constantin Film', 'Screen Gems', 'Don Carmody Productions', 'Unique Features', 'Mister Smith Entertainment']",1,"['CA', 'DE', 'GB', 'US']",['en'],tt1538403,6.427,4107,Released
4,1944-07-20,Dragon Seed,3070000,4627000,145,['Drama'],The lives of a small Chinese village are turned Upside down when the Japanese invade it. An heroic young Chinese woman leads her fellow villagers in an uprising against Japanese Invaders.,M-G-M's immortal production of the great novel,"['Harold S. Bucquet', 'Jack Conway']","['Katharine Hepburn', 'Walter Huston', 'Aline MacMahon', 'Akim Tamiroff', 'Turhan Bey', 'Hurd Hatfield', 'J. Carrol Naish', 'Agnes Moorehead', 'Henry Travers', 'Robert Bice', 'Robert Lewis', 'Frances Rafferty', 'Jacqueline deWit', 'Lionel Barrymore', 'Claire Du Brey']",['Metro-Goldwyn-Mayer'],1,['US'],['en'],tt0036777,6.3,13,Released
5,2012-11-01,Jagal,1000000,444575,159,['Documentary'],"In a place where killers are celebrated as heroes, these filmmakers challenge unrepentant death-squad leaders to dramatize their role in genocide. The result is a surreal, cinematic journey, not only into the memories and imaginations of mass murderers, but also into a frighteningly banal regime of corruption and impunity.","A story of killers who win, and the society they build.","['Joshua Oppenheimer', 'Christine Cynn']","['Anwar Congo', 'Herman Koto', 'Syamsul Arifin', 'Ibrahim Sinik', 'Yapto Soerjosoemarno', 'Safit Pardede', 'Jusuf Kalla', 'Adi Zulkadry', 'Haji Anif', 'Sakhyan Asmara', 'Soaduon Siregar', 'Suryono', 'Haji Marzuki', 'Rahmat Shah']","['Spring Films', 'Final Cut for Real', 'Piraya Film', 'Novaya Zemlya']",1,"['DK', 'FI', 'DE', 'ID', 'NL', 'NO', 'PL', 'SE', 'GB']","['en', 'id']",tt2375605,7.722,562,Released
6,1990-03-09,The Last of the Finest,12000000,1531489,106,"['Action', 'Crime', 'Drama']","An elite group of vice cops are fired from the L.A.P.D. for being over-zealous in their war against drugs. It is immediately apparent that some of their superiors are involved in the drug ring. Banded together, four of the banned cops (which quickly becomes three when one is killed early) band together to fight the drug ring undercover. They gain capital for weapons by ripping off minor drug dealers. Then well-armed they go after the kingpin (Boyd).",It's time for heroes again.,['John Mackenzie'],"['Brian Dennehy', 'Joe Pantoliano', 'Jeff Fahey', 'Bill Paxton', 'Michael C. Gwynne', 'Henry Stolow', 'Guy Boyd', 'Henry Darrow', 'J. Kenneth Campbell', 'Deborra-Lee Furness', 'Lisa Jane Persky', 'Pamela Gidley', 'Patricia Clipper', 'Michele Little', 'John P. Finnegan', 'Ron Canada', 'Xander Berkeley', 'Burke Byrnes', 'Michael Strasser', 'Kathleen Dennehy', 'Patrick Stack', 'Larry Carroll']","['Orion Pictures', 'Davis Entertainment']",1,['US'],['en'],tt0099991,6.0,26,Released
7,2013-01-05,Demonic Possession,12,30,95,[],Alex is possessed...,"""Help me!""",[],[],[],1,['US'],['en'],,0.0,0,Released
