,date,titre,budget,recette,duree,genres,synopsis,tagline,realisateur,casting,compagnies_production,suite,production_countries,langues,imdb_id,vote_average,vote_count,status
0,2012-10-11,회사원,3500000,7339398,96,"['Drama', 'Action']",A contract killer becomes disenchanted with his line of work and spares the lives of his two latest would-be-victims. But the assassination company he works for has no intentions of letting him quit.,Fight Before Being Fired.,['Lim Sang-Yun'],"['So Ji-sub', 'Lee Mi-yeon', 'Kwak Do-won', 'Kim Dong-jun', 'Lee Kyung-young', 'Han Bo-bae', 'Yoo Ha-bok', 'Jeon Kuk-hwan', 'Hwang Suk-jung', 'Lee Jun-hyeok']",['Showbox'],1,['KR'],['ko'],tt2371486,6.881,143,Released
1,2012-05-04,മല്ലൂ സിംഗ്,1300000,1530000,120,"['Action', 'Comedy']","Anil decides to look for his friend Hari who has been missing since seven years. When he finally locates him in Punjab, Hari claims that he is Harinder Singh and has no connection with Kerala.",,['Vysakh'],"['Unni Mukundan', 'Kunchacko Boban', 'Samvrutha Sunil', 'Rupa Manjari', 'Biju Menon', 'Manoj K Jayan', 'Meera Nandan', 'Aparna Nair', 'Siddique', 'Saikumar', 'Suraj Venjaramoodu', 'Shaalin Zoya', 'Esther Anil', 'Ganapathi S Poduval']",['Aan Mega Media'],1,['IN'],['ml'],tt2157186,4.9,10,Released
2,2013-04-18,Pain & Gain,25000000,87305549,130,"['Crime', 'Action', 'Comedy']","Daniel Lugo, manager of the Sun Gym in 1990s Miami, decides that there is only one way to achieve his version of the American dream: extortion. To achieve his goal, he recruits musclemen Paul and Adrian as accomplices. After several failed attempts, they abduct rich businessman Victor Kershaw and convince him to sign over all his assets to them. But when Kershaw makes it out alive, authorities are reluctant to believe his story.",Their American dream is bigger than yours.,[],"['Mark Wahlberg', 'Dwayne Johnson', 'Anthony Mackie', 'Tony Shalhoub', 'Ed Harris', 'Rob Corddry', 'Bar Paly', 'Rebel Wilson', 'Ken Jeong', 'Michael Rispoli', 'Keili Lefkovitz', 'Vivi Pineda', 'Christopher Jestin Langstaff', 'Gustavo Escobar', 'Corinne Ferrer', 'Zack Moore', 'Kory Getman', 'Peter Stormare', 'Larry Hankin', 'Tony Plana', 'Brian Stepanek', 'Persei Caputo', 'Bill Kelly', 'Emily Rutherfurd', 'Wladimir Klitschko', 'Yolanthe Cabau', ""Anthony 'Ace' Thomas"", 'Kurt Angle', 'Jennifer Nicole Lee', 'Andrea Bennetti', 'Nikki Benz', 'Jessica Dykstra', 'Gwendalyn Barker', 'Vannessa Nevader']","['Paramount', 'De Line Pictures']",1,['US'],['en'],tt1980209,6.222,3845,Released
3,2012-09-21,The Mistress,22361,5876918,125,"['Romance', 'Drama']","A young woman is torn between the affections of her two lovers. One is a young bachelor who brings passion into her life. The other is a married man who has kept her as his mistress for years. Architect JD has a chip on his shoulder about his father Rico never really accepting him as his son. Seamstress Sari struggles to take care of her family. The two meet by chance, and JD aggressively pursues Saris affections. Though the two are clearly a good match, there is a problem standing in the way of their bliss: Sari is the mistress of JDs father. Against his better judgment, JD continues to court Sari even after finding out this difficult fact. He hides his true identity as Ricos son, and fights to win Saris heart.",No one dreamed to be the other woman.,[],"['Bea Alonzo', 'John Lloyd Cruz', 'Ronaldo Valdez', 'Hilda Koronel', 'Anita Linda', 'Carmi Martin', 'Clarence Delgado', 'Tony Mabesa', 'K Brosas', 'Minnie Aguilar', 'Gabe Mercado', 'Nor Domingo', 'Madeleine Humphries', 'Al Gatmaitan']",['Star Cinema – ABS-CBN Film Productions'],1,['PH'],"['en', 'tl']",tt2389344,5.9,8,Released
4,2013-02-21,Snitch,35000000,42930462,112,"['Thriller', 'Drama', 'Action']","Construction company owner John Matthews learns that his estranged son, Jason, has been arrested for drug trafficking. Facing an unjust prison sentence for a first time offender courtesy of mandatory minimum sentence laws, Jason has nothing to offer for leniency in good conscience. Desperately, John convinces the DEA and the opportunistic DA Joanne Keeghan to let him go undercover to help make arrests big enough to free his son in return. With the unwitting help of an ex-con employee, John enters the narcotics underworld where every move could be his last in an operation that will demand all his resources, wits and courage to survive.",How Far Would You Go To Save Your Son?,['Ric Roman Waugh'],"['Dwayne Johnson', 'Barry Pepper', 'Susan Sarandon', 'Benjamin Bratt', 'Michael Kenneth Williams', 'Melina Kanakaredes', 'Nadine Velazquez', 'David Harbour', 'Jon Bernthal', 'Harold Perrineau', 'J. D. Pardo', 'Lela Loren', 'Rafi Gavron', 'James Allen McCune', 'Sam Medina']","['Front Street Productions', 'Participant', 'Imagenation Abu Dhabi FZ', 'Exclusive Media', 'Spitfire Pictures']",1,"['US', 'AE']","['en', 'es']",tt0882977,6.056,2076,Released
5,1991-09-15,ഗോഡ്ഫാദർ,18000,700000,150,"['Drama', 'Comedy', 'Romance']","The story of Anjooran, and his four sons Balaraman, Swaminathan, Premachandran and Ramabhadran are in severe enmity with the Anappara family.",,['Siddique'],"['N.N. Pillai', 'Mukesh', 'Thilakan', 'Innocent', 'Bheeman Raghu', 'Jagadish', 'Siddique', 'Philomina', 'Kanaka', 'Paravoor Bharathan', 'Janardhanan', 'Kundara Johny', 'KPAC Lalitha', 'Sankaradi', 'Kollam Thulasi', 'Harisree Ashokan', 'Unni Mary', 'Thodupuzha Vasanthi', 'Thezni Khan', 'Beena Antony', 'Ravi Vallathol', 'Zeenath']",['Swargachitra'],1,['IN'],['ml'],tt0353496,7.48,25,Released
