,date,titre,budget,recette,duree,genres,synopsis,tagline,realisateur,casting,compagnies_production,suite,production_countries,langues,imdb_id,vote_average,vote_count,status
166,1987-05-08,Hot Pursuit,0,4215859,93,['Comedy'],"Young Danny is following his rich girlfriend's family to the Caribbean. But suddenly he simply must make a chemistry test and cannot go with them. After they have left, he gets a leave from his professor and takes a plane to find them. But he is not quite sure where they are, and meets smugglers, crazy captains and murderers.",She promised him ten days together in paradise. He never dreamed how far he'd have to go.,['Steven Lisberger'],"['John Cusack', 'Robert Loggia', 'Jerry Stiller', 'Wendy Gazelle', 'Monte Markham', 'Shelley Fabares', 'Paul Bates', 'Keith David', 'Martin LaSalle', 'Ben Stiller', 'Ursaline Bryant', 'Terence Cooper', 'Dah-ve Chodan', 'Andaluz Russell', 'Ted White']",['Paramount'],1,"['MX', 'US']",['en'],tt0093215,5.97,66,Released
167,2008-07-04,जाने तू ... या जाने ना,2300000,11100000,155,"['Drama', 'Comedy', 'Romance']",Two best friends being convinced that they are not in love search for each other's love.,So when do you know it's love?,[],"['Imran Khan', ""Genelia D'Souza"", 'Manjari Fadnnis', 'Prateik Babbar', 'Sugandha Garg', 'Nirav Mehta', 'Alishka Varde', 'Ayaz Khan', 'Naseeruddin Shah', 'Ratna Pathak', 'Padam Bhola', 'Jayant Kripalani', 'Anooradha Patel', 'Jerrit John', 'Pratiek Babbar', 'Arbaaz Khan', 'Sohail Khan', 'Paresh Rawal', 'Rajat Kapoor', 'Kitu Gidwani', 'Ayaz Khan', 'Uditanshu Mehta', 'Deepak Dhadwal', 'Veena Mehta', 'Murali Sharma', 'Omprakash']","['Aamir Khan Productions', 'PVR Pictures']",1,['IN'],['hi'],tt0473367,6.833,123,Released
168,2008-03-18,The Sickhouse,4000000,0,100,['Horror'],"Terror lurks in the old orphanage, beneath a disused London hospital - a Seventeeth Century malevolence, the Plague Doctor, has returned to complete his evil masterpiece",,['Curtis Radclyffe'],"['Gina Philips', 'Alex Hassell', 'Kellie Shirley', 'Andrew Knott', 'Jack Bailey', 'John Lebar', 'Romla Walker', 'Tom Wontner', 'Gregg Harris', 'Finlay Carr', 'Gillian MacGregor', 'Stuart Brennan']","['iDream Productions', 'Hopscotch Films']",1,['GB'],['en'],tt0451197,4.263,19,Released
169,2006-03-30,The Oh in Ohio,5000000,648183,88,"['Comedy', 'Romance']","Priscilla and Jack appear to be the perfect couple, but they have a secret: She is sexually frustrated. They separate in the hope of resolving the situation. While Jack moves into a bachelor pad and begins an affair with a student, Priscilla discovers the joys of self-pleasuring and finds an unusual bed-mate.",One woman's story is about to climax.,[],"['Parker Posey', 'Paul Rudd', 'Mischa Barton', 'Keith David', 'Tim Russ', 'Robert John Burke', 'Liza Minnelli', 'Danny DeVito', 'Winter Ave Zoli', 'Ramon Adams', 'Jennifer Luu', 'Alex Potapenko', 'James Kisicki', 'Brynn Horrocks', 'Richard A. Clark', 'Randall Harr', 'Christopher Mattingly', 'Debrae Barenfeld', 'John Sloan', 'Brandon Lewis', 'Michael Orlando', 'Toby Radloff', 'Ed Brigadier', 'Molly McGinnis', 'Bernard Canepari', 'Alexander Alioto', 'Marisa Miller', 'Thomas T.K. Zung', 'Heather Graham', 'Fumi Desalu-Vold']","['Cold Iron Pictures', 'Ambush Entertainment', 'AV Club, The']",1,['US'],['en'],tt0422861,5.257,70,Released
170,1980-07-11,Used Cars,8000000,11715321,113,['Comedy'],"When the owner of a struggling used car lot is killed, it's up to the lot's hot-shot salesman to save the property from falling into the hands of the owner's ruthless brother and used-car rival.","Like new, great looking and fully loaded with laughs.",['Robert Zemeckis'],"['Kurt Russell', 'Jack Warden', 'Gerrit Graham', 'Frank McRae', 'Deborah Harmon', 'Joe Flaherty', 'David L. Lander', 'Michael McKean', 'Michael Talbott', 'Harry Northup', 'Alfonso Arau', 'Al Lewis', 'Woodrow Parfrey', 'Andrew Duncan', 'Dub Taylor', 'Claude Earl Jones', 'Beans Morocco', 'Cheryl Rixon', 'Wendie Jo Sperber', 'Marc McClure', 'Susan Donovan', 'Don Ruskin', 'Jan Sandwich', 'Tracy Lee Rowe', 'Patrick McMorrow', 'Joseph Barnaba', 'Diane Hardin', 'Dick Miller', 'Rita Taggart', 'Dave Herrera', 'Walter Jackson', 'Gene Blakely', 'Russ Fega', 'Tiny Wells', 'Terence Knox', 'Tony Lucatorto', 'Will MacMillan', 'Josiah Steiner', 'Douglas O. Tepper', 'Dave Adams', 'Frank Harmon', 'Allen Wood', 'John M. Abbott', 'Sam Ingraffia', 'Bill Wine', 'Judy Began', 'Phillip Greenwood', 'Alex Herring', 'Sanford Gibbons', 'Mildred Brion', 'Peanuts', 'Lyle Gold', 'Stephen Lloyd', 'Leigh Scarritt']",['Columbia Pictures'],1,['US'],['en'],tt0081698,6.4,184,Released
171,1999-10-07,Body Shots,0,239894,106,"['Drama', 'Romance']","The Los Angeles club scene is a place of booze-fueled decadence and debauchery. In a night full of possibilities, eight 20-somethings take to the clubs seeking good times, companionship and maybe a little sex. But in the harsh light of the morning after, their worlds are thrown into a spin of confusion when hungover Sara accuses hard-partying Mike of date rape. Loyalties are tested as each among them is forced to take sides.",Tonight it's for sex. Tomorrow it's for real.,[],"[""Jerry O'Connell"", 'Amanda Peet', 'Sean Patrick Flanery', 'Tara Reid', 'Ron Livingston', 'Emily Procter', 'Joe Basile', 'Scott Burkholder', 'Liz Coke', 'Allison Dunbar', 'Edmund Genest', 'Adam Lieberman', 'Mark Hicks', 'Larry Joshua', 'Elizabeth Liebel', 'Marc Lynn', 'Lou Paget', 'Adina Porter', 'Benny Quan', 'Brad Rowe', 'Wendy Schenker', 'Nick Spano', 'Emmy Collins', 'Phil Hawn', 'Rich Knight', 'Cheryl Rusa', 'Robert Steinberg', 'Heidi Van Horne', 'Dwayne Winstead', 'Sybil Temchen']","['New Line Cinema', 'Colomby/Keaton Productions']",1,['US'],['en'],tt0172627,4.877,61,Released
172,1987-07-01,Mio min Mio,7200000,2300000,99,"['Adventure', 'Drama', 'Fantasy', 'Family', 'Mystery']","They're two best friends, a million miles from home. On an incredible adventure, beyond the boundaries of space and time. A fantasy about a lonely boy who is transferred from his dull life with his adoptive parents to the land where his real father is the king.",,[],"['Nick Pickard', 'Christian Bale', 'Timothy Bottoms', 'Susannah York', 'Christopher Lee', 'Sverre Anker Ousdal', 'Gunilla Nyroos', 'Tomas Bolme', 'Lena Endre', 'Igor Yasulovich', 'Lyubov Germanova']","['Svenska Filminstitutet', 'Nordisk Tonefilm', 'Gorky Film Studios', 'Sovinfilm', 'Norway Film Development']",1,"['NO', 'SU', 'SE']",['en'],tt0093543,6.1,68,Released
173,2008-03-11,Bachelor Party 2: The Last Temptation,6000000,0,104,['Comedy'],"Ron Simmons is ready to settle down and get married, but first, he must survive his out-of-control bachelor party.",,[],"['Josh Cooke', 'Harland Williams', 'Greg Pitts', 'Sara Foster', 'Emmanuelle Vaugier', 'Warren Christie', 'Danny Jacobs', 'Karen-Eileen Gordon', 'Steven Crowley', 'Audrey Landers', 'Mauricio Sanchez', 'Chay Santini', 'Erika Smith', 'Sandra Seeling', 'Ashley Totin', 'Diana Vilskaya', 'Stacy Ann Rose', 'Steve DuMouchel', 'Kim Ostrenko', 'Michelle Jones', 'Mariann Gavelo', 'Sara Kova', 'Arianna Coltellacci', 'Akari Kalai', 'Dena Carman', 'La Trice Perry', 'Claudia Costa', 'Paula LaBaredas', 'Jennifer Steele', 'Ginger Williams', 'Rod Ball', 'Paul Aldanée', 'Hiromi Oshima', 'Cindy Taylor']","['Ignition Pictures', '20th Century Fox Home Entertainment', 'Twin Continental Films']",2,['US'],['en'],tt0954541,4.7,39,Released
174,1988-12-07,The Adventures of Baron Munchausen,46630000,8083123,126,"['Action', 'Adventure', 'Comedy', 'Fantasy', 'Family']",An account of Baron Munchausen's supposed travels and fantastical experiences with his band of misfits.,Remarkable. Unbelievable. Impossible. And true.,['Terry Gilliam'],"['John Neville', 'Eric Idle', 'Sarah Polley', 'Oliver Reed', 'Charles McKeown', 'Winston Dennis', 'Jack Purvis', 'Valentina Cortese', 'Jonathan Pryce', 'Bill Paterson', 'Peter Jeffrey', 'Uma Thurman', 'Alison Steadman', 'Ray Cooper', 'Don Henderson', 'Robin Williams', 'Sting', 'Andrew MacLachlan', 'José Lifante', 'Mohamed Badrsalem', 'Kiran Shah', 'Franco Adducci', 'Ettore Martini', 'Antonio Pistillo', 'Michael Polley', ""Laura D'Arista Adam"", 'Calogero Azzaretto', 'Angelo Casadei', 'Martin Dansky', 'Alba Maiolini', 'Franca Scagnetti', 'Luciano Zanussi']","['Columbia Pictures', 'Laura Films', 'Allied Filmmakers', 'Prominent Features']",1,"['IT', 'GB']",['en'],tt0096764,6.986,698,Released
175,1986-10-24,From Beyond,4500000,1261000,85,"['Horror', 'Science Fiction']","A group of scientists have developed the Resonator, a machine which allows whoever is within range to see beyond normal perceptible reality. But when the experiment succeeds, they are immediately attacked by terrible life forms.",Humans are such easy prey.,['Stuart Gordon'],"['Jeffrey Combs', 'Barbara Crampton', 'Ken Foree', 'Ted Sorel', 'Carolyn Purdy-Gordon', 'Bunny Summers', 'Bruce McGuire', 'Del Russel', 'Dale Wyatt']","['Empire Pictures', 'Taryn Prov']",1,['US'],['en'],tt0091083,6.6,410,Released
176,2006-03-03,Flourish,500000,0,95,"['Drama', 'Mystery']","A tutor recounts a frantic night that culminated in a 16-year old girl's disappearance. Unfolding in front of a video camera direct from a psychiatric ward, Gaby Winters (Jennifer Morrison) recalls a dreadful babysitting job that sent her on a frantic search for a missing teenager out into the heart of a mysterious city. Woven into the story are a multitude of subplots that add up to one chaotic night that Gaby will never forget.",A babysitter's worst fear gets real.,[],"['Jennifer Morrison', 'Jesse Spencer', 'Leighton Meester', 'Daniel Roebuck', 'Olivia Burnette', 'Connie Ray']","['Swipe Films', 'Symbolic Entertainment', 'PettingZoo Pictures']",1,['US'],['en'],tt0479914,5.0,5,Released
177,2005-01-25,MirrorMask,4000000,973613,101,['Fantasy'],"In a fantasy world of opposing kingdoms, a 15-year old girl must find the fabled MirrorMask in order to save the kingdom and get home",The Other Side of Reason. The Other Side of Fate. The Other Side of Truth.,['Dave McKean'],"['Stephanie Leonidas', 'Jason Barry', 'Rob Brydon', 'Gina McKee', 'Dora Bryan', 'Stephen Fry', 'Robert Llewellyn', 'Lenny Henry', 'Nik Robson', 'Simon Harvey', 'Eryl Maynard', 'Eve Pearce', 'Victoria Williams', 'Rick Allen']","['Destination Films', 'The Jim Henson Company']",1,"['GB', 'US']",['en'],tt0366780,6.509,268,Released
178,2006-09-23,Peter & the Wolf,2300000,0,32,"['Animation', 'Family', 'Music']","An animated retelling set to Prokofiev's suite. Peter is a slight lad, solitary, locked out of the woods by his protective grandfather",Boys like Peter are not afraid of wolves...,[],[],"['Se-Ma-For', 'Storm Studios', 'Archangel', 'TV UNAM']",1,"['NO', 'PL', 'GB']",['en'],tt0863136,6.688,72,Released
179,2009-01-17,UFC 93: Franklin vs. Henderson,0,1300000,239,[],"The Ultimate Fighting Championship travels to Dublin, Ireland for the first time and the big guns of the light heavyweight division are coming along for the ride. Former UFC middleweight champion Rich “Ace” Franklin battles former two-division Pride champion Dan Henderson in a pivotal 205-pound battle that could determine the future for both superstars.",,"['Anthony ""Pasquale"" Giordano']","['Dan Henderson', 'Rich Franklin', 'Maurício Rua', 'Mark Coleman', 'Rousimar Palhares', 'Jeremy Horn', 'Alan Belcher', 'Denis Kang', 'Marcus Davis', 'Chris Lytle', 'John Hathaway', 'Tom Egan', 'Martin Kampmann', 'Alexandre Barros', 'Eric Schafer', 'Antonio Mendes', 'Tomasz Drwal', 'Ivan Serati', 'Dennis Siver', 'Nate Mohr']",[],1,['US'],['en'],tt1517803,5.9,4,Released
180,2003-10-03,Foolproof,8256269,460978,97,['Action'],"Kevin, Sam and Rob have an unusual hobby: planning foolproof heists, without intending to actually perform them. The game goes wrong when their latest plan is stolen and carried out. Things get even worse when a mysterious man approaches them with an offer: plan a heist for him, or go to jail. As the clock ticks, they find that the risk might be higher than just their freedom.",,[],"['Ryan Reynolds', 'Kristin Booth', 'Joris Jarsky', 'David Suchet', 'Sean Sullivan', 'Tara Slone', 'Soo Garay', 'William House', 'Wai Choy', 'James Allodi', 'Anthony J. Mifsud', 'Duff MacDonald', 'David Hewlett', 'Laura Catalano', 'Philip Craig']","['Alliance Atlantis Communications', 'Téléfilm Canada', 'Canadian Film or Video Production Tax Credit (CPTC)', 'Movie Central Network', 'Ego Film Arts', 'MuchMusic']",1,['CA'],"['fr', 'en']",tt0356614,6.122,123,Released
181,1993-09-17,Rudy,12000000,22750363,114,"['Drama', 'History']","Rudy grew up in a steel mill town where most people ended up working, but wanted to play football at Notre Dame instead. There were only a couple of problems. His grades were a little low, his athletic skills were poor, and he was only half the size of the other players. But he had the drive and the spirit of 5 people and has set his sights upon joining the team.","It's not the size of the dog in the fight, It's the size of the fight in the dog.",['David Anspaugh'],"['Sean Astin', 'Jon Favreau', 'Ned Beatty', 'Lili Taylor', 'Charles S. Dutton', 'Vince Vaughn', 'Greta Lind', 'Christopher Reed', 'Deborah Wittenberg', 'Kevin Duda', 'Amy Pietz', 'Scott Benjaminson', 'Mary Ann Thebus', 'Christopher Erwin', 'Robert Benirschke', 'Luke Massery', 'Robert J. Steinmiller Jr.', 'Lauren Katz', 'Gerry Becker', 'Robert Prosky', 'John Beasley', 'Ron Dean', 'Mitch Rouse', 'Chelcie Ross']",['TriStar Pictures'],1,['US'],"['en', 'es']",tt0108002,7.355,527,Released
182,2009-01-30,New in Town,8000000,29010817,97,"['Comedy', 'Romance']","Lucy Hill is an ambitious up-and-coming executive living in Miami. She loves her shoes, she loves her cars and she loves climbing the corporate ladder. When she is offered a temporary assignment – in the middle of nowhere – to restructure a manufacturing plant, she jumps at the opportunity, knowing that a big promotion is close at hand. What begins as a straight-forward assignment becomes a life-changing experience as Lucy discovers greater meaning in her life and, most unexpectedly, the man of her dreams.",She's an executive on the move. But her career is taking her a little farther than she expected.,['Jonas Elmer'],"['Renée Zellweger', 'Harry Connick Jr.', 'J.K. Simmons', 'Siobhan Fallon Hogan', ""Mike O'Brien"", 'Frances Conroy', 'Ferron Guerreiro', 'Barbara James Smith', 'James Durham', 'Robert Small', 'Wayne Nicklas', 'Hilary Carroll', 'Nancy Drake', 'Stewart J. Zully', 'Marilyn Boyle', 'Dan Augusta', 'Jimena Hoyos', 'Suzanne Coy']","['Edmonds Entertainment Group', 'Epidemic Pictures', 'The Safran Company', 'Gold Circle Films']",1,['US'],"['en', 'es']",tt1095174,5.788,398,Released
183,2008-02-09,江山美人,0,9323473,99,"['Action', 'Adventure', 'History']","After the death of her father, a woman is forced to take over as empress and fight to save her kingdom.",,['Tony Ching Siu-Tung'],"['Kelly Chen', 'Donnie Yen', 'Leon Lai', 'Guo Xiaodong', 'Kau Jan-Hoi', 'Zhang Shan', 'Liu Wei-Hua', 'Peng Zhi', 'Chen Zhihui', 'Yan Jie', 'Zhou Bo', 'Zhang Jin', 'Limin Deng', 'Peng Bo', 'Eric Zhang', 'Wong Dungdung']","['China Film Co-Production Corporation', 'Beijing Poly-bona Film Distribution Company']",1,"['CN', 'HK']","['zh', 'tr']",tt1186803,5.967,90,Released
184,2007-05-11,Delta Farce,12,0,90,"['Comedy', 'Action', 'Adventure']","Three bumbling Army reservists are hustled onto a plane headed for combat in Iraq -- but the fact that the plane drops them in Mexico doesn't stop them from ""liberating"" what they believe to be the Middle East.",In this war the wind doesn’t blow… It hurls.,['C.B. Harding'],"['Larry the Cable Guy', 'Bill Engvall', 'DJ Qualls', 'Christina Moore', 'Danny Trejo', 'Keith David', 'Jeff Dunham', ""Ed O'Ross"", 'Michael Papajohn', 'Marisol Nichols', 'Glenn Morshower', 'Michael Rose', 'Lorna Scott', 'Parker Goris', 'Lisa Lampanelli', 'Lance Smith', 'Bill Doyle', 'McKinley Freeman', 'Joel McKinnon Miller', 'Chris Spencer', 'Alejandro Patiño', 'Luis Chávez', 'David DeSantos', 'Nicholas Guilak', 'Jimmy Ortega', 'Albert P. Santos', 'Emilio Rivera', 'Shelly Desai', 'Tony Perez', 'Danielle Hartnett', 'Carlos Moreno Jr.', 'Rolando Molina', 'Joe Nunez', 'Esteban Cueto', 'Thomas Rosales Jr.', 'Matt Riedy', 'Amy Powell']","['Lions Gate Films', 'Shaler Entertainment Pictures', 'Parallel Entertainment Pictures', 'Sleeping Marmots Production', 'Samwilla Productions']",1,['US'],"['es', 'en']",tt0800003,4.963,134,Released
185,1989-04-07,The Dream Team,0,28890240,113,"['Comedy', 'Crime', 'Thriller']",This morning they were playing ping-pong in the hospital rec room. Now they're lost in New York and framed for murder. This was never covered in group therapy.,Four guys on a field trip to reality.,['Howard Zieff'],"['Michael Keaton', 'Christopher Lloyd', 'Peter Boyle', 'Stephen Furst', 'Lorraine Bracco', 'James Remar', 'Dennis Boutsikaris', 'Philip Bosco', 'Milo O’Shea', 'Ron James', 'Larry Pine']","['Imagine Entertainment', 'Universal Pictures']",1,['US'],['en'],tt0097235,6.087,178,Released
186,1950-07-12,Winchester '73,0,2250000,92,['Western'],"Lin McAdam rides into town on the trail of Dutch Henry Brown, only to find himself in a shooting competition against him. McAdam wins the prize, a one-in-a-thousand Winchester rifle, but Dutch steals it and leaves town. McAdam follows, intent on settling his old quarrel, while the rifle keeps changing hands and touching a number of lives.",The Gun That Won The West!,['Anthony Mann'],"['James Stewart', 'Shelley Winters', 'Dan Duryea', 'Stephen McNally', 'Millard Mitchell', 'Charles Drake', 'John McIntire', 'Will Geer', 'Jay C. Flippen', 'Rock Hudson', 'John Alexander', 'Steve Brodie', 'James Millican', 'Abner Biberman', 'Tony Curtis', 'James Best', 'Victor Adamson', 'Chet Brandenburg', 'Roy Bucko', 'Victor Cox', 'Jack Kenny', 'Jack Perry', 'Robert Anderson', 'Mel Archer', 'Ted Mapes', 'Ray Bennett', 'Frank Chase', 'Edmund Cobb', 'Forrest Taylor', 'Frank Conlan', 'Tex Cooper', 'Steve Darrell', 'John Doucette', 'Chick Hannan', 'Jimmy Hawkins', 'Bill McKenzie', 'Larry Olsen', 'Tony Taylor', 'Carol Henry', 'Ethan Laidlaw', 'Gregg Martell', 'Norman Ollestad', 'Bud Osborne', 'Duke York', 'Chuck Roberson', 'Ray Teal', 'John War Eagle', 'Chief Yowlachie', 'Guy Wilkerson']",['Universal International Pictures'],1,['US'],['en'],tt0043137,7.338,275,Released
187,2007-05-21,"Have Dreams, Will Travel",5000000,0,86,"['Drama', 'Romance']","West Texas, in the 1960's. A tale of two 12-year-olds who embark on an adventure to find new parents in order to escape their unhappy and emotionally unsatisfying family life.",You're never too young to have a plan,[],"['Cayden Boyd', 'AnnaSophia Robb', 'Val Kilmer', 'Heather Graham', 'Lara Flynn Boyle', 'Matthew Modine', 'J.D. Garfield', 'Johnny Cotugno', 'Jeff Griffin', 'Candace Campfield', 'Mary Evans', 'Mike Miller', 'William Lawrence Allen', 'Michael Clark', 'Boots Southerland', 'Ramsey Scott', 'Stephen Root', 'Toby Huss', 'Sean Brosnan', 'Jackson Hurst', 'Argos MacCallum', 'Tonea Stewart', 'Jerry Biggs', 'Brenda Isaacs Booth', 'Susan Conklin', 'Breanna Ellis', 'Mathew Greer', 'James Johnstone', 'Ashley Fox Linton', 'Dylan McDermott', 'Ethan Phillips']",['Thunder Bay Pictures'],1,['US'],['en'],tt0446802,7.25,42,Released
188,1955-01-13,Bad Day at Black Rock,1271000,3788000,81,"['Thriller', 'Drama', 'Crime']","One-armed war veteran John J. Macreedy steps off a train at the sleepy little town of Black Rock.  Once there, he begins to unravel a web of lies, secrecy, and murder.",Just the way it happened!,['John Sturges'],"['Spencer Tracy', 'Robert Ryan', 'Anne Francis', 'Dean Jagger', 'Walter Brennan', 'John Ericson', 'Ernest Borgnine', 'Lee Marvin', 'Russell Collins', 'Walter Sande', 'Billy Dix', 'K.L. Smith', 'Robert Griffin', 'Harry Harvey', 'Bobby Johnson', 'Francis McDonald']","['Metro-Goldwyn-Mayer', ""Loew's Incorporated""]",1,['US'],['en'],tt0047849,7.354,280,Released
189,2008-12-03,Pour elle,10000000,0,96,"['Drama', 'Thriller']","Lisa and Julien are married and lead a happy uneventful life with their son Oscar. But their life radically changes one morning, when the police comes to arrest Lisa on murder charges. She's sentenced to 20 years of prison. Convinced of his wife's innocence, Julien decides to act. How far will he be willing to go for her?","In a second, their life will change...",['Fred Cavayé'],"['Vincent Lindon', 'Diane Kruger', 'Lancelot Roch', 'Olivier Marchal', 'Hammou Graïa', 'Liliane Rovère', 'Olivier Perrier', 'Moussa Maaskri', 'Rémi Martin', 'Thierry Godard', 'Slimane Hadjar', 'Dorothée Tavernier', 'Alaa Safi', 'Joseph Beddelem', 'Ivan Franěk', 'Flore Vannier-Moreau', 'Pascal Parmentier', 'Kader Boukhanef', 'Odile Roire', 'Martine Vandeville', 'Gilles Kneusé', 'Nathalie Bécue', 'Frédéric Maranber', 'Marie-France Santon', 'Pierre Benoist', 'Diane Stolojan', 'Mikaela Fisher', 'Smadi Wolfman', 'Albert Jeunehomme', 'Andreas Christou', 'Marc Robert', 'Vincent Dubois']","['TF1 Films Production', 'Wild Bunch', 'Fidélité Films', 'TPS Star', 'Jerico']",1,['FR'],"['es', 'fr']",tt1217637,6.898,210,Released
190,1998-08-21,Dead Man on Campus,14000000,15064946,96,['Comedy'],College freshmen Josh and Cooper are more interested in hitting the bottle than in hitting the books -- and their poor grades are set to get them kicked out of school. Their only hope of passing is to find a roommate who will kill himself. That's because an oddball college code states that a suicide victim's roommates automatically get straight A's. But sharing space with a lineup of lunatics proves enough to drive both boys crazy.,Roommate Wanted...For a Limited Time Only,[],"['Tom Everett Scott', 'Mark-Paul Gosselaar', 'Poppy Montgomery', 'Lochlyn Munro', 'Alyson Hannigan', 'Randy Pearlstein', 'Corey Page', 'Jason Segel', 'Mari Morrow', 'Linda Cardellini', 'Mark Carapezza', 'Jeff Tarpley', 'Aeryk Egan', 'Judyann Elder', 'Dave Ruby', 'Wynn Irwin', 'John Aprea', ""Michael O'Hagan"", 'Nancy Linehan Charles', 'Shelley Malil', 'Ann Fairlie', 'Paul Collins', 'Johnny Dark', 'Daniel Villarreal', ""Annie O'Donnell"", 'P.J. Ochlan', 'Michael Rivkin', 'Peter James Smith', 'Kurt Loder', 'Mary Stein', 'Brian Howe', ""Patrick Thomas O'Brien"", 'Rueben Grundy', 'Steve Mackall', 'Cory Oliver', 'Zoaunne LeRoy', 'Kenn Michael', 'Tracey Stone']","['Paramount', 'MTV Films']",1,['US'],['en'],tt0118301,5.473,113,Released
191,2009-01-15,Paul Blart: Mall Cop,26000000,183293131,91,"['Action', 'Adventure', 'Comedy', 'Family']","Mild-mannered Paul Blart has always had huge dreams of becoming a State Trooper. Until then, he patrols the local mall as a security guard. With his closely cropped moustache, personal transporter and gung-ho attitude, only Blart seems to take his job seriously. All that changes when a team of thugs raids the mall and takes hostages. Untrained, unarmed and a super-size target, Blart has to become a real cop to save the day.",Safety Never Takes A Holiday.,['Steve Carr'],"['Kevin James', ""Keir O'Donnell"", 'Jayma Mays', 'Bobby Cannavale', 'Shirley Knight', 'Raini Rodriguez', 'Stephen Rannazzisi', 'Peter Gerety', 'Adam Ferrara', 'Jamal Mixon', 'Adhir Kalyan', 'Erick Avari', 'Gary Valentine', 'Allen Covert', 'Mike Vallely', 'Mike Escamilla', 'Jason Ellis', 'Jason Packham', 'Rick Thorne', 'Victor T. Lopez', 'Natascha Hopkins', 'Jackie Sandler', 'Mookie Barker', 'Jackie Flynn', 'Richie Minervini', 'Brie Hill Arbaugh', 'Steffiana De La Cruz', 'Dylan Clark Marshall', 'Bernie McInerney', 'Tyler Spindel', 'Bas Rutten', 'Teresa Zantua', 'Dahlia Salem', 'Zele Avradopoulos', 'Maria Arcé', 'Robert Harvey', 'Billy Concha', 'Michael Burton', 'Carl Randall', 'Ruby Wendell', 'Lindsay MacDonald', 'Donna Glee Reim', 'Dale F. Appel', 'Joel Arsenault', 'Stephanie Atkinson', 'Amber Baldinelli', 'William Bornkessel', 'Mike Burton', 'Katelyn Cahill', 'Patrick Canty', 'Gio Castellano', 'Jeffrey Corazzini', 'D.W. Cormier', 'Benjamin Crocker', 'Nicholas Davis', 'Kevin DeCoste', 'Michael DeMello', 'Hannah Depew', 'Vincent J. Earnshaw', 'Suzanne England', 'Susan Farese', 'Keith Fluker', 'Andy Forgit', 'Victor Franko', 'Sari Gagnon', 'Suzanne Gillies', 'Albert Gornie', 'Rob W. Gray', 'Dane Grigas', 'Cody Harter', 'Matt Heron-Duranti', 'Mark Hetherington', 'Louis Holmes', 'Ren Knopf', ""Lynn L'Heureux"", 'Dan Marshall', 'Andrew J McGuinness', 'Todd Mello', 'Jason Mulcahy', 'Ron Murphy', 'Scott Neufville', 'Chris Palermo', 'Aaron J. Patton', 'Alan Resnic', 'Brieann Rich', 'Michael Rich', 'Nicholas Rich', 'Bradley Robinson', 'Jessica Rockwood', 'Gary Roscoe', 'Jonathan Sawicki', 'Cate Smit', 'Gustin Smith', 'Ylian Alfaro Snyder', 'Jon Robert Stafford', 'George J. Vezina', 'Donald Warnock', 'Jon Warnock', 'Mike Wendt', 'Kent R. Williams']","['Columbia Pictures', 'Sony Pictures', 'Happy Madison Productions', 'Relativity Media', 'Hey Eddie']",1,['US'],['en'],tt1114740,5.409,2121,Released
192,2016-10-28,Rings,25000000,83080890,102,['Horror'],"Julia becomes worried about her boyfriend, Holt when he explores the dark urban legend of a mysterious videotape said to kill the watcher seven days after viewing. She sacrifices herself to save her boyfriend and in doing so makes a horrifying discovery: there is a ""movie within the movie"" that no one has ever seen before.",Evil is reborn.,['F. Javier Gutiérrez'],"['Matilda Anna Ingrid Lutz', 'Alex Roe', 'Johnny Galecki', ""Vincent D'Onofrio"", 'Aimee Teegarden', 'Bonnie Morgan', 'Chuck David Willis', 'Patrick R. Walker', 'Zach Roerig', 'Laura Slade Wiggins', 'Lizzie Brocheré', 'Drew Grey', 'Kayli Carter', 'Jill Jane Clements', 'Andrea Laing', 'Surely Alvelo', 'Adam Fristoe', 'Andrea Powell', 'Michael Sanders', 'Chris Greene']","['Paramount', 'Vertigo Entertainment', 'Macari/Edelstein', 'Parkes+MacDonald Image Nation', 'Waddieish Claretrap']",3,['US'],['en'],tt0498381,5.0,2295,Released
