,date,titre,budget,recette,duree,genres,synopsis,tagline,realisateur,casting,compagnies_production,suite,production_countries,langues,imdb_id,vote_average,vote_count,status
219,2007-09-12,The Stone Angel,0,473993,116,['Drama'],"The feisty aging Hagar Shipley has lived an unconventional life. Her rebellious heart has always ruled and her choices have put her at odds with family and friends. Faced with her own mortality, and desperate to find solace, she goes on the run. In both the past and the present, she is forced to come to terms with the pain and pleasure, the disappointments and the exhilarations of her life.",,['Kari Skogland'],"['Ellen Burstyn', 'Christine Horne', 'Cole Hauser', 'Kevin Zegers', 'Elliot Page', 'Dylan Baker', 'Wings Hauser', 'Jordan Todosey', 'Landon Norris', 'Sheila McCarthy', 'Devon Bostick']","['Téléfilm Canada', 'Sequence Film', 'Astral Media', 'Alliance', 'Buffalo Gal Pictures', 'Movie Central Network', 'HandMade Films']",1,"['CA', 'GB']",['en'],tt0847897,5.5,23,Released
220,2002-03-25,The Rookie,20000000,75597042,127,"['Drama', 'Family']","Jim Morris never made it out of the minor leagues before a shoulder injury ended his pitching career twelve years ago. Now a married-with-children high-school chemistry teacher and baseball coach in Texas, Jim's team makes a deal with him: if they win the district championship, Jim will try out with a major-league organization. The bet proves incentive enough for the team, and they go from worst to first, making it to state for the first time in the history of the school. Jim, forced to live up to his end of the deal, is nearly laughed off the try-out field--until he gets onto the mound, where he confounds the scouts (and himself) by clocking successive 98 mph fastballs, good enough for a minor-league contract with the Tampa Bay Devil Rays. Jim's still got a lot of pitches to throw before he makes it to The Show, but with his big-league dreams revived, there's no telling where he could go.",Sometimes dreams come back to life.,['John Lee Hancock'],"['Dennis Quaid', 'Rachel Griffiths', 'Jay Hernandez', 'Beth Grant', 'Angus T. Jones', 'Brian Cox', 'Rick Gonzalez', 'Chad Lindberg', 'Angelo Spizzirri', 'Royce D. Applegate', 'Russell Richardson', 'Raynor Scheine', 'Chris Sheffield', 'Brandon Smith']","['Walt Disney Pictures', 'Gran Via Productions', '98 MPH Productions']",1,['US'],['en'],tt0265662,6.737,355,Released
221,2007-04-27,The Condemned,0,8642858,113,"['Action', 'Thriller']","Jack Conrad is awaiting the death penalty in a corrupt Central American prison. He is ""purchased"" by a wealthy television producer and taken to a desolate island where he must fight to the death against nine other condemned killers from all corners of the world, with freedom going to the sole survivor.","10 Will Fight, 9 Will Die. You Get To Watch.",[],"['Steve Austin', 'Vinnie Jones', 'Robert Mammone', 'Tory Mussett', 'Madeleine West', 'Rick Hoffman', 'Sullivan Stapleton', 'Manu Bennett', 'Christopher James Baker', 'Sam Healy', 'Luke Pegler', 'Masa Yamaguchi', 'Emelia Burns', 'Marcus Johnson', 'Nathan Jones', 'Dasi Ruz', 'Andy McPhee', 'Rai Fazio', 'Angie Milliken', 'Grant Piro', 'Andrew Buchanan', 'Neil Pigot', 'Jacy Lewis', 'John Walton', 'Steve Morris']","['Lionsgate', 'Condemned Productions', 'Sidestreet Entertainment', 'New Wave Entertainment', 'WWE Studios', 'Colossal Entertainment']",1,['US'],['en'],tt0443473,6.044,642,Released
222,2008-12-19,Nothing But the Truth,11500000,409832,108,"['Drama', 'Thriller']","When reporter Rachel Armstrong writes a story that reveals the identity of a covert CIA operative, the government demands that Rachel reveal her source. She defies the special prosecutor and is thrown in jail. Meanwhile, her attorney, Albert Burnside argues her case all the way to the U.S. Supreme Court.",Don't Reveal the Source.,['Rod Lurie'],"['Kate Beckinsale', 'Matt Dillon', 'Alan Alda', 'Vera Farmiga', 'Noah Wyle', 'Angela Bassett', 'David Schwimmer', 'Floyd Abrams', 'Courtney B. Vance', 'Preston Bailey', 'Kristen Bough', 'Merle Dandridge', 'Kelly Holleman', 'Julie Ann Emery']","['Battleplan Productions', 'Yari Film Group']",1,['US'],['en'],tt1073241,6.896,383,Released
223,2008-01-01,20 Years After,1000000,0,95,"['Drama', 'Fantasy', 'Science Fiction']","In the middle of nowhere, 20 years after an apocalyptic terrorist event that obliterated the face of the world!",,['Jim Torres'],"['Azura Skye', 'Joshua Leonard', 'Nathan Baesel', 'Diane Salinger', 'Reg E. Cathey', 'Aaron Hendry', 'Charlie Talbert', 'Malika', 'Khadijah Haqq McCray', 'Shannon Eubanks', 'Dan Beene', 'Deborah Duke', 'Graham Roden', 'Jake B. Miller', 'Evan McManus']",[],1,['US'],['en'],tt0825279,3.1,37,Released
224,2008-02-07,Boot Camp,14000000,0,99,"['Drama', 'Thriller']",A group of troubled teens are sent to a rehabilitation program housed in a remote camp on the island of Fiji. What their parents believe is a state-of-the-art deluxe institution in a beautiful natural environment turns out to be a prison-like boot camp where they are abused and brainwashed.,Every year troubled teens are sent away to change their lives. On this island they must fight to save them.,['Christian Duguay'],"['Mila Kunis', 'Gregory Smith', 'Peter Stormare', 'Regine Nehy', 'Matthew Smalley', 'Colleen Rennison', 'Lexie Huber', 'Christopher Jacot', 'Sarah Lind', 'Barbara Gates Wilson', 'Christianne Hirt', 'Belinda Metz', 'Grace Bauer', 'Carrie Schiffler', 'Anna Tofinga', 'Elsie Braise', 'Tygh Runyan', 'Serge Houde', 'David Haysom']","['CD Films', 'Edgey Productions']",1,"['CA', 'US']",['en'],tt0870204,5.921,165,Released
225,2004-08-25,Ils se marièrent et eurent beaucoup d'enfants,10900000,7725902,100,"['Drama', 'Comedy', 'Romance']",Is love compatible with coupledom? And what of freedom and fidelity? These are some of the questions facing two married men.,,[],"['Charlotte Gainsbourg', 'Yvan Attal', 'Alain Chabat', 'Alain Cohen', 'Emmanuelle Seigner', 'Anouk Aimée', 'Aurore Clément', 'Carolina Gynning', 'Ben Attal', 'Kitu Gidwani', 'Sujay Sood', 'Keith Allen', 'Nicolas Vaude', 'Jérôme Bertin', 'Stéphanie Murat', 'Marie-Sophie Wilson', 'Angie David', 'Johnny Depp', 'Sébastien Vidal']",[],1,['FR'],['fr'],tt0381270,5.994,80,Released
226,1998-08-14,Slums of Beverly Hills,5000000,5502773,91,"['Comedy', 'Drama']","In 1976, a lower-middle-class teenager struggles to cope living with her neurotic family of nomads on the outskirts of Beverly Hills.",Growing Up is Hard to Do,[],"['Natasha Lyonne', 'Alan Arkin', 'Marisa Tomei', 'Eli Marienthal', 'David Krumholtz', 'Kevin Corrigan', 'Jessica Walter', 'Mena Suvari', 'Rita Moreno', 'Carl Reiner', 'Bryna Weiss', 'Charlotte Stewart', 'Marley McClean', 'Mary Portser', 'Jay Patterson', 'Natalie Karp']","['Fox Searchlight Pictures', 'Wildwood Enterprises']",1,['US'],['en'],tt0120831,6.303,180,Released
227,1981-12-18,Sharky's Machine,17500000,35610100,122,"['Crime', 'Drama', 'Action', 'Thriller']","Police officer Tom Sharky gets busted back to working vice, where he happens upon a scandalous conspiracy involving a local politician. Sharky's new 'machine' gathers evidence while Sharky falls in love with a woman he has never met.","If you mess with a cop like Sharky, you better be very tough . . . or very beautiful.",[],"['Burt Reynolds', 'Rachel Ward', 'Henry Silva', 'Brian Keith', 'Vittorio Gassman', 'Charles Durning', 'Earl Holliman', 'Bernie Casey', 'Richard Libertini', 'Darryl Hickman', 'Joseph Mascolo', 'Tony King', 'John Fiedler', 'Carol Locatell', 'Suzee Pai', 'Val Avery']","['Warner Bros. Pictures', 'Deliverance Productions']",1,['US'],['en'],tt0083064,6.068,73,Released
228,1991-09-13,Dogfight,0,397631,94,"['Comedy', 'Drama', 'Romance']","In the fall of 1963, Eddie Birdlace is an 18-year-old Marine Corps volunteer who is about to ship out with three of his buddies for a tour of duty in Vietnam. Planning a massive blowout for their last night in San Francisco, Eddie, his buddies, and a number of other Marines set up a contest they call a ""dogfight.""",A love story.,['Nancy Savoca'],"['River Phoenix', 'Lili Taylor', 'Richard Panebianco', 'Anthony Clark', 'Mitchell Whitfield', 'Holly Near', 'Elizabeth Daily', 'Sue Morales', 'Christina Mastin', 'Christopher Shaw', 'John Lacy', 'Chris San Nicholas', 'Brian Gotta', 'Peg Phillips', 'Ron Lynch', 'Dale Carman', 'Burke Pearson', 'Angie Utt', 'Julian Schembri', 'Barbara Benedetti', 'Ivars Mikelson', 'Brendan Fraser', 'Matt Skerritt', 'Dion Williams', 'Jason Moore', 'Denise Williams', 'Kristie Gamer', 'Dave MacIntyre', 'Art Cahn', 'Robert Munns', 'Jessica Wallenfels', 'Bonnie Fox', 'Sandra Ellis Lafferty', 'Joseph Franklin', 'Frank Walters', 'Jacob Luft', 'Constance McCord', 'Laura Vetter', 'Krisha Fairchild', 'George Evans', 'Jillian Armenante', 'Anne Elizabeth Washburn', 'John Fry', 'Albert Farrar', 'Raf Orozco']",['Warner Bros. Pictures'],1,['US'],['en'],tt0101748,6.948,92,Released
229,2008-04-01,Yonkers Joe,5000000,8286,101,['Drama'],"Yonkers Joe tells the story of a dice hustler whose determination to make one last grab for a big score in Vegas is complicated by the reappearance of his estranged, mentally challenged son into his life.",,['Robert Celestino'],"['Chazz Palminteri', 'Christine Lahti', 'Tom Guiry', 'Michael Lerner', 'Nate Bynum', 'Roma Maffia', 'Rusty Meyers', 'Michael Rispoli', 'Lauri Johnson', 'Linus Roache', 'Frank John Hughes', 'Saverio Guerra', 'Arthur J. Nascarella', 'Dean Marrazzo', 'Chad McKnight', ""John 'Fast Jack' Farrell"", 'Michael A. Rizza', 'Anthony Tarantola', 'Michael A. Rizza', 'Patrick Hughes', 'Charlie DiPinto', 'Bill Allison', 'Lanette Fugit Hannah', 'Anat Gerber', 'Corinna Harney']","['GO Productions', 'Trent Othick Productions']",1,['US'],['en'],tt1018830,4.8,12,Released
230,1987-07-22,Summer School,0,35114428,97,['Comedy'],"A high-school gym teacher has big plans for the summer, but is forced to cancel them to teach a ""bonehead"" English class for misfit goof-off students. Fortunately, his unconventional brand of teaching fun field trips begins to connect with them, and even inspires ardor in some.","At Ocean Front High, what do they call a guy who cuts classes, hates homework, and lives for summer vacations? Teacher.",[],"['Mark Harmon', 'Kirstie Alley', 'Courtney Thorne-Smith', 'Dean Cameron', 'Gary Riley', 'Shawnee Smith', 'Fabiana Udenio', 'Ken Olandt', 'Robin Thomas', 'Kelly Jo Minter', 'Richard Steven Horvitz', 'Carl Reiner', 'DeeDee Rescher', 'Andrea Howard', 'Beau Starr', 'Prince Hughes', 'Amy Stoch', 'Patrick Labyorteaux', 'Duane Davis', 'Tom Troupe', 'Francis X. McCarthy', 'Lucy Lee Flippin', 'Laura Waterbury']",['Paramount'],1,['US'],['en'],tt0094072,6.376,201,Released
231,2002-07-11,Crackerjack,2600000,6500000,92,['Comedy'],"When dwindling membership and increasing overheads makes a local bowling club and prime candidate for a takeover, it's all hands on deck to save the club, in what turns into an epic battle where young meets old, greed meets good and people rise to the occasion in extraordinary circumstances.",It’s on for young and old.,['Paul Moloney'],"['Mick Molloy', 'Bill Hunter', 'Frank Wilson', 'Monica Maughan', 'Lois Ramsay', 'Samuel Johnson', 'Judith Lucy', 'John Clarke']","['Million Monkeys', 'Melbourne Film Office', 'Molloy Boy Productions', 'Showtime Australia']",1,['AU'],['en'],tt0291832,6.6,11,Released
232,1937-10-20,The Awful Truth,600000,3000000,91,"['Comedy', 'Drama', 'Romance']","Unfounded suspicions lead a married couple to begin divorce proceedings, whereupon they start undermining each other's attempts to find new romance.",Danger! Wild woman on the loose!,['Leo McCarey'],"['Irene Dunne', 'Cary Grant', 'Ralph Bellamy', ""Alexander D'Arcy"", 'Cecil Cunningham', 'Molly Lamont', 'Esther Dale', 'Joyce Compton', 'Robert Allen', 'Robert Warwick', 'Mary Forbes', 'Claud Allister', 'Al Bridge', 'Edgar Dearing', 'Wyn Cahoon', 'Sarah Edwards', 'Bess Flowers', 'Mitchell Harris', 'Dell Henderson', 'Scott Kolk', 'Bert Moorhouse', 'Miki Morita', 'Edmund Mortimer', 'Zita Moulton', 'George C. Pearce', 'Edward Peil Sr.', 'Paul Stanton', 'John Tyrrell', 'Frank C. Wilson', 'Ruth Cherrington', 'Dora Clement', 'Arthur Stuart Hull', 'Frank McLure', 'Frances Raymond', 'Bruce Sidney', 'Lee Willard', 'Skippy']",['Columbia Pictures'],1,['US'],"['fr', 'en', 'it']",tt0028597,7.299,221,Released
233,2004-02-14,Eating Out,50000,0,84,"['Comedy', 'Romance']","After getting dumped by his slutty girlfriend, Caleb falls in love with Gwen. However, thanks to Caleb's roommate, Gwen thinks he's gay and sets him up with her roommate, Marc.",The fastest way to a girl's heart is through her gay best friend.,['Q. Allan Brocka'],"['Rebekah Kochan', 'Ryan Carnes', 'Scott Lunsford', 'Emily Brooke Hands', 'Jim Verraros', 'Kris Black', 'Billy Shepard', 'John Janezic', 'Adrienne Pearson']",['Ariztical Entertainment'],1,['US'],['en'],tt0372884,5.878,82,Released
234,1992-09-18,School Ties,0,14715067,106,['Drama'],"When David Greene receives a football scholarship to a prestigious prep school in the 1950s, he feels pressure to hide the fact that he is Jewish from his classmates and teachers, fearing that they may be anti-Semitic. He quickly becomes the big man on campus thanks to his football skills, but when his Jewish background is discovered, his worst fears are realized and his friends turn on him with violent threats and public ridicule.",Just because you’re accepted doesn’t mean you belong.,['Robert Mandel'],"['Brendan Fraser', 'Matt Damon', ""Chris O'Donnell"", 'Randall Batinkoff', 'Ben Affleck', 'Amy Locane', 'Cole Hauser', 'Anthony Rapp', 'Zeljko Ivanek', 'Kevin Tighe', 'Ed Lauter', 'Peter Donat', 'Stanton Denman', 'John Cunningham', 'John Speredakos', 'Andrew Lowery']",['Paramount'],1,['US'],['en'],tt0105327,6.444,310,Released
235,2007-09-22,Eichmann,8000000,0,100,"['History', 'Drama']","Based upon the final confession of Adolf Eichmann, made before his execution in Israel, of his role in Hitler's plan for the final solution.",,['Robert Young'],"['Thomas Kretschmann', 'Troy Garity', 'Franka Potente', 'Stephen Fry', 'Delaine Yates', 'Tereza Srbova', 'Judit Viktor', 'Stephen Greif', 'Dénes Bernáth', 'Bernadett Kis', ""Tilly O'Neil"", 'Alexis Latham', 'Scott Alexander Young', 'Béla Fesztbaum', 'Gyula Mesterházy', 'Richard Rifkin', 'László Bereczki', 'Péter Ambrus', 'Péter Geltz', 'Máté Endrédi', 'Eszter Palóc']","['uFilm', 'Entertainment Motion Pictures', 'uMedia', 'HCC Media Group', 'Thema Production', 'Grand Hotel Pictures']",1,"['HU', 'GB']","['es', 'en']",tt0901481,6.099,75,Released
236,2009-02-18,Le Code a changé,12000000,15016366,100,"['Comedy', 'Romance']",So called friends at a dinner party end up acting like a dysfunctional family.,,[],"['Karin Viard', 'Dany Boon', 'Marina Foïs', 'Patrick Bruel', 'Emmanuelle Seigner', 'Christopher Thompson', 'Marina Hands', 'Patrick Chesnais', 'Pierre Arditi', 'Guillaume Durand']",['Thelma Films'],1,['FR'],['fr'],tt1193088,5.446,139,Released
237,1966-10-10,Hawaii,15000000,34562222,189,"['Drama', 'Adventure', 'Romance']","Abner Hale, a rigid and humorless New England missionary, marries the beautiful Jerusha Bromley and takes her to the exotic island kingdom of Hawaii, intent on converting the natives. But the clash between the two cultures is too great and instead of understanding there comes tragedy.",James Michener's novel reaches the screen.,['George Roy Hill'],"['Julie Andrews', 'Max von Sydow', 'Richard Harris', 'Gene Hackman', ""Carroll O'Connor"", 'Jocelyne LaGarde', 'Manu Tupou', 'Ted Nobriga', 'Elizabeth Logue', 'John Cullum', 'George Rose', 'Torin Thatcher', 'Michael Constantine', 'Malcolm Atterbury', 'Elizabeth Cole', 'John Harding', 'Diane Sherry Case', 'Heather Menzies', 'Lokelani S. Chicarell', 'Don Doolittle', 'Robert Oakley', 'Clas S. von Sydow', 'Bertil Werjefelt', 'Jane Buchanan', 'Bette Midler', 'Wayne Stam']","['United Artists', 'The Mirisch Company']",1,['US'],['en'],tt0060491,6.5,37,Released
238,2005-10-16,Havoc,9000000,0,85,"['Crime', 'Drama']","A wealthy Los Angeles teen and her superficial friends wants to break out of suburbia and experience Southern California's ""gangsta"" lifestyle. But problems arise when the preppies get in over their heads and provoke the wrath of a violent Latino gang. Suddenly, their role-playing seems a little too real.",Too much is never enough.,['Barbara Kopple'],"['Anne Hathaway', 'Bijou Phillips', 'Shiri Appleby', 'Michael Biehn', 'Joseph Gordon-Levitt', ""Matt O'Leary"", 'Freddy Rodríguez', 'Laura San Giacomo', 'Mike Vogel', 'Raymond Cruz', 'Alexis Dziena', 'Channing Tatum', 'Sam Hennings', 'Cecilia Peck', 'Josh Peck', 'J. D. Pardo', 'Terri Hanauer', 'Sam Bottoms', 'Jocelyn Towne', 'Jillian McWhirter', 'Laura Breckenridge', 'Alysia Joy Powell', 'Jon Erik', 'Luis Robledo', 'Tammy Trull', 'Jossara Jinaro', 'Angela Meryl']",['Media 8 Entertainment'],1,"['DE', 'US']","['es', 'en']",tt0285175,5.169,239,Released
239,1959-12-22,"Suddenly, Last Summer",3000000,9000000,114,"['Thriller', 'Drama', 'Mystery']",The only son of wealthy widow Violet Venable dies while on vacation with his cousin Catherine. What the girl saw was so horrible that she went insane; now Mrs. Venable wants Catherine lobotomized to cover up the truth.,"Suddenly, last summer, Cathy knew she was being used for something evil!",[],"['Elizabeth Taylor', 'Katharine Hepburn', 'Montgomery Clift', 'Albert Dekker', 'Mercedes McCambridge', 'Gary Raymond', 'Mavis Villiers', 'Patricia Marmont', 'Joan Young', 'Maria Britneva', 'Sheila Robbins', 'Julián Ugarte', 'Eddie Fisher', 'David Cameron', 'Beatrice Shaw', 'Frank Merlo', 'Gore Vidal', 'Sheila Raynor', 'Sandra White', 'Rita Webb', 'Ian Wilson', 'Florence Stark', 'Brenda Dunrich', 'Roberta Woolley', 'Grace Denbigh Russell']","['Columbia Pictures', 'Horizon Pictures', 'Academy Pictures Corporation', 'Camp Films']",1,"['GB', 'US']",['en'],tt0053318,7.39,219,Released
240,1964-08-06,The Night of the Iguana,3000000,12000000,118,"['Drama', 'Romance']",A defrocked Episcopal clergyman leads a bus-load of middle-aged Baptist women on a tour of the Mexican coast and comes to terms with the failure haunting his life.,One man... three women... one night,['John Huston'],"['Richard Burton', 'Ava Gardner', 'Deborah Kerr', 'Sue Lyon', 'Skip Ward', 'Grayson Hall', 'Cyril Delevanti', 'Mary Boylan', 'Emilio Fernández', 'Eloise Hardt']","['Metro-Goldwyn-Mayer', 'Seven Arts Productions']",1,['US'],"['en', 'es']",tt0058404,7.216,111,Released
241,2007-12-05,Donkey Xote,18000000,7365250,90,"['Family', 'Adventure', 'Animation']","The donkey, Rucio, tells the true story of Don Quixote and defends the idea that he wasn't insane, but a very intelligent, passionate and enthusiastic fellow.",,['José Pozo'],"['Andreu Buenafuente', 'José Luis Gil', 'Sancho Gracia', 'Luis Posada']","['Lumiq Studios', 'Filmax Animation', 'Bren Entertainment', 'Green Publicidad y Medios']",1,"['IT', 'ES']",['es'],tt0419704,5.4,61,Released
242,2008-04-23,Clean Break,3000000,0,93,['Thriller'],"A dramatic thriller about a couple who own an advertising agency. The husband apparently commits suicide, but the police and the insurance company decide to investigate his death.",,['Robert Malenfant'],"['Tara Reid', 'Angus Macfadyen', 'Colm Meaney', 'Lorena Bernal', 'Mingo Ràfols', 'George Wendt', 'Marta Bayarri', 'Francesc Garrido', 'Sue Flack', 'Roger Delmont', 'Colin Morgan']",['Drimtim Entertainment'],1,['US'],['en'],tt0867464,4.6,12,Released
243,1980-05-16,The Long Riders,10000000,15795189,99,"['Western', 'Crime', 'Action']","The origins, exploits and the ultimate fate of the James gang is told in a sympathetic portrayal of the bank robbers made up of brothers who begin their legendary bank raids because of revenge.","""All the world likes an outlaw. For some damn reason they remember 'em."" - Jesse James",['Walter Hill'],"['David Carradine', 'Keith Carradine', 'Robert Carradine', 'James Keach', 'Stacy Keach', 'Dennis Quaid', 'Randy Quaid', 'Kevin Brophy', 'Harry Carey, Jr.', 'Christopher Guest', 'Nicholas Guest', 'Shelby Leverington', 'Felice Orlandi', 'Pamela Reed', 'James Remar', 'Fran Ryan', 'Savannah Smith Boucher', 'Amy Stryker', 'John Bottoms', 'West Buchanan', 'Edward Bunker', 'Martina Deignan', 'Allan Graf', 'Chris Mulkey', 'Thomas Myers', 'Marlise Karlin', 'Glenn Robards', 'Tim Rossovich', 'Lin Shaye', 'Gary Watkins', 'Peter Jason', 'Duke Stroud', 'Steven Chambers', 'William Traylor', 'J. Don Ferguson', 'Hugh McGraw', 'Prentiss Rowe', 'Stuart Mossman', 'Mitch Greenhill', 'Tom Sauber', 'Jimmy Medearis', 'Edgar McLeod', 'Luis Contreras', 'Kalen Keach', 'R.B. Thrift', 'George D. Miklos', 'Bill Rampley', 'Michael Lackey']",['United Artists'],1,['US'],['en'],tt0081071,6.616,173,Released
244,2000-04-21,Love & Basketball,20000000,27728118,124,"['Action', 'Comedy', 'Drama', 'Romance']","Quincy McCall and Monica Wright grew up in the same neighborhood and have known each other since childhood. As they grow into adulthood, they fall in love, but they also share another all-consuming passion: basketball. As Quincy and Monica struggle to make their relationship work, they follow separate career paths though high school and college basketball and, they hope, into stardom in big-league professional ball.",All's fair in love and basketball.,['Gina Prince-Bythewood'],"['Omar Epps', 'Sanaa Lathan', 'Chris Warren', 'Kyla Pratt', 'Alfre Woodard', 'Regina Hall', 'Glenndon Chatman', 'Jess Willard', 'Naykia Harris', 'Harry Lennix', 'Debbi Morgan', 'Dennis Haysbert', 'Al Foster', 'Colleen Matsuhara', 'Gabrielle Union', 'Tyra Banks', 'Christine Dunford', 'Boris Kodjoe', 'Erika Ringor', 'Monica Calhoun', 'Chick Hearn']",['40 Acres and a Mule Filmworks'],1,['US'],"['en', 'es']",tt0199725,7.485,364,Released
245,1977-11-01,The Goodbye Girl,0,102000000,111,"['Comedy', 'Romance']","Paula (an unemployed dancer) and her 10-year-old daughter live in a Manhattan apartment with Tony, Paula's married boyfriend. Tony takes an acting job in Italy, and sublets the apartment to a friend without telling Paula.",Thank you Neil Simon for making us laugh at falling in love... again.,['Herbert Ross'],"['Richard Dreyfuss', 'Marsha Mason', 'Quinn Cummings', 'Paul Benedict', 'Barbara Rhoades', 'Theresa Merritt', 'Michael Shawn', 'Patricia Pearcy', 'Gene Castle', 'Daniel Levans', 'Marilyn Sokol', 'Anita Dangler', 'Victoria Boothby', 'Robert Costanzo', 'Pancho González', 'Jose Machado', 'Hubert Kelly', 'Dana Laurita', 'Clarence Felder', 'Loyita Chapel', 'Caprice Clark', 'Esther Sutherland', 'Kensuke Haga', 'Ryohei Kanokogi', 'Ruby Holbrook', 'Kristina Hurrell', 'David Matthau', 'Milt Oberman', 'Eddie Villery', 'Joseph Carberry', 'Eric Uhler', 'Raymond J. Barry', 'Powers Boothe', 'Tom Everett', 'Janice Fuller', 'Munson Hicks', 'Robert Kerman', 'Jeanne Lange', 'Robert Lesser', 'Fred McCarren', 'Nicholas Mele', 'Maureen Moore', 'Joe Regalbuto', 'Peter Vogt', 'Wendy Cutler', 'Susan Elliot', 'Andy Goldberg', 'Paul Wilson', 'Nicol Williamson']","['Metro-Goldwyn-Mayer', 'Rastar Productions']",1,['US'],['en'],tt0076095,7.043,129,Released
246,1982-07-30,Night Shift,8100000,21095683,106,['Comedy'],"A nebbish of a morgue attendant gets shunted back to the night shift where he is shackled with an obnoxious neophyte partner who dreams of the ""one great idea"" for success. His life takes a bizarre turn when a prostitute neighbour complains about the loss of her pimp. His partner, upon hearing the situation, suggests that they fill that opening themselves using the morgue at night .","Ever since two enterprising young men turned the City Morgue into a swinging business, people have been dying to get in.",['Ron Howard'],"['Henry Winkler', 'Michael Keaton', 'Shelley Long', 'Gina Hecht', 'Pat Corley', 'Bobby Di Cicco', 'Nita Talbot', 'Basil Hoffman', 'Tim Rossovich', 'Clint Howard', 'Joe Spinell', 'Cheryl Carter', 'Becky Gonzalez', 'Corki Grazer', 'Jaid Barrymore', 'Ava Lazar', 'Ola Ray', 'Cassandra Gava', 'Ashley Cox', 'Dawn Dunlap', 'K.C. Winkler', 'Monique Gabrielle', 'Richard Belzer', 'Beau Billingslea', 'Grand L. Bush', 'Floyd Levine', 'Charles Fleischer', 'Vincent Schiavelli', 'Brett Baxter Clark', 'Kevin Costner', 'Shannen Doherty', 'Michael Pataki', 'Elizabeth Carder', 'Joy Michael Vogelbacher']","['Warner Bros. Pictures', 'The Ladd Company']",1,['US'],['en'],tt0084412,5.967,152,Released
247,2008-10-31,The Haunting of Molly Hartley,0,15,82,"['Drama', 'Horror']","When teenage Molly Hartley moves to a new town, she's haunted by terrifying visions that may have to do with dark secrets from her past. Something evil lurks just beneath the lush surfaces of her private-school world, and it holds the rights to her very soul. On the eve of her 18th birthday, Molly is about to discover the truth of just who or what she is destined to become.",Her past is yet to come.,[],"['Haley Bennett', 'Jake Weber', 'Chace Crawford', 'Shannon Woodward', 'Shanna Collins', 'AnnaLynne McCord', 'Marin Hinkle', 'Nina Siemaszko', 'Josh Stewart', 'Jessica Lowndes', 'Ross Thomas']","['LD Entertainment', 'Huntington Prep']",1,['US'],['en'],tt1045655,4.346,133,Released
