,date,titre,budget,recette,duree,genres,synopsis,tagline,realisateur,casting,compagnies_production,suite,production_countries,langues,imdb_id,vote_average,vote_count
0,2014-06-14,Earth to Echo,13000000,45300000,89,"['Family', 'Adventure', 'Science Fiction']","After a construction project begins digging in their neighbourhood, best friends Tuck, Munch and Alex inexplicably begin to receive strange, encoded messages on their cell phones. Convinced something bigger is going on, they go to their parents and the authorities. The three embark on a secret adventure to crack the code and follow it to its source, and discover a mysterious being from another world who desperately needs their help. The journey that follows will change all their lives forever.",No one will ever believe our story.,['Dave Green'],"['Teo Halm', 'Astro', 'Reese Hartwig', 'Ella Wahlestedt', 'Jason Gray-Stanford', 'Algee Smith', 'Arthur Darbinyan', 'Cassius M. Willis', 'Sonya Leslie', ""Kerry O'Malley"", 'Virginia Louise Smith', 'Peter MacKenzie', 'Valerie Wildman', 'Roger Hewlett', 'Mary Pat Gleason', 'Brooke Dillman', 'Myk Watford', 'Tiffany Espensen', 'Israel Broussard', 'Drake Kemper', 'Sara Arrington', 'Michael Lee Merrins', 'Sean Carroll', 'Chris Wylde']","['Walt Disney Pictures', 'Panay Films']",1,['US'],['en'],tt2183034,5.904,516
1,2015-07-10,Self/less,26000000,31807156,117,"['Science Fiction', 'Mystery', 'Thriller', 'Action']",An extremely wealthy elderly man dying from cancer undergoes a radical medical procedure that transfers his consciousness to the body of a healthy young man but everything may not be as good as it seems when he starts to uncover the mystery of the body's origins and the secret organization that will kill to keep its secrets.,God Created Man. Man Created Immortality.,['Tarsem Singh'],"['Ryan Reynolds', 'Ben Kingsley', 'Natalie Martinez', 'Matthew Goode', 'Michelle Dockery', 'Melora Hardin', 'Victor Garber', 'Sam Page', 'Derek Luke', 'Mariana Paola Vicente', 'Jaynee-Lynne Kinchen', 'Brendan McCarthy', 'Thomas Francis Murphy', 'Sandra Ellis Lafferty', 'Emily Tremaine', 'Griff Furst', 'Cedric Palmisano', 'Tom Waite', 'Douglas M. Griffin', 'Marcus Lyle Brown', 'Teri Wyble', 'Gary Weeks', 'Kristin Erickson', 'Dakota Buchanan', 'Robert Harvey', 'Jimmy Gonzales', 'Jesica Ahlberg', 'Dacia Fernandez', 'Hannah Jelinovic', 'Ashley Laliberty', 'Anna Dudnik', 'Big Freedia', 'Antionique Price', 'Stephanie Bertrand', 'Shelby Skipper', 'Alvin Santana', 'Rashod Singleton', 'Keiton Crump', 'Clay Chamberlin', 'Julian Niccolini', 'Mariah Quintana', 'Steffie Grote', 'Claire McReynolds', 'Lola Phillips', 'Anne Speed', 'Katherine Grace Yeaton', 'Christopher Heskey', 'Dylan Lowe', 'Ronn Surels']","['Endgame Entertainment', 'Ram Bergman Productions']",1,['US'],['en'],tt2140379,6.403,2725
2,1950-05-26,The Big Hangover,1026000,1626000,82,['Comedy'],"A young law school graduate is hired by a prestigious firm, but he neglects to inform them he is allergic to even a single whiff of alcohol.",Van's New Girl - What a Dish!,['Norman Krasna'],"['Van Johnson', 'Elizabeth Taylor', 'Leon Ames', 'Gene Lockhart', 'Percy Waram', 'Fay Holden', 'Edgar Buchanan', 'Selena Royle', 'Rosemary DeCamp', 'Philip Ahn', 'Gordon Richards', 'Matt Moore', 'Pierre Watkin', 'Russell Hicks']",['Metro-Goldwyn-Mayer'],1,['US'],[],tt0042247,7.2,3
3,2014-07-17,The Purge: Anarchy,9000000,111928365,104,"['Horror', 'Thriller']","One night per year, the government sanctions a 12-hour period in which citizens can commit any crime they wish -- including murder -- without fear of punishment or imprisonment. Leo, a sergeant who lost his son, plans a vigilante mission of revenge during the mayhem. However, instead of a death-dealing avenger, he becomes the unexpected protector of four innocent strangers who desperately need his help if they are to survive the night.",Welcome to America where one night a year all crime is legal,['James DeMonaco'],"['Frank Grillo', 'Carmen Ejogo', 'Zach Gilford', 'Michael Kenneth Williams', 'Kiele Sanchez', 'Zoë Soul', 'Edwin Hodge', 'Justina Machado', 'John Beasley', 'Jack Conley', 'Noel Gugliemi', 'Castulo Guerra', 'Lakeith Stanfield', 'Roberta Valderrama', 'Niko Nicotera', 'Bel Hernandez', 'Lily Knight', 'Jasper Cole', 'Brandon Keener', 'Amy Price-Francis', 'Vick Sabitjian', 'Matt Lasky', 'Wiley B. Oscar', 'Nicholas Gonzalez', 'Chad Morgan', 'Judith McConnell', 'Adrian Sparks', 'Rick Chambers', 'Amy Paffrath', 'Dale Dye', 'Carla Jimenez', 'Brad Drake', 'Rowan Alexander', 'Roger Schueller', 'Branton Box', 'Brennan Feonix', 'Cindy Robinson', 'Alina Andrei', 'Tammie Baird', 'Chris Gann', 'Cortney Palm']","['Universal Pictures', 'Why Not Productions', 'Platinum Dunes', 'Blumhouse Productions', '5150 Action']",2,['US'],['en'],tt2975578,6.656,5736
4,2015-05-06,Spy,65000000,235666219,120,"['Action', 'Comedy', 'Crime']","A desk-bound CIA analyst volunteers to go undercover to infiltrate the world of a deadly arms dealer, and prevent diabolical global disaster.",One of the guys. One of the Spies.,['Paul Feig'],"['Melissa McCarthy', 'Rose Byrne', 'Miranda Hart', 'Allison Janney', 'Jason Statham', 'Jude Law', 'Bobby Cannavale', 'Peter Serafinowicz', 'Morena Baccarin', 'Raad Rawi', 'Jessica Chaffin', 'Sam Richardson', 'Katie Dippold', 'Jaime Pacheco', 'Romain Apelbaum', 'Richard Brake', 'Steve Bannos', 'Carlos Ponce', 'Will Yun Lee', 'Michael McDonald', 'Adam Ray', 'Lukács Bicskey', 'Attila Bardóczy', 'Julian Miller', 'Ed Kear', 'Nargis Fakhri', 'Andrey Danilko', 'Attila Árpa', 'Bálint Adorjáni', 'Jamie Denbo', 'Alessandro De Marco', 'Peter Linka', 'Zach Woods', 'Luca Fiorilli', 'Sergej Onopko', 'Yuri Buzzi', 'Dimitri Andreas', 'Mitch Silpa', 'Matt Devere', 'Péter Farkas', 'Björn Gustafsson', 'Ben Falcone', 'Kamarás Iván', 'Greta Csizmadia', 'Klaudia Halasi', '50 Cent', 'Zalán Takács', 'Dénes Bernáth', 'Zsolt Zágoni', 'Levente Törköly', 'Matt Mullins']","['Chernin Entertainment', 'TSG Entertainment', 'Feigco Entertainment']",1,['US'],"['de', 'en', 'fr', 'it']",tt3079380,6.827,5393
5,1989-11-10,Best of the Best,5000000,1700000,97,['Action'],A team from the United States is going to compete against Korea in a Tae Kwon Do tournament. The team consists of fighters from all over the country--can they overcome their rivalry and work together to win?,A team is not a team if you don't give a damn about each other.,['Robert Radler'],"['Eric Roberts', 'Phillip Rhee', 'James Earl Jones', 'Sally Kirkland', 'Chris Penn', 'John Dye', 'David Agresta', 'Tom Everett', 'Louise Fletcher', 'John P. Ryan', 'Edan Gross', 'Simon Rhee', 'Master Hee Il Cho', 'James Lew', 'Ken Nagayama', 'Ho Sik Pak', 'Dae Kyu Chang', 'Cal Bartlett', 'Edward Bunker', 'Bob Telford', 'Samantha Scully', 'Adrianne Sachs', 'Melanie Kinnaman', 'Kane Hodder', 'Pete Antico', 'Michael E. Burgess', 'Fabian Carrillo', 'Mylo Ironbear', 'Ahmad Rashād']","['SVS Films', 'The Movie Group']",4,['US'],"['en', 'ko']",tt0096913,6.522,224
