,date,titre,budget,recette,duree,genres,synopsis,tagline,realisateur,casting,compagnies_production,suite,production_countries,langues,imdb_id,vote_average,vote_count
0,2000-12-02,തെങ്കാശിപ്പട്ടണം,640000,2,150,"['Comedy', 'Drama', 'Family']","Kannan and Dasappan are two rowdies in their village. Shathrugnan. a newcomer, is in love with Dasappan' s sister, Devootty, but she is not interested in him. Shathru joins Kannan's and Dasappan's firm, KD & Company, as the manager, in an attempt to win the love of Devootty. KD & Company keeps as hostage a music troupe who comes to their village to perform. The main singer of that troupe, Sangeetha, gets expelled from her home because of this and Kannan and Dasappan give her refuge, at the insistence of Devootty.  Meenakshi and Kannan are in love. But due to some misunderstanding, Dasappan falls in love with Meenakshi and Sangeetha falls in love with Kannan. Shathru takes the responsibility of sorting it out and linking Dasappan with Sangeetha. In the chaos and confusions that follows, he manages to be victorious and wins his lady love Devootty too.",,"['Raffi', 'Mecartin']","['Suresh Gopi', 'Lal', 'Dileep', 'Samyuktha Varma', 'Geethu Mohandas', 'Kavya Madhavan', 'Salim Kumar', 'George']",['Lal Creations'],1,['IN'],['ml'],tt0334482,7.667,15
1,2007-03-02,The സ്പീഡ് Track,618000,867000,117,"['Comedy', 'Action', 'Romance']","The movie tells the story of Arjun, a young athlete, who is all set to create history with his speed and spirits.",,['S.L Puram Jayasurya'],"['Dileep', 'Gajala', 'Madhu Warrier', 'Riyaz Khan', 'Jagathy Sreekumar', 'Vijayaraghavan', 'Captain Raju', 'Salim Kumar', 'Kalaranjini', 'Saikumar', 'Yadu Krishnan', 'Jaffer Idukki']",['Varnachithra Bigscreen'],1,['IN'],['ml'],tt0482961,6.2,3
2,2006-07-07,Chess,500000,1000000,122,"['Action', 'Comedy', 'Drama']",Chess is a story of young man who is thrown into the deep end where sharks of the society swim with nonchalance.,The Brilliant Game,['Raj Babu'],"['Dileep', 'Bhavana', 'Salim Kumar', 'Ashish Vidhyarthi', 'Harisree Ashokan', 'Kalasala Babu', 'Vijayaraghavan', 'Bheeman Raghu', 'Baburaj', 'Suresh Krishna', 'Jagathy Sreekumar', 'Janardhanan', 'Saikumar', 'Madhupal']",['Super Star Films'],1,['IN'],['ml'],tt0842001,4.8,6
3,2014-07-25,Lucy,40000000,458863600,89,"['Action', 'Science Fiction']","A woman, accidentally caught in a dark deal, turns the tables on her captors and transforms into a merciless warrior evolved beyond human logic.",The average person uses 10% of their brain capacity. Imagine what she could do with 100%.,['Luc Besson'],"['Scarlett Johansson', 'Morgan Freeman', 'Choi Min-sik', 'Amr Waked', 'Julian Rhind-Tutt', 'Pilou Asbæk', 'Lio Tipton', 'Shin Yoo-ram', 'Seo Chong-ju', 'Nicolas Phongpheth', 'Paul Lefèvre', 'Jan Oliver Schroeder', 'Luca Angeletti', 'Pierre Poirot', 'Pierre Grammont', 'Bertrand Quoniam', 'Loïc Brabant', 'Pascal Loison', 'Pierre Gérard', 'Isabelle Cagnat', 'Frédéric Chau', 'Claire Tran', 'François Legrand', 'Bob Martet', 'Alexis Rangheard', 'Tonio Descanvelle', 'Julien Personnaz', 'Christophe Lavalle', 'Renaud Cestre', 'Thibault Segouin', 'Matthew Bravais', 'Claire Zaniolo', 'Alessandro Giallocosta', 'Wolfgang Pissors', 'Sifan Shao', 'Paul Chan', 'Chou Chung-Wei', 'Huan Jhih-Cyuan', 'I. Cheng-Sheng', 'Frank Ma', 'Tseng Sheng-En', 'Liu Hsieh-Min', 'Sandra Abouav', 'Abel Aboualiten', 'Ken Lin', 'Hsing Feng', 'Hao-Hsiang Hsu', ""Laura D'Arista"", 'Eunyul Hong', 'Samuel Churin', 'Mason Lee', 'Mohammad Aslam Ansari', 'Kevin Dust', 'Diego Llano', 'Timothy Reevis', 'Jaysson Reyes De La Cruz', 'German Tintaya Mamani', 'Kanneti Sawe Han', 'Cédric Chevalme']","['Canal+', 'TF1 Films Production', 'EuropaCorp', 'Ciné+']",1,['FR'],"['zh', 'en', 'fr', 'es', 'ko']",tt2872732,6.4,14440
4,2014-04-11,நான் சிகப்பு மனிதன்,1200000,2800000,161,"['Action', 'Drama']","Indran suffers from narcolepsy, a sleep disorder that makes him fall asleep at the slightest excitement. He meets Meera and they fall in love but one night, they are attacked by unknown persons. Indran panics and goes into sleep, while Meera is raped. Indran must rely hard on his wits to find the assailants and overcome his condition get his revenge.",,['Thiru'],"['Vishal Krishna', 'Lakshmi Menon', 'Iniya', 'Saranya Ponvannan', 'Jayaprakash', 'Sunder Ramu', 'Jagan', 'Pyramid Natarajan', 'Rishi', 'Seenu', 'V. I. S. Jayapalan']","['UTV Motion Pictures', 'Vishal Film Factory']",1,['IN'],['ta'],tt3569788,6.4,15
