,date,titre,budget,recette,duree,genres,synopsis,tagline,realisateur,casting,compagnies_production,suite,production_countries,langues,imdb_id,vote_average,vote_count
0,2015-12-25,Daddy's Home,50000000,242786137,96,['Comedy'],"The story of a mild-mannered radio executive who strives to become the best stepdad ever to his wife's two children, but complications ensue when their freewheeling, freeloading real father arrives, forcing stepdad to compete for the affection of the kids.",Choose your Daddy,['Sean Anders'],"['Will Ferrell', 'Mark Wahlberg', 'Linda Cardellini', 'Thomas Haden Church', 'Scarlett Estevez', 'Owen Vaccaro', 'Bobby Cannavale', 'Hannibal Buress', 'John Cena', 'Alessandra Ambrosio', 'Didi Costine', 'Bill Burr', 'Jamie Denbo', 'LaMonica Garrett', 'Paul Scheer', 'Kerry Cahill', 'Mark L. Young', 'Olivia Renee Dupepe', 'Billy Slaughter', 'James Harlon Palmer', 'Matthew Paul Martinez', 'Riley Ann Corbin', 'LaJessie Smith', 'Billy 4 Johnston', 'Nathaniel Woolsey', 'Kobe Bryant', 'Hector Presedo', 'Zora Ngwaba', 'Beau Joseph Faucheaux', ""D'Vitrius Shirley-Davie"", 'Joshua Probus', 'Caleb J. Middlebrooks', 'Cooper Dodson', 'Joel K. Berger', 'Grayson Thorne Kilpatrick', 'Alex Wayne Boutte', 'JoAnna Wortham', 'Allen Zwolle', 'Abigail C Addison', 'Chris Angerdina', 'Michael D. Anglin', 'Sue-Lynn Ansari', 'John L. Armijo', 'Saber Bankson', 'Charles Barber', 'Nazeema Bartek', 'Tony Beard', 'Lukas Bennett', 'Eric Berris', 'Tracy Brotherton', 'Brady Calhoun', 'Dave Davis']","['Paramount', 'Gary Sanchez Productions', 'Red Granite Pictures']",1,['US'],['en'],tt1528854,6.259,2742
1,2008-04-16,Buddha Wild: Monk in a Hut,25000,275000,60,"['Adventure', 'Comedy', 'Documentary', 'Family']","Buddhist monks open up about the joys and challenges of living out the precepts of the Buddha as a full-time vocation. Controversies swirling within modern monastic Buddhism are examined, from celibacy and the role of women to racism and concerns about the environment.",,['Anna Wilding'],"['Vanta Kaur', 'Len West', 'Tenzin Gyatso', 'Phra Sathuwanda', 'Chaip Saissard', 'Phramah Somchai', 'Phra Visechat', 'Phram Sayan', 'Prahamaha Veera', 'Bhante Somaratana', 'Phra Kannoong', 'Ashley Kinsman', 'Lucy Gaudin', 'Sally Gaudin', 'Dan Cousins', 'Supawadee']",['Carpe Diem Films'],1,"['LK', 'NZ', 'US', 'TH']","['en', 'sa', 'th']",tt0449570,10.0,1
2,2015-12-24,Joy,60000000,101134059,124,"['Drama', 'Comedy']",A story based on the life of a struggling Long Island single mom who became one of the country's most successful entrepreneurs.,,['David O. Russell'],"['Jennifer Lawrence', 'Robert De Niro', 'Bradley Cooper', 'Edgar Ramírez', 'Diane Ladd', 'Virginia Madsen', 'Isabella Rossellini', 'Dascha Polanco', 'Elisabeth Röhm', 'Susan Lucci', 'Laura Wright', 'Maurice Benard', 'Donna Mills', 'Jimmy Jean-Louis', 'Ken Howard', 'Ray De La Paz', 'John Enos III', 'Marianne Leone Cooper', 'Melissa Rivers', 'Drena De Niro', 'Isabella Crovetti', 'Emily Nuñez', 'Madison Wolfe', 'Aundrea Gadsby', 'Gia Gadsby', 'Tomas Elizondo', 'Zeke Elizondo', 'Alexander Cook', 'Suzanne Frazier Wilkins', 'Luisa Maria Badaracco', 'Jamell Washington', 'Will LeBow', 'Johnnie McQuarley', 'Pedro Martinez Campos', 'Carlos Sala Valencia', 'Alvaro Benavides', 'Edgar Pantoja Aleman', 'Shonda Schilling', 'Grant Schilling', 'Gary Zahakos', 'Robert Sabino', 'Mateo Gómez', 'Marcela Jaramillo', 'Jim Frangione', 'Melissa McMeekin', 'Erica McDermott', 'Michele Egerton', 'Marianne Bayard', 'Fiore Leo', 'Steven DeMarco', 'Collin Knight', 'Barbara Feeney', 'Damien Di Paola', 'Patsy Meck', 'Jeremiah Kissel', 'Dale Place', 'Mitchell Rosenwald', 'Thomas Matthews', 'Matthew Russell', 'Bates Wilder', 'Paul Herman', 'Christy Scott Cashman', 'Colleen Camp', 'Richard McElvain', 'Mark Nemeskal', 'Patrick Pitu', 'Michael DeMello', 'Ken Cheeseman', 'Daniel Bowen', 'Naheem Garcia', 'Raymond Alongi', 'Johnny Lee Davenport', 'Sonny Mirabella', 'Bill Thorpe', 'Sam Weisman', 'Jeff Avigian', 'Barry Primus', 'Eliana Adise', 'Calidore Robinson', 'Jasmine Brooke White']","['20th Century Fox', 'Fox 2000 Pictures', 'Davis Entertainment', 'Annapurna Pictures', 'TSG Entertainment']",1,['US'],"['es', 'en']",tt2446980,6.511,3687
3,1989-01-02,O Ônibus da Suruba,60000,200000,68,"['Comedy', 'Crime']","The trickster Smudge steals a bus at a gas station, abducts some employees and covers Brazil from São Paulo to Rio Grande do Sul in the vehicle, now renamed ""Coach of Suruba"" or ""Ônibus de Suruba"". Along the way, it forces the ""passengers"" to have sex.",,"['Renalto Alves', 'Sady Baby']","['X-Tayla', 'Irlanda Mem', 'Jerônimo Freire', 'Renalto Alves', 'Maria Gasolina', 'Feijoada', 'Raimunda Rodela']",['Produções Cinematográficas Sady'],1,['BR'],['pt'],tt15282122,5.1,4
4,2015-10-21,The Last Witch Hunter,90000000,146936910,106,"['Fantasy', 'Action', 'Adventure']","The modern world holds many secrets, but by far the most astounding is that witches still live among us; vicious supernatural creatures intent on unleashing the Black Death upon the world and putting an end to the human race once and for all. Armies of witch hunters have battled this unnatural enemy for centuries, including Kaulder, a valiant warrior who many years ago slayed the all-powerful Witch Queen, decimating her followers in the process. In the moments right before her death, the Queen cursed Kaulder with immortality, forever separating him from his beloved wife and daughter. Today, Kaulder is the last living hunter who has spent his immortal life tracking down rogue witches, all the while yearning for his long-lost family.",Live forever. Hunt forever.,['Breck Eisner'],"['Vin Diesel', 'Rose Leslie', 'Elijah Wood', 'Ólafur Darri Ólafsson', 'Rena Owen', 'Julie Engelbrecht', 'Michael Caine', 'Joseph Gilgun', 'Isaach De Bankolé', 'Sloane Coombs', 'Dawn Olivieri', 'Inbar Lavi', 'Bex Taylor-Klaus', 'Aimee Carrero', 'Armani Jackson', 'Samara Lee', 'Kurt Angle', 'David Whalen', 'Jack Erdie', 'Toussaint Raphael Abessolo', 'Allegra Carpenter', 'Tracey Turner', 'Laura C. Smiley', 'Eric Rasmussen', 'Billy Hepfinger', 'Tamica White', 'Joseph Rittenhouse', 'Keein Brown', 'Tracey D. Turner', 'Lotte Verbeek']","['Summit Entertainment', 'One Race', 'Lionsgate', 'Atmosphere Entertainment MM', 'Goldmann Pictures', 'NeoReel', 'Aperture Entertainment', 'TIK Films']",1,"['HK', 'US']",['en'],tt1618442,5.936,3184
5,2017-10-13,Geostorm,120000000,221600160,109,"['Action', 'Science Fiction', 'Thriller']","After an unprecedented series of natural disasters threatened the planet, the world's leaders came together to create an intricate network of satellites to control the global climate and keep everyone safe. But now, something has gone wrong: the system built to protect Earth is attacking it, and it becomes a race against the clock to uncover the real threat before a worldwide geostorm wipes out everything and everyone along with it.",Some things were never meant to be controlled.,['Dean Devlin'],"['Gerard Butler', 'Alexandra Maria Lara', 'Jim Sturgess', 'Abbie Cornish', 'Ed Harris', 'Andy García', 'Zazie Beetz', 'Eugenio Derbez', 'Robert Sheehan', 'David S. Lee', 'Talitha Bateman', 'Daniel Wu', 'Adepero Oduye', 'Amr Waked', 'Richard Schiff', 'Billy Slaughter', 'Tom Choi', 'Mare Winningham', 'Daniella Garcia-Lorido', 'Ritchie Montgomery', 'Judd Lormand', 'Corey Mendell Parker', 'Catherine Ashton', 'Arnold Chun', 'Randall Newsome', 'Sean Paul Braud', 'Julia Denton', 'Carlos Antonio', 'Joe Drago', 'Douglas M. Griffin', 'Blake Burt', 'Derek Roberts', 'Randy Havens', 'Edgar Leza', 'Ricardo Vargas']","['Warner Bros. Pictures', 'Electric Entertainment', 'RatPac Entertainment', 'Skydance Media', 'Stereo D', 'Twisted Media']",1,['US'],['en'],tt1981128,6.083,4075
6,2017-05-10,King Arthur: Legend of the Sword,175000000,148675066,126,"['Action', 'Drama', 'Fantasy']","When the child Arthur’s father is murdered, Vortigern, Arthur’s uncle, seizes the crown. Robbed of his birthright and with no idea who he truly is, Arthur comes up the hard way in the back alleys of the city. But once he pulls the sword Excalibur from the stone, his life is turned upside down and he is forced to acknowledge his true legacy... whether he likes it or not.",From nothing comes a King,['Guy Ritchie'],"['Charlie Hunnam', 'Astrid Bergès-Frisbey', 'Jude Law', 'Djimon Hounsou', 'Eric Bana', 'Aidan Gillen', 'Freddie Fox', 'Craig McGinlay', 'Mikael Persbrandt', 'Tom Wu', 'Kingsley Ben-Adir', 'Neil Maskell', 'Annabelle Wallis', 'Peter Ferdinando', 'Geoff Bell', 'Katie McGrath', 'Lorraine Bruce', 'Eline Powell', 'Hermione Corfield', 'Zac Barker', 'Oliver Barker', 'Poppy Delevingne', 'Millie Brady', 'Nicola Wren', 'Wil Coban', 'Bleu Landau', 'Jacqui Ainsley', 'Georgina Campbell', 'Rob Knighton', 'Michael Hadley', 'David Beckham', 'Alan Turkington', 'Michael McElhatton', 'Charlie Rawes', 'James Warren', 'Ellie Graham', 'Kamil Lemieszewski', 'Kalle Hennie', 'Peter Guinness', 'Mark Umbers', 'Adrian Bouchet', 'Florence Bell', 'Anna Brooks Beckman', 'Cordelia Bugeja', 'Rebecca Calder', 'Lee Nicholas Harris', 'Gintare Beinoraviciute', 'Alice E. Mayer', 'Claira Watson Parr', 'Alphonso Austin', 'Rudy Barrow', 'Daniel Stisen', 'Joel Bryant', 'Dacio Caballero', 'Lucy Chappell', 'Jamie B. Chambers', 'Pedro Caxade', 'Nick Cornwall', 'Steve Barnett', 'Steen Young', 'Jason Lines']","['Village Roadshow Pictures', 'Warner Bros. Pictures', 'Weed Road Pictures', 'Wigram Productions', 'Safehouse Pictures']",1,['US'],['en'],tt1972591,6.526,5043
7,2017-09-21,The Lego Ninjago Movie,70000000,123081555,101,"['Family', 'Animation', 'Action', 'Adventure', 'Comedy']","Six young ninjas are tasked with defending their island home of Ninjago. By night, they’re gifted warriors using their skill and awesome fleet of vehicles to fight villains and monsters. By day, they’re ordinary teens struggling against their greatest enemy....high school.",Find your inner piece.,"['Paul Fisher', 'Charlie Bean', 'Bob Logan']","['Dave Franco', 'Justin Theroux', 'Fred Armisen', 'Abbi Jacobson', 'Olivia Munn', 'Kumail Nanjiani', 'Michael Peña', 'Zach Woods', 'Jackie Chan', 'Randall Park', 'Retta', 'Charlyne Yi', 'Chris Hardwick', 'Robin Roberts', 'Michael Strahan', 'David Burrows', 'Ali Wong', 'Todd Hansen', 'Doug Nicholas', 'Pearl', 'Ruby', 'Constance Wu']","['Warner Bros. Pictures', 'Vertigo Entertainment', 'Lin Pictures', 'LEGO', 'Warner Animation Group', 'Lord Miller Productions']",1,"['DK', 'US']",['en'],tt3014284,6.486,840
8,2016-12-21,Passengers,110000000,303144152,116,"['Drama', 'Romance', 'Science Fiction']","A spacecraft traveling to a distant colony planet and transporting thousands of people has a malfunction in its sleep chambers. As a result, two passengers are awakened 90 years early.",There is a reason they woke up.,['Morten Tyldum'],"['Chris Pratt', 'Jennifer Lawrence', 'Michael Sheen', 'Laurence Fishburne', 'Andy García', 'Aurora Perrineau', 'Kristin Brock', 'Julee Cerda', 'Fred Melamed', 'Matt Corboy', 'Vince Foster', 'Kara Michele Wilder', 'Conor Brophy', 'Alpha Takahashi', 'Matthew Wolf', 'Jean-Michel Richaud', 'Curtis Grecco', 'Joy Spears', 'Lauren Farmer', 'Tom Ferrari', 'Emerald Mayne', 'Quansae Rutledge', 'Desmond Reid', 'Chris Edgerly', 'Jesus Mendoza', 'Kimberly Battista', 'Inder Kumar', 'Ivana Vitomir', 'Shelby Taylor Mullins', 'Kevin Tan', 'Robert Larriviere', 'Nazanin Boniadi', 'Marie Burke']","['Columbia Pictures', 'Village Roadshow Pictures', 'Original Film', 'Company Films', 'Start Motion Pictures', 'LStar Capital', 'Wanda Pictures']",1,['US'],['en'],tt1355644,6.917,11743
