,date,titre,budget,recette,duree,genres,synopsis,tagline,realisateur,casting,compagnies_production,suite,production_countries,langues,imdb_id,vote_average,vote_count
0,1956-03-28,Kalbimin Şarkısı,55000,100000,87,"['Drama', 'Romance']",,,['Lütfi Ömer Akad'],"['Münir Özkul', 'Nubar Terziyan', 'Altan Karındaş', 'Sezer Sezin', 'Kenan Artun', 'Deniz Tanyeli', 'Muammer Gözalan', 'Celal Gökkaya', 'Ayten Güvenç', 'Güler Kardeşler', 'Vahi Öz', 'Faik Coşkun', 'Hasan Ceylan', 'Niyazi Vanlı', 'Adalet Cimcoz', 'Hayri Esen']",['Lale Film'],1,['TR'],['tr'],tt0143331,8.5,2
1,2016-04-07,Criminal,31500000,14708696,113,"['Action', 'Crime', 'Science Fiction']","CIA Agent Bill Pope is on a mission to track down a shadowy hacker named 'The Dutchman'. When he gets mysteriously killed, an experimental procedure transfers his memories into a dangerous ex-convict. When he wakes up Pope's memories, his mission is to eliminate The Dutchman before the hacker launches ICBMs and starts World War III.",The mission is in the memories.,['Ariel Vromen'],"['Ryan Reynolds', 'Kevin Costner', 'Gary Oldman', 'Tommy Lee Jones', 'Gal Gadot', 'Alice Eve', 'Michael Pitt', 'Jordi Mollà', 'Antje Traue', 'Scott Adkins', 'Amaury Nolasco', 'Danny Webb', 'Colin Salmon', 'Lara Decaro', 'Freddy Bosche', 'Emmanuel Imani', 'Harry Hepple', 'Doug Cockle', 'Steve Nicolson', 'Sope Dirisu', 'Gisella Marengo', 'Mark Kempner', 'Michael Bodie', 'Joshua James', 'Samantha Coughlan', 'David Avery', 'Joe Fidler', 'Michael Webber', 'Katharine Gwen', 'Richard Alan Reid', 'Kelly Clare', 'Joanna Brookes', 'Matthew Steer', 'Andrew Byron', 'Elizabeth Ross', 'James Richard Marshall', 'Henry Garrett', 'Tim Woodward', 'Lotte Spring Rice', 'Nathan Osgood', 'Sarah Middleton', 'Dragos Savulescu', 'Tamer Doghem', 'Priyanga Burford', 'Diana Dimitrovici', 'Amina Zia', 'Rio Fredrika Debolla', 'Steven Brand', 'Natalie Marie Ames', 'Piers Morgan', 'Luca Giorgio Maggiora', 'Mark Rhino Smith', 'Louis Tamone', 'Sophie Ross', ""Samuel Turner O'Toole"", 'Mark Underwood', 'Ian Burfield', 'Natalie Burn', 'Jamie B. Chambers', 'Michael Chapman', 'Anastasia Harrold', 'Daniel Westwood', 'Robert Davi']","['Millennium Films', 'Lionsgate', 'BenderSpink', 'Fipex Holding', 'Campbell Grobman Films', 'Criminal Productions']",1,"['GB', 'US']",['en'],tt3014866,6.123,1492
2,2019-01-25,Iron Sky: The Coming Race,21000000,400900,93,"['Action', 'Comedy', 'Fantasy', 'Science Fiction', 'Adventure']","Twenty years after the events of Iron Sky, the former Nazi Moonbase has become the last refuge of mankind. Earth was devastated by a nuclear war, but buried deep under the wasteland lies a power that could save the last of humanity - or destroy it once and for all. An old enemy leads our heroes on an adventure into the Hollow Earth. To save humanity, they must fight the Vril, an ancient shapeshifting reptilian race and their army of dinosaurs.",Let's make Earth great again,['Timo Vuorensola'],"['Lara Rossi', 'Vladimir Burlakov', 'Kit Dale', 'Julia Dietze', 'Stephanie Paul', 'Tom Green', 'Udo Kier', 'John Flanders', 'James Quinn', 'Emily Atack', 'Martin Swabey', 'Pierce Nathan-Calvin Baechler', 'Christoph Drobig', 'Edward Judge', 'Kari Berg', 'Victor Au', 'Vasco De Beukelaer', 'Muya Lubambu Tshinioka', 'Antoine Plaisant', 'Amanda Wolzak', 'Francesco Italiano', 'Duta Skhirtladze', 'Jukka Hildén', 'Abbas Shirafkan', 'Kari Ketonen', 'Hon Ping Tang', 'Lloyd Li', 'Gaëtan Wenders', 'Alexander Moens', 'Anabel Lopez', 'Vincent Eaton', 'Jan Debski', 'Zana Salobir']","['27 Films Production', 'Potemkino', 'Iron sky universe']",2,"['FI', 'DE']",['en'],tt3038708,5.15,284
3,2016-09-15,Snowden,40000000,37357216,134,"['Drama', 'History', 'Crime', 'Thriller']",CIA employee Edward Snowden leaks thousands of classified documents to the press.,The only safe place is on the run.,['Oliver Stone'],"['Joseph Gordon-Levitt', 'Shailene Woodley', 'Melissa Leo', 'Zachary Quinto', 'Tom Wilkinson', 'Scott Eastwood', 'Timothy Olyphant', 'Ben Schnetzer', 'Lakeith Stanfield', 'Rhys Ifans', 'Nicolas Cage', 'Joely Richardson', 'Jaymes Butler', 'Robert Firth', 'Ben Chaplin', 'Bhasker Patel', 'Edward Snowden', 'Christy Meyer', 'Gregory Schwabe', 'Patrick Joseph Byrnes', 'Jamie Hodge', 'Mathangi Ray', 'Alan Rusbridger', 'Stephanie Simbeck', 'Logan Marshall-Green', 'Demetri Goritsas', 'Rachel Handshaw', 'Christian Contreras', 'Parker Sawyers', 'Michael Benz', 'Ken Thomas', 'Nicholas Rowe', 'Erol Sander', 'Eric Kofi Abrefa', 'Stanley I. Walker Jr.', 'Olga Koda', 'Alexandra Adomaitis', 'Andreas Dubois', 'Barack Obama', 'Osama bin Laden', 'Hugo Chávez', 'Hillary Clinton', 'Sarah Harrison', 'John Kerry', 'Michelle Obama', 'Vladimir Putin', 'Donald Trump', 'Al Sotto']","['Endgame Entertainment', 'Vendian Entertainment', 'KrautPack Entertainment']",1,"['DE', 'US']",['en'],tt3774114,7.098,3851
4,1969-01-01,Damga,55000,105000,95,['Drama'],,,['Ümit Utku'],"['Sadri Alışık', 'Zeynep Aksu', 'Süleyman Turan', 'Mümtaz Ener', 'Asım Nipton', 'Muzaffer Tema', 'Kuzey Vargın', 'Muazzez Arçay', 'Sadri Karan', 'Aydan Budak', 'Faik Coşkun', 'Tuncay Torun', 'Nusret Özkaya']",['Demir Film'],1,['TR'],['tr'],tt0433961,0.0,0
5,1999-10-08,Naturally Native,700000,10508,107,['Drama'],"Naturally Native follows the lives, loves, pain, joy and relationships of three sisters as they attempt to start their own business. Of American Indian ancestry, but adopted by white foster parents as young children, each sister has her own identity issues and each has chosen a very different career path. Now dedicated to starting a Native cosmetic business, they attempt to overcome obstacles both in the business world and in the home. A touching love story of family and culture, Naturally Native also interweaves a subtle, but strong wake-up call regarding the treatment of Native people in corporate America. Naturally Native also provides some insight into tribal infrastructure and gaming issues.","Sometimes When You're Going Home, It's Important To Know Where You've Come From...","['Valerie Red-Horse', 'Jennifer Wynne Farmer']","['Irene Bedard', 'Kimberly Guerrero', 'Pato Hoffmann', 'Mark Abbott', 'Collin Bernsen', 'Mary Kay Place', 'Carol Potter', 'Floyd Red Crow Westerman', 'Max Gail', 'Jerry Rector', 'Akima Castaneda', 'Kevin Cloud Brechner', 'Lowell Raven', 'Courtney Red-Horse Mohl']",['Red-Horse Native Productions'],1,['US'],['en'],tt0133117,6.0,1
6,2016-03-23,My Big Fat Greek Wedding 2,18000000,90632641,94,"['Romance', 'Comedy']","The continuing adventures of the Portokalos family. A follow-up to the 2002 comedy, ""My Big Fat Greek Wedding.""",People change. Greeks don't.,['Kirk Jones'],"['Nia Vardalos', 'John Corbett', 'Lainie Kazan', 'Michael Constantine', 'Elena Kampouris', 'Gia Carides', 'Andrea Martin', 'Bess Meisler', 'Louis Mandylor', 'Joey Fatone', 'Bruce Gray', 'Fiona Reid', 'Harper Gunn', 'Alex Wolff', 'John Stamos', 'Ian Gomez', 'Rita Wilson', 'Dave Reachill', 'Maxillian Grimm', 'Robert Bellissimo', 'Lauren Saarimaki', 'Constantine Vardalos', 'Jeff White', 'Julia Gartha', 'Maria Vacratsis', 'Chrissy Paraskevopoulos', 'Ashleigh Rains', 'Ethan Pugiotto', 'Theodore Paraskevopoulos', 'Kolton Stewart', 'Kathryn Haggis', 'Gerry Mendicino', 'Alec Stockwell', 'Sam Moses', 'Aniela Kurylo', 'Teresa Pavlinek', 'Kathryn Greenwood', 'Tannis Burnett', 'Hershel Blatt', 'Peter Tharos', 'Stavroula Logothettis', 'Leonidas Castrounis']","['Universal Pictures', 'Playtone', 'HBO Films', 'Gold Circle Films']",2,"['CA', 'US']","['en', 'el']",tt3760922,5.931,869
7,2016-06-15,Central Intelligence,50000000,216972543,107,"['Action', 'Comedy', 'Crime', 'Mystery']","After he reunites with an old pal through Facebook, a mild-mannered accountant is lured into the world of international espionage.",Saving the world takes a little Hart and a big Johnson.,['Rawson Marshall Thurber'],"['Kevin Hart', 'Dwayne Johnson', 'Amy Ryan', 'Aaron Paul', 'Danielle Nicolet', 'Ryan Hansen', 'Timothy John Smith', 'Megan Park', 'Thomas Kretschmann', 'Jason Bateman', 'Melissa McCarthy', 'Kumail Nanjiani', 'Brett Azar', 'Slaine', 'Anthony Molinari', 'Tim Griffin', 'Arthur Hiou', 'Joseph Oliveira', 'Dylan Boyack', 'Guy Nardulli', 'Sione Kelepi', 'Annie Kerins', 'Nate Richman', 'Robert Woo', 'Phil Reeves', 'Rickey Brown', 'Kyle Washburn', 'Michael Patrick Kane', 'Sarah K. Thurber', 'Lawrence Koplin', 'Mikaela Happas', 'Christopher Weigel', 'Timothy Carr']","['New Line Cinema', 'Universal Pictures', 'Warner Bros. Pictures', 'Perfect World Pictures', 'Bluegrass Films', 'Principato-Young Entertainment', 'RatPac Entertainment', 'Artists First']",1,['US'],['en'],tt1489889,6.4,5076
8,2016-10-13,The Accountant,44000000,155160045,128,"['Crime', 'Thriller', 'Drama']","As a math savant uncooks the books for a new client, the Treasury Department closes in on his activities and the body count starts to rise.",Calculate your choices.,"[""Gavin O'Connor""]","['Ben Affleck', 'Anna Kendrick', 'J.K. Simmons', 'Jon Bernthal', 'Jeffrey Tambor', 'Cynthia Addai-Robinson', 'John Lithgow', 'Jean Smart', 'Andy Umberger', 'Alison Wright', 'Daeg Faerch', 'Inder Kumar', 'Michael Beasley', 'Seth Lee', 'Jade Halley Bartlett', 'Angel Giuffria', 'Tait Fletcher', 'Jake Presley', 'Dennis Keiffer', 'Ron Yuan', 'Fernando Chien']","['Warner Bros. Pictures', 'Zero Gravity Management', 'Electric City Entertainment', 'RatPac Entertainment']",1,['US'],['en'],tt2140479,7.042,5248
