,date,titre,budget,recette,duree,genres,synopsis,tagline,realisateur,casting,compagnies_production,suite,production_countries,langues,imdb_id,vote_average,vote_count,status
0,2010-03-11,She's Out of My League,20000000,49779728,104,"['Romance', 'Comedy']","When he starts dating drop-dead gorgeous Molly, insecure airport security agent Kirk can't believe it. As his friends and family share their doubts about the relationship lasting, Kirk does everything he can to avoid losing Molly forever.","When she's this hot, You get one shot.",['Jim Field Smith'],"['Jay Baruchel', 'Alice Eve', 'T.J. Miller', 'Nate Torrence', 'Mike Vogel', 'Lindsay Sloane', 'Krysten Ritter', 'Kyle Bornheimer', 'Jessica St. Clair', 'Debra Jo Rupp', 'Adam LeFevre', 'Kim Shaw', 'Geoff Stults', 'Trevor Eve', 'Sharon Maughan', 'Hayes MacArthur', 'Jasika Nicole', 'Andrew Daly', 'Adam Tomei', 'Patrick Jordan', 'Tom Stoviak', 'Rick Applegate', 'Heather Morgan Leigh', 'Chuck Aber', 'Jason McCune', 'Yan Xi', 'Evan Alex Cole', 'Joseph F. Eberle', 'Phil Spano', 'Jeff Adams', 'Mike Gaffney', 'Sidney Crosby', 'Jon Knapp', 'Brian E. Stead', 'Christopher Nardizzi', 'Robert R. Bell', 'Renee Downing', 'Jillian Vitko', 'Gaynelle W. Sloman', 'Crystalann Jones', 'David Santiago', 'Joiel Bauschatz', 'Jim Fitzgerald', 'Mandy Ekman', 'Aaron Bernard', 'Robert Stull', 'Phil Nardozzi', 'Lorelei Mahoney', 'Tony Amen', 'Minda Briley', 'Stephanie Macdougall', 'Jack Davis', 'Christopher Mele', 'Sean P. McCarthy', 'Jonathan Eldell', 'Jackie Evancho']","['DreamWorks Pictures', 'Mosaic']",1,['US'],['en'],tt0815236,6.38,1747,Released
1,1993-08-20,King of the Hill,8000000,1214231,103,"['Drama', 'History']","Based on the Depression-era bildungsroman memoir of writer A. E. Hotchner, the film follows the story of a boy struggling to survive on his own in a hotel in St. Louis after his mother is committed to a sanatorium with tuberculosis. His father, a German immigrant and traveling salesman working for the Hamilton Watch Company, is off on long trips from which the boy cannot be certain he will return.","When the world turns upside down, the trick is coming out on top.",['Steven Soderbergh'],"['Jesse Bradford', 'Jeroen Krabbé', 'Lisa Eichhorn', 'Karen Allen', 'Spalding Gray', 'Elizabeth McGovern', 'Cameron Boyd', 'Adrien Brody', 'Joe Chrest', 'John McConnell', 'Amber Benson', 'Kristin Griffith', 'Chris Samples', 'Peggy Freisen', 'Katherine Heigl', 'John Durbin', 'Lauryn Hill', 'Jesse Zeigler', 'Remak Ramsay', 'Fred Cherrick', 'Joseph Moynihan', 'Don Richard', 'Masaharu Takano', 'Craig Hawksley', 'Aelred Rosser', 'Jason Feiner', 'Jared Joplin', 'David Jensen', 'Harry Governick', 'Sarah Mermelstein', 'Kimberly Jenkins', 'Gabriel Levinson', 'Ron Vawter', 'Christopher Meister', 'Richard Alan Nichols', 'Matthew Terry']","['Gramercy Pictures', 'Wildwood Enterprises', 'Bona Fide Productions']",1,['US'],['en'],tt0107322,6.894,127,Released
2,1985-08-23,Warning Sign,707990,1918117,99,"['Drama', 'Science Fiction', 'Thriller']",An accident occurs in an ultra-secret government biological weapons laboratory spreading a sinister bacteria.,,[],"['Sam Waterston', 'Kathleen Quinlan', 'Yaphet Kotto', 'Jeffrey DeMunn', 'Richard Dysart', 'G.W. Bailey', 'Jerry Hardin', 'Rick Rossovich', 'Cynthia Carle', 'Scott Paulin', 'Kavi Raz', 'Keith Szarabajka', 'J. Patrick McNamara', 'Tom McFadden', 'Jack Thibeau', 'Kyle T. Heffner', 'Meshach Taylor', 'Lori Hallier', 'Bernard Behrens']","['20th Century Fox', 'SLM Production Group']",1,['US'],['en'],tt0090293,6.2,48,Released
3,2009-05-14,Budapeste,230000,415555,113,['Drama'],"José Costa is a Brazilian ghost writer. Returning from a ghost writers convention his airplane is rerouted to Budapest. His life is also rerouted when he meets Krista and with her help, learns ""the only language in the world which, according to the tongue-wagers, the devil respects.",,[],"['Leonardo Medeiros', 'Gabriella Hámori', 'Giovanna Antonelli', 'Débora Nascimento']","['Eurofilm Stúdió', 'Stopline', 'Nexus Cinema e Vídeo']",1,"['BR', 'HU', 'PT']","['fr', 'hu', 'pt']",tt1180300,5.139,18,Released
4,2002-11-22,Ted Bundy,1200000,68716,99,"['Crime', 'Drama', 'Horror']","Docu-drama based on the life of Ted Bundy, a serial killer who killed at least 19 young women during the 1970's (though some sources say as many as 30 to 35 were murdered). Set from his college student years, to his first victims, his capture, escape from prison (twice), his final killing spree to his trial, conviction and execution.",Not every serial killer fits the profile.,[],"['Michael Reilly Burke', 'Boti Bliss', 'Tracey Walter', 'Deborah Offner', 'Tom Savini', 'Tiffany Shepis', 'Julianna McCarthy', 'Steffani Brass', 'Matt Hoffman', 'Phoebe Dollar', 'Marina Black', 'Alexa Jago', 'Jennifer Tisdale', 'Michael Santos', 'Eric DaRe', 'Melissa Schmidt', 'Orly Tepper', 'Susan Featherly', 'Alexa Nikolas', 'Jesse Rutherford', 'Katrina Miller']",['Incessant Barking Productions Inc.'],1,['US'],['en'],tt0284929,5.834,125,Released
5,1990-04-27,Spaced Invaders,3000000,15369573,100,"['Comedy', 'Family', 'Science Fiction']","A crew of Martians overhears a radio broadcast of Orson Welles' ""War of the Worlds"" coming from Earth, and, thinking the Martian fleet is attacking Earth, they land their broken-down ship in a backwater mid-American town. As luck would have it, they land on Halloween and get mistaken for trick-or-treaters. Comedy ensues as the Martians try to get taken seriously.",,['Patrick Read Johnson'],"['Royal Dano', 'Ariana Richards', 'J.J. Anderson', 'Gregg Berger', 'Wayne Alexander', 'Fred Applegate', 'Patrika Darbo', 'Tonya Williams', 'William Holmes', 'Kevin Thompson', 'Jimmy Briscoe', 'Tony Cox', 'Debbie Lee Carrington', 'Tommy Madden', 'Jeff Winkless', 'Bruce Lanoil', 'Joe Alaskey', 'Tony Pope']","['Touchstone Pictures', 'Silver Screen Partners IV']",1,['US'],['en'],tt0100666,4.898,59,Released
6,1938-09-01,You Can't Take It with You,1644736,7433101,126,"['Comedy', 'Drama', 'Romance']","Alice, the only relatively normal member of the eccentric Sycamore family, falls in love with Tony Kirby, but his wealthy banker father and snobbish mother strongly disapprove of the match. When the Kirbys are invited to dinner to become better acquainted with their future in-laws, things don't turn out the way Alice had hoped.",You'll love them all for giving you the swellest time you've ever had!,['Frank Capra'],"['Jean Arthur', 'James Stewart', 'Lionel Barrymore', 'Edward Arnold', 'Mischa Auer', 'Ann Miller', 'Spring Byington', 'Samuel S. Hinds', 'Donald Meek', 'H.B. Warner', 'Halliwell Hobbes', 'Dub Taylor', 'Mary Forbes', 'Lillian Yarbo', ""Eddie 'Rochester' Anderson"", 'Clarence Wilson', 'Josef Swickard', 'Ann Doran', 'Christian Rub', 'Bodil Rosing', 'Charles Lane', 'Harry Davenport', 'Irving Bacon', 'Ward Bond', 'James Burke', 'Eddy Chandler', 'Anne Cornwall', 'Nell Craig', 'Edgar Dearing', 'Pat Flaherty', 'Robert Greig', 'Kit Guard', 'John Hamilton', 'Edward Hearn', 'Russell Hicks', 'Edward Keane', 'Pert Kelton', 'Edwin Maxwell', 'Frank McLure', 'Charles McMurphy', 'James Millican', 'Edward Peil Sr.', 'Ian Wolfe', 'Eugene Anderson Jr', 'Stanley Andrews', 'William Arnold', 'Johnny Arthur', 'Frank Austin', 'Harry A. Bailey', 'Joseph E. Bernard', 'Beatrice Blinn', 'Charles Brinley', 'Beatrice Curtis', 'Betty Farrington', 'John Ince', 'Stella LeSaint', 'Margaret Mann', 'Tina Marshall', 'Eva McKenzie', 'Fred Parker', 'George C. Pearce', 'Ed Randolph', 'Frances Raymond', 'Bert Starkey', 'Dorothy Vernon', 'Bess Wade', 'Gladys Blake', 'Joe Bordeaux', 'Ralph Brooks', 'Stanley Brown', 'Gloria Browne', 'Wallis Clark', 'Chester Clute', 'Nick Copeland', 'Dick Curtis', ""Sidney D'Albrook"", 'Lew Davis', 'Lester Dorr', 'Jack Gardner', 'William Lally', 'Gene Morgan', 'Vernon Dent', 'Kay Deslys', 'Florence Dudley', 'Almeda Fowler', 'Alice Keating', ""Georgia O'Dell"", 'Dagmar Oakland', 'Rosemary Theby', 'Homer Dickenson', 'Oliver Eckhardt', 'Sterrett Ford', 'Jesse Graves', 'Bob Kortman', 'Ralph McCullough', 'Clive Morgan', 'Cy Schindell', 'Harry Semels', 'Ernest Shields', 'S.S. Simon', 'Victor Travis', 'Roland Dupree', 'Edward Earle', 'Jim Farley', 'Eddie Fetherston', 'James Flavin', 'Byron Foulger', 'Dick French', 'Carlton Griffin', 'Dick Rush', 'Bruce Sidney', 'Harry Stafford', 'Joe Geil', 'Billy Wolfstone', 'Chuck Hamilton', ""Oscar 'Dutch' Hendrian"", 'Harry Hollingsworth', 'Paul Irving', 'Boyd Irwin', 'Eddie Kane', 'Frank Mills', 'Bruce Mitchell', 'Wedgwood Nowell', 'Blanche Payson', 'Lee Phelps', 'Hilda Plowright', 'Doris Rankin', 'Ky Robinson', 'Frank Shannon', 'C.L. Sherwood', 'Edwin Stanley', 'Bert Stevens', 'Laura Treadwell', 'John Tyrrell', 'Walter Walker', 'Pierre Watkin', 'Pat West', 'Larry Wheat', 'Alex Woloshin', 'Bess Flowers']",['Columbia Pictures'],1,['US'],"['en', 'ru']",tt0030993,7.503,296,Released
7,2009-01-01,Peter and Vandy,500000,11276,78,"['Drama', 'Comedy', 'Romance']",Flashbacks and flash-forwards illustrate the rise and fall of a love affair between two New Yorkers.,A love story in disorder.,['Jay DiPietro'],"['Jason Ritter', 'Jess Weixler', 'Jesse L. Martin', 'Tracie Thoms', 'Noah Bean', 'David Rasche', 'Bobby Aiello', 'Bruce Altman', 'Dana Eskelson', 'Kristina Klebe', 'Lawrence Michael Levine', 'Zak Orth', 'Maryann Plunkett', 'Gregg Prosser']",['Paper Street Films'],1,[],['en'],tt1144551,6.2,18,Released
8,2010-02-26,अतिथि तुम कब जाओगे?,2100000,5400000,155,['Comedy'],The story of a happily married couple living in Mumbai whose lives take an interesting turn when a distant relative turns up unannounced at their doorstep from a far off village.,,[],"['Ajay Devgn', 'Konkona Sen Sharma', 'Paresh Rawal', 'Sanjay Mishra', 'Mukesh Tiwari', 'Satish Kaushik', 'Akhilendra Mishra', 'Viju Khote', 'Rohitash Gaud', 'Hrishikesh Joshi', 'Nataliya Kozhenova', 'Mac Mohan']","['Warner Bros. Pictures', 'Wide Frame Pictures', 'Panorama Studios']",1,['IN'],['hi'],tt1578116,6.3,38,Released
9,1996-10-31,Larger Than Life,30000000,8315693,93,['Comedy'],"Motivational Speaker Jack Corcoran is determined to get his career off the ground, but the biggest gigs he can get are the ones nobody wants. Then one day, he receives a telegram that his circus clown father has passed away, and has left a ""huge"" inheritance. When he gets there, he finds that his inheritance has come in the form of an elephant that was his father's pride and joy in circus acts. His main intention is to sell the pachyderm off. Jack must choose between loud and rude zookeeper Mo or attractive animal show owner Terry. As the two treks through the country Jack and the elephant develop a bond, and it changes his approach on life for the better.",He's got 5 days to go coast-to-coast. (There's just one BIG problem.),[],"['Bill Murray', 'Jeremy Piven', 'Janeane Garofalo', 'Pat Hingle', 'Linda Fiorentino', 'Matthew McConaughey', 'Keith David', 'Tracey Walter', 'Harve Presnell', 'Deon Aumaier', 'Anita Gillette', 'Jimmy Hart']","['United Artists', 'Trilogy Entertainment Group', 'Majestic Films International']",1,['US'],['en'],tt0116823,5.452,114,Released
10,1986-07-18,Vamp,3300000,4941117,93,"['Comedy', 'Horror']","Two fraternity pledges go to a sleazy bar in search of a stripper for their college friends, unaware it is occupied by vampires.",Ever have one of those nights?,[],"['Grace Jones', 'Chris Makepeace', 'Sandy Baron', 'Robert Rusler', 'Dedee Pfeiffer', 'Gedde Watanabe', 'Billy Drago', 'Brad Logan', 'Lisa Lyon', 'Jim Boyle', 'Larry Spinak', 'Eric Welch', 'Stuart Rogers', 'Gary Swailes', 'Ray Ballard', 'Paunita Nichols', 'Trudel Williams', 'Marlon McGann', 'Thomas Bellin', 'Tanya Papanicolas', 'Simmy Bow', 'Hy Pyke', 'Dar Robinson', 'Francie Swift', 'Tricia Brown']","['Balcor Film Investors', 'Planet Productions']",1,['US'],['en'],tt0092147,6.0,121,Released
11,1948-12-01,Adventures of Don Juan,3408000,4772000,110,"['Action', 'Adventure', 'Romance']",The adventures of the notorious Spanish Lothario Don Juan highlights Errol Flynn's swashbuckling and romantic antics.,History's Boldest Lover . . . Most Daring Swordsman ! !,['Vincent Sherman'],"['Errol Flynn', 'Viveca Lindfors', 'Robert Douglas', 'Alan Hale', 'Romney Brent', 'Ann Rutherford', 'Robert Warwick', 'Jerry Austin', 'Douglas Kennedy', 'Jean Shepherd', 'Mary Stuart', 'Helen Westcott', 'Fortunio Bonanova', 'Aubrey Mather', ""Una O'Connor"", 'Raymond Burr']",['Warner Bros. Pictures'],1,['US'],['en'],tt0040076,6.5,26,Released
12,1998-10-23,The Last Broadcast,900,12097,86,"['Horror', 'Mystery']","Bristling with equipment, two enthusiastic local access cable TV producers recruit an assistant and venture into a forest in search of the mythical and horrifying Jersey Devil. Days later, only one of the trio emerges. He becomes the prime suspect in the disappearances of the other two. However, a local filmmaker examines extensive footage found at the scene and arrives at a different conclusion.",What actually happened that night in the woods?,"['Stefan Avalos', 'Lance Weiler']","['David Beard', 'Jim Seward', 'Rein Clabbers', 'Michele Pulaski', 'Tom Brunt', 'Mark Rublee', 'A.D. Roso', 'Dale Worstall']",['FFM Productions'],1,['US'],['en'],tt0122143,5.043,82,Released
13,1997-10-10,Most Wanted,25000000,11838218,99,['Action'],"Sgt. James Dunn, who is wrongly accused of assassination of the officer he had a row with, is saved from death row and recruited for top-secret special operations squad led by Lt. Col Grant Casey. Their mission is to neutralize criminals who had avoided conventional law enforcement methods. On his first Mission, James is made the fall guy for the assassination of the first lady and everyone is loo",Sometimes the most patriotic thing a Marine can do...is disobey orders. From most honored to Most Wanted.,['David Hogan'],"['Keenen Ivory Wayans', 'Jon Voight', 'Jill Hennessy', 'Paul Sorvino', 'Eric Roberts', 'Robert Culp', 'Wolfgang Bodison', 'Eddie Velez', 'Donna Cherry', 'Rick Cramer', 'Robert Kotecki', 'Simon Baker', 'John Diehl', 'Kenn Whitaker', 'Michael Marich', 'Michael Milhoan', 'Lee de Broux', 'Tucker Smallwood', 'Ping Wu', 'Andy Hogan', 'Casey Lee', 'Mario Vitale', 'John Reidy']","['New Line Cinema', 'Ivory Way Productions']",1,['US'],"['en', 'pt']",tt0119709,5.276,85,Released
14,1997-01-09,Turbulence,55000000,11466088,100,"['Action', 'Thriller', 'Crime']","On a flight transporting dangerous convicts, murderer Ryan Weaver manages to break free and cause complete chaos throughout the plane. As various people on board fall victim to Weaver, it is ultimately down to flight attendant Teri Halloran to keep the aircraft from crashing, with on-ground support from an air traffic controller. While Halloran struggles to pilot the plane, Weaver continues to terrorize the surviving members of the crew.","If you weren't afraid of flying before, you will be now.",['Robert Butler'],"['Ray Liotta', 'Lauren Holly', 'Brendan Gleeson', 'Hector Elizondo', 'Rachel Ticotin', 'Ben Cross', 'Catherine Hicks', 'Jeffrey DeMunn', 'John Finn', 'Heidi Kling', 'J. Kenneth Campbell', 'James MacDonald', 'Grand L. Bush', 'Michael Harney', 'Don Dowe', 'Gordy Owens', 'Richard Hoyt-Miller', 'Michael Francis Kelly', 'Alan Bergmann', 'Danna Hansen', 'R.J. Knoll', 'Sondra Spriggs', 'Garrett M. Brown', 'Darryl Theirse', 'Fritz Mashimo', 'Tom Todoroff', 'Jeffrey Joseph', 'Dennis Redfield', 'Malachy McCourt', 'Gary Rodriguez', 'Callie Thorne', 'John Elsen', 'Bill Cross', 'Tannis Benedict', 'Scott Gurney', 'Cooper Huckabee', ""Kevin O'Rourke"", 'Scott Lawrence', 'Lara Bierner', 'Paxton Culpepper', 'Charles Gemmill', 'Paxton Culpepper', 'Billy Malone', 'L.A. Rothman', 'George Cheung']","['Metro-Goldwyn-Mayer', 'Rysher Entertainment']",1,['US'],['en'],tt0120390,5.351,188,Released
15,1985-12-25,Murphy's Romance,13000000,30867525,107,"['Comedy', 'Drama', 'Romance']","Emma, a divorced single mother seeking to start her life over, moves to a small town in Arizona. She befriends Murphy, the older local pharmacist, but things turn complicated when her ex-husband shows up.","Just when you think you've found the right guy, someone even worse comes along.",['Martin Ritt'],"['Sally Field', 'James Garner', 'Brian Kerwin', 'Corey Haim', 'Dennis Burkley', 'Georgann Johnson', 'Dortha Duckworth', 'Michael Prokopuk', 'Billy Ray Sharkey', 'Michael Crabtree', 'Anna Levine Thomson', 'Charles Lane', 'Bruce French', 'John C. Becher', 'Henry Slate', 'Tom Rankin', 'Peggy McCay', 'Carole King', 'Ted Gehring', 'C. Ray Cook', 'Eugene Cochran', 'Gene Blakely', 'Sherry Lynn Amorosi', 'Patricia Ann Willoughby', 'Mike Casper', 'Hugh Burritt', 'Michael Friel', 'Art Royer', 'Marian Gibson', 'Michael Hungerford', 'John Higgenbotham', 'Drasha Meyer', 'Ron Nix', 'Johnny Ray Anthony', 'Paul Pinnt']",['Columbia Pictures'],1,['US'],['en'],tt0089643,6.058,52,Released
16,2002-09-20,Men with Brooms,7500000,4245870,102,['Comedy'],"A decade ago, curler Chris Cutterdisappeared suddenly on the verge of stardom, dropping his curling stones to the bottom of a lake and leaving his fiancée, Julie Foley, at the altar. But when his former coach dies, Cutter returns home for the funeral and attempts to fulfill the man's last wishes. The team is reunited under Cutter's estranged dad, Gordon — himself a former curling star — for a final attempt at glory.",There's More Than One Way To Sweep a Woman Off Her Feet.,[],"['Paul Gross', 'Molly Parker', 'Leslie Nielsen', 'Polly Shannon', 'Peter Outerbridge', 'Michelle Nolden', 'Barbara Gordon', 'Connor Price', 'James Allodi', 'Jed Rees', 'Kari Matchett', 'Hannah Gross']",[],1,['CA'],['en'],tt0263734,5.152,23,Released
17,1991-05-17,Mannequin Two: On the Move,13000000,3752426,95,"['Fantasy', 'Comedy', 'Science Fiction', 'Romance']","Although Jason works as a department store clerk, he is also a reincarnated prince. Long ago, his beloved Jessie was snatched away from him by an evil wizard who used his powers to transform her into wooden statue. Now Jessie is in Jason's department store as a mannequin. When he encounters her, she awakens from her thousand-year sleep. They quickly revive their romance, but the evil wizard has been reincarnated as well, and he's up to no good.",A lively comedy about a living doll!,['Stewart Raffill'],"['Kristy Swanson', 'William Ragsdale', 'Meshach Taylor', 'Terry Kiser', 'Stuart Pankin', 'Cynthia Harris', 'Heather Henderson', 'Julie Foreman', 'John Edmondson', 'Phil Latella', 'Mark Gray', 'Erick Weiss', 'Jackye Roberts', 'John Casino', 'Laurie Wing', 'Julie Warder', 'James Reed', 'Joanne Bradley', 'Allelon Ruggiero', 'Sherry Wallén', 'Thom Christopher Warren', 'Wendy Worthington', 'Jim Nital', 'Ilene Norris', 'Hazel Pierce', 'Robert Hines', 'Daphne Lynn Stacey', 'Eva Andell', 'Michael J. Anderson', 'Dana Dewes', 'Celeste Russi', 'Chris Giannini', 'Cocò', 'Ellen Sabino', 'Christine Vanacore', 'Michael Stermel', 'Jerry Lyden', 'John Richman', 'Rocky Cathcart', 'Joe Milazzo', 'Matt Myers', 'Bud Seese', 'Cliff McMullen', 'Nancy Nicholson', 'Dana Edward Schmidt', 'Ereina Valencia', 'Felise Bagley', 'Irene Schoener', 'Christa Catakoso', 'Bey Brown', 'Jennifer McDonough', 'Luis Torres', 'Jody Ellis', 'Jose Rodriquez', 'Kerry I. Lacy', 'Billy Angell', 'David Ogden', 'Cynthia Savage', 'Kim McKee', 'Steve Kwasnik', 'George Pellegrino', 'Sonny Vellozzi', 'Kurt Leitner']","['20th Century Fox', 'Gladden Entertainment']",2,['US'],['en'],tt0102395,5.9,123,Released
18,1987-10-23,No Man's Land,8000000,2877571,106,"['Action', 'Drama', 'Crime']","A rookie cop goes undercover to infiltrate a gang of car thieves led by smooth and charming Ted. The rookie becomes too involved and starts to enjoy the thrill and lifestyle of the game, and becomes romanticly involved with the leaders sister.",Once you get a taste of the good life it's hard to let go. Even if your life depends on it.,['Peter Werner'],"['Charlie Sheen', 'D.B. Sweeney', 'Lara Harris', 'Randy Quaid', 'Bill Duke', 'R. D. Call', 'Arlen Dean Snyder', 'M. Emmet Walsh', 'Al Shannon', 'Bernie Pock', 'Clare Wren', 'Linda Carol', 'Danitza Kingsley', 'Peggy McCay', 'Robert Pierce', 'Claude Earl Jones', 'Florence Schauffler', 'Guy Boyd', 'George Dzundza', 'Brad Pitt']",[],1,['US'],['en'],tt0093638,6.125,76,Released
19,2010-02-26,तीन पत्ती,1000000,3900000,142,"['Drama', 'Thriller']",A professor uses the three-card game to prove his probability thesis. He involves some of his students on his research and later realizes it was a big mistake,An Equation That Changed All Other Equations,['Leena Yadav'],"['Amitabh Bachchan', 'Ben Kingsley', 'R. Madhavan', 'Shraddha Kapoor', 'Dhruv Ganesh', 'Raima Sen', 'Mahesh Manjrekar', 'Saira Mohan', 'Tinnu Anand', 'Vaibhav Talwar', 'Shakti Kapoor', 'Jackie Shroff', 'Ajay Devgn']","['Serendipity Films', 'Hinduja Ventures']",1,['IN'],"['en', 'hi']",tt1183917,4.1,7,Released
20,1991-03-15,The Perfect Weapon,10000000,14061361,87,"['Action', 'Drama', 'Crime']","Jeff, a young delinquent, is enrolled by his father in a kenpo school, in the hopes of teaching the boy some self-discipline. Years later, Jeff's mentor, Kim, is being threatened by one of the Korean mafia families. Jeff tries to help his old friend, but is too late to prevent Kim's death at the hands of an unknown hitman. Vowing revenge, Jeff takes on all of the families, using his martial arts skills to find the man who killed his friend.",No gun. No knife. No equal.,[],"['Jeff Speakman', 'John Dye', 'Mako', 'James Hong', 'Mariska Hargitay', 'Dante Basco', 'Beau Starr', 'Seth Sakai', 'Professor Toru Tanaka', 'Clyde Kusatsu', 'Cary-Hiroyuki Tagawa', 'Craig Ng', 'John Koyama', 'Roger Yuan', 'Shaun Shimoda', 'Yoshimi Imai', 'Ralph Ahn', 'Troy Fromin', 'Leland Sun', 'James Lew', 'Ray Sua', 'Leo Lee', 'Chris Tashima', 'Bill Saito', 'Al Leong', 'Branscombe Richmond', 'Carl Ciarfalio', 'Philip Tan', 'Thomas Rosales Jr.']",['Paramount'],1,['US'],"['en', 'ko']",tt0102655,6.2,89,Released
21,2008-08-22,The Errand of Angels,160000,195184,91,['Drama'],"Sister Rachel Taylor of Boise, Idaho is an eager young missionary of the LDS Church who has been sent on an 18-month long mission to Austria. Rachel finds herself having a hard time adjusting to her new cultural surroundings in the foreign country. Due to differences in opinion, she is also unable to get along with the companion missionary that was assigned to her by the church.",,['Christian Vuissa'],"['Erin Chambers', 'Rachel Emmers', 'Bettina Schwarz']",[],1,['US'],"['de', 'en']",tt1029285,6.8,4,Released
22,1933-10-06,I'm No Angel,225000,2850000,87,"['Comedy', 'Romance']","The bold Tira works as dancing beauty and lion tamer at a fair. Out of an urgent need of money, she agrees to a risky new number: she'll put her head into the lion's mouth! With this attraction, the circus makes it to New York and Tira can pursue her dearest occupation— flirting with rich men and accepting expensive presents.","""Come up and see me sometime - any time!""",['Wesley Ruggles'],"['Mae West', 'Cary Grant', 'Gregory Ratoff', 'Edward Arnold', 'Ralf Harolde', 'Kent Taylor', 'Gertrude Michael', 'Russell Hopton', 'Dorothy Peterson', 'William B. Davidson', 'Gertrude Howard', 'Libby Taylor', 'Walter Walker', 'Irving Pichel', 'Nat Pendleton', 'Hattie McDaniel', 'Nigel De Brulier', 'Ray Cooke', 'Larry Steers']",['Paramount'],1,['US'],['en'],tt0024166,6.355,31,Released
23,2009-10-14,The Descent: Part 2,6000200,7048886,94,"['Adventure', 'Horror', 'Thriller']","Distraught, confused, and half-wild with fear, Sarah Carter emerges alone from the Appalachian cave system where she encountered unspeakable terrors. Unable to plausibly explain to the authorities what happened - or why she's covered in her friends' blood - Sarah is forced back to the subterranean depths to help locate her five missing companions.",Fear runs deeper,[],"['Shauna Macdonald', 'Natalie Mendoza', ""Gavan O'Herlihy"", 'Josh Dallas', 'Anna Skellern', 'Saskia Mulder', 'Douglas Hodge', 'Krysten Cummings', 'Michael J. Reynolds', 'Jessika Williams', 'Doug Ballard', 'Josh Cole', 'MyAnna Buring', 'Alex Reid', 'Nora-Jane Noone']",['Celador Films'],2,['GB'],['en'],tt1073105,5.932,880,Released
