,date,titre,budget,recette,duree,genres,synopsis,tagline,realisateur,casting,compagnies_production,suite,production_countries,langues,imdb_id,vote_average,vote_count
0,2013-12-05,Everybody's Business,846820,515150,91,['Comedy'],Everybody's Business is a light-hearted satire on Singapore and Singaporeans from different walks of life. When Singapore is hit with a widespread bout of food poisoning – with at least fifty victims – everyone is sent into a tizzy. How on earth could something like this happen in Singapore? And who’s responsible?,Your business is everybody's business.,['Lee Thean Jeen'],"['Gurmit Singh', 'Mark Lee', 'Kumarason Chinnadurai', 'Wang Lei', 'Liu Ling Ling', 'Henry Thia', 'Judee Tan', 'Aloysius Pang', 'Zhang Wei', 'Chua Enlai', 'Marcus Chin', 'Dennis Chew', 'Ai Ling Ho', 'Xu Yahui', 'Tan Jian Hao', 'Nadiah M. Din', 'Chua Jin Sen', 'Anna Ru Ping Lim', 'Shi Suen Liow', 'Henry Heng', 'Richard Low', 'Ckay Lim', 'Fish Chaar', 'Lily Siew Lin Ong', 'Silver Ang']","['Clover Films', 'J Team Productions', 'MM2 Entertainment', 'Scorpio East Pictures']",1,['SG'],"['zh', 'en']",tt3174120,4.0,2
1,2012-06-12,Closure,150,500,72,"['Comedy', 'Drama', 'Romance']","All paths inevitably end, whether we want them to or not. This is a tale about one particular path, followed by two particular people, but this is not a tale about romance, this is simply a film about beginnings and endings. Daniel and Eve are a young couple in crisis. The film follows their relationship in reverse from the end to the beginning, starting with a break up. Daniel - a level-headed, well-meaning slacker caught between his desire to make something of himself,and his student inclinations to have fun. Upon meeting Eve at a party, Daniel finds her attractive precisely because she possesses the traits he does not. As their various differences bring them together, they are forced to acknowledge their faults, many of which are reflected in the other.",This is not a romance film. This is not a film about romantics. This is simply a film about beginnings and endings.,"['Joel Hewett', 'Andrew Golden']","['Sarah Calmus', 'Michael Coull', 'Simon Reynolds', 'Stuart Tomlin', 'Jacob Duane', 'Chris Bangs', 'Rory Broadhurst', 'Iain Ferguson', 'Katy May Ferguson', 'Daniel Hewett', 'Naomi Laing', 'Jason Leong', 'Jenn Samson', 'Greg Smith']",['Finger Click Productions'],1,['GB'],['en'],tt2170576,0.0,0
2,2016-07-24,Batman: The Killing Joke,3500000,3775000,76,"['Action', 'Animation', 'Crime', 'Drama']","As Batman hunts for the escaped Joker, the Clown Prince of Crime attacks the Gordon family to prove a diabolical point mirroring his own fall into madness.",The madness begins,['Sam Liu'],"['Kevin Conroy', 'Mark Hamill', 'Tara Strong', 'Ray Wise', 'Robin Atkin Downes', 'Brian George', 'John DiMaggio', 'Rick D. Wasserman', 'Maury Sterling', 'Fred Tatasciore', 'JP Karliak']","['DC Comics', 'Warner Bros. Animation', 'DC Entertainment']",1,['US'],['en'],tt4853102,6.611,1555
3,2016-02-04,我们的故事,1180000,4292000,107,"['Comedy', 'Drama']","The story spans from 1965 to the early 1970s. Heavily pregnant Zhao Di, the unwanted second wife of an older man, was chased out by her husband's family and forced to return to her own family. She gave birth to a pair of twins, Shun Fatt and Su-mei. As Su-mei had two moles on her face, which was said to be bad luck, she decided to give her up due to the pressure of wanting to build a better life for the rest of her family.",There was a time when tomorrow was uncertain.,['Jack Neo'],"['Aileen Tan', 'Mark Lee', 'Wang Lei', 'Benjamin Josiah Tan', 'Suhaimi Yusof', 'Ryan Lian', 'Charmaine Sei', 'Yan Li Xuan', 'Ng Suan Loi', 'Silvarajoo Prakasam', 'Bharathi Rani', 'Nurijah binte Sahat', 'Jaspers Lai']","['J Team Productions', 'MM2 Entertainment']",1,['SG'],"['zh', 'ms']",tt5291232,7.0,9
4,2017-02-01,RAID Dingue,32400000,34598750,105,"['Action', 'Comedy']","The story of a woman who dreams to join an intervention group in the police department called RAID. Unfortunately, she is rather clumsy and both her family (and soon to be family-in-law) and a veteran of the RAID do not approve. However, Johanna is determined to prove them wrong.",,['Dany Boon'],"['Alice Pol', 'Dany Boon', 'Michel Blanc', 'Yvan Attal', 'Sabine Azéma', 'Patrick Mille', 'François Levantal', 'Florent Peyre', 'Anne Marivin', 'Alain Doutey', 'Urbain Cancelier', 'Ludovic Pinette', 'Robert Paturel', 'François Vincentelli', 'Akim Omiri', 'Jean-François Cayrey', 'Guy Amram', 'Narcisse Mame', 'Alain Laub', 'Audrey Looten', 'Sâm Mirhosseini', 'Tony Zarouel']","['TF1 Films Production', 'Pathé', 'Artémis Productions', ""Les Productions du Ch'timi""]",1,['FR'],['fr'],tt5736696,5.758,819
5,2017-06-16,The Book of Henry,10000000,4596705,105,"['Drama', 'Crime', 'Thriller']","Susan, a single mother of two, works as a waitress in a small town. Her son, Henry, is an 11-year-old genius who not only manages the family finances but acts as emotional support for his mother and younger brother. When Henry discovers that the girl next door has a terrible secret, he implores Susan to take matters into her own hands.",Never leave things undone.,['Colin Trevorrow'],"['Naomi Watts', 'Jaeden Martell', 'Jacob Tremblay', 'Sarah Silverman', 'Maddie Ziegler', 'Lee Pace', 'Dean Norris', 'Bobby Moynihan', 'Tonya Pinkins', 'Geraldine Hughes', 'Jackson Nicoll', 'Joel Marsh Garland', 'Wass Stevens', 'Marjan Neshat', 'Maxwell Simkins', 'Donnetta Lavinia Grays', 'Mary Joy', 'Mike Massimino', 'Deborah Rayne', 'Zandi Holup', 'Arthur French', 'Donna Mitchell', 'Taylor Dior', 'Lily Peterson', 'Logan Smith', 'Philip Smreck', 'Peter Hourihan']","['Sidney Kimmel Entertainment', 'Double Nickel Entertainment']",1,['US'],['en'],tt4572792,7.54,1171
6,2016-02-12,Sanam Re,3056472,4472886,120,"['Drama', 'Romance']",A story about the man who is confused with his love life finds solace in his birthplace with his childhood love.,,['Divya Khosla Kumar'],"['Yami Gautam', 'Pulkit Samrat', 'Urvashi Rautela', 'Rishi Kapoor', 'Prachee Shah', 'Bharti Singh', 'Ashish Kaul', 'Manoj Joshi', 'Ketki Dave']",['T-Series'],1,['IN'],['hi'],tt4262516,4.78,25
