,date,titre,budget,recette,duree,genres,synopsis,tagline,realisateur,casting,compagnies_production,suite,production_countries,langues,imdb_id,vote_average,vote_count
0,2016-05-20,Kaptaan,60,109,142,"['Action', 'Comedy', 'Drama', 'Family']","Kaptaan is Latest 2016 indian Punjabi Action Comedy Drama Film,directed By Mandeep Kumar,The star cast of the Film Gippy Grewal, Karishma Kotak, Monica Gill,The film is released on 20 May 2016",A lawyer rethinks his life after he works with an NGO.,['Mandeep Kumar'],"['Gippy Grewal', 'Monica Gill', 'Karishma Kotak', 'Pankaj Dheer', 'Rana Jung Bahadur']",['Tips Industries'],1,['IN'],['pa'],tt5595240,5.5,2
1,2017-10-12,Cult of Chucky,6500000,2200000,91,"['Horror', 'Thriller']","Confined to an asylum for the criminally insane, Nica Pierce is convinced that she, not Chucky, murdered her entire family. But when the psychiatrist introduces a new therapeutic ""Good Guy"" doll with a familiar face, a string of new, grisly deaths leads Nica to wonder if she isn't crazy after all.",You may feel a little prick,['Don Mancini'],"['Fiona Dourif', 'Brad Dourif', 'Alex Vincent', 'Jennifer Tilly', 'Michael Therriault', 'Adam Hurtig', 'Elisabeth Rosen', 'Zak Santiago', 'Ali Tataryn', 'Grace Lynn Kung', 'Marina Stephenson Kerr', 'Allison Dawn Doiron', 'Summer H. Howell', 'Tom Anniko', 'Darren Wall', 'Dan De Jaeger', 'Matthew Stefanson', 'Dennis Scullard', 'Aidan Ritchie', 'Linden Porco', 'Lorrie Papadopoulos', 'Dustin Kuschnereit', 'Paolo Bryant', 'Christine Elise', 'Nedim Jahić']",['Universal 1440 Entertainment'],7,"['CA', 'US']",['en'],tt3280262,5.826,1029
2,2016-12-16,Fences,24000000,64414761,139,['Drama'],"In 1950s Pittsburgh, a frustrated African-American father struggles with the constraints of poverty, racism, and his own inner demons as he tries to raise a family.","Some people build fences to keep people out, and other people build fences to keep people in.",['Denzel Washington'],"['Denzel Washington', 'Viola Davis', 'Stephen McKinley Henderson', 'Jovan Adepo', 'Russell Hornsby', 'Mykelti Williamson', 'Saniyya Sidney', 'Lesley Boone', 'Christopher Mele', ""Tra'Waan Coles"", 'Joe Fishel']","['Paramount', 'Scott Rudin Productions', 'Escape Artists', 'Bron Studios', 'MACRO']",1,"['CA', 'US']",['en'],tt2671706,6.849,2292
3,2016-11-11,Grave,3500000,4100000,99,"['Drama', 'Horror']","In Justine’s family everyone is a vet and a vegetarian. At 16, she’s a gifted teen ready to take on her first year in vet school, where her older sister also studies. There, she gets no time to settle: hazing starts right away. Justine is forced to eat raw meat for the first time in her life. Unexpected consequences emerge as her true self begins to form.",What are you hungry for?,['Julia Ducournau'],"['Garance Marillier', 'Ella Rumpf', 'Rabah Nait Oufella', 'Laurent Lucas', 'Joana Preiss', 'Bouli Lanners', 'Thomas Mustin', 'Marouan Iddoub', 'Jean-Louis Sbille', 'Benjamin Boutboul', 'Virgil Leclaire', 'Anna Solomin', 'Sophie Breyer', 'Daniel Utegenova', 'Bérangère Mc Neese', 'Morgan Politi', ""Alice D'Hauwe"", 'Pierre Nisse', 'Maïté Katinka Lonne', 'Amandine Hinnekens', 'Sibylle du Plessy', 'Denis Mpunga', 'Alexis Julemont', 'Lich Jass', 'Helena Coppejans', 'Charlotte Sandersen', 'Christophe Menier', 'Julianne Binard']","['Canal+', 'ARTE', 'Angoa-Agicoa', 'CNC', 'RTBF', 'MEDIA Programme of the European Union', 'Wild Bunch', 'Rouge International', 'Focus Features', 'Ciné+', ""Centre du Cinéma et de l'Audiovisuel de la Fédération Wallonie-Bruxelles"", 'VOO', 'BeTV', 'La Wallonie', 'Frakas Productions', 'Ciclic - Région Centre', 'Bruxelles Capitale', 'Petit Film', 'Cofinova 12', 'Casa Kafka Pictures Movie Tax Shelter Empowered by Belfius', 'Torino Film Lab']",1,"['BE', 'FR']",['fr'],tt4954522,7.068,2710
4,2016-09-22,Ma vie de courgette,8000000,5873256,66,"['Animation', 'Comedy', 'Drama', 'Family', 'Romance']","After his mother’s death, Zucchini is befriended by a kind police officer, Raymond, who accompanies him to his new foster home filled with other orphans his age. There, with the help of his newfound friends, Zucchini eventually learns to trust and love as he searches for a new family of his own.",SOMETIMES WE CRY BECAUSE WE'RE HAPPY.,['Claude Barras'],"['Gaspard Schlatter', 'Sixtine Murat', 'Paulin Jaccoud', 'Michel Vuillermoz', 'Raul Ribera', 'Estelle Hennard', 'Elliot Sanchez', 'Lou Wick', 'Brigitte Rosset', 'Natacha Koutchoumov', 'Monica Budde', 'Adrien Barazzone', 'Véronique Montel', 'Romane Cretegny', 'Evelyne Bouvier', 'Léonard Geneux', 'Anne-Laure Brasey', 'Jean-Claude Issenmann', 'Iannis Jaccoud']","['Canal+', 'CNC', 'France 3 Cinéma', 'Eurimages', 'Gébéka Films', 'Rita Productions', 'France Télévisions', 'Ciné+', 'SRG SSR', 'RTS', 'Office Fédéral de la Culture', 'Loterie Suisse Romande', 'Suissimage', 'Blue Spirit', 'Région Poitou-Charentes', 'Département de la Charente', 'KNM', 'Indie Sales Company', 'Indie Invest', 'Cinéforom', 'Hélium Films', 'Auvergne-Rhône-Alpes Cinéma', 'Région Auvergne-Rhône-Alpes']",1,"['FR', 'CH']",['fr'],tt2321405,7.81,1110
5,2016-06-24,रमन राघव २.०,521873,1013926,134,"['Thriller', 'Crime']",A corrupt cop and a serial killer obsessed with a psychopath from the '60s get caught up in a ruthless cat-and-mouse game.,,['Anurag Kashyap'],"['Nawazuddin Siddiqui', 'Vicky Kaushal', 'Sobhita Dhulipala', 'Amruta Subhash', 'Anuschka Sawhney', 'Deepali Suryakant Badekar', 'Ashok Lokhande', 'Harssh A. Singh', 'Rajesh Jais', 'Hitesh Dave', 'Vipin Sharma', 'Kalidas Parthitan', 'Rhea Pagar']",['Phantom Films'],1,['IN'],"['en', 'hi']",tt5662932,7.142,102
6,2016-07-29,పెళ్ళిచూపులు,200000,5500000,124,"['Romance', 'Comedy']","Fed up with his carefree attitude, Prasanth's father fixes his marriage to make him responsible. However, meeting an ambitious girl changes his life for the better.",,['Tharun Bhascker Dhaassyam'],"['Vijay Deverakonda', 'Ritu Varma', 'Nandu Vijay Krishna', 'Priyadarshi Pullikonda', 'Abhay Bethiganti', 'Anish Kuruvilla', 'Gururaj Manepalli', 'Kedar Shankara', 'Anisha Alla']","['BigBen Films', 'Vinoothna Geetha']",1,['IN'],['te'],tt5824826,6.808,26
