,date,titre,budget,recette,duree,genres,synopsis,tagline,realisateur,casting,compagnies_production,suite,production_countries,langues,imdb_id,vote_average,vote_count
0,2018-02-09,The Mercy,18000000,4536348,102,"['Drama', 'Adventure']","In 1968, Donald Crowhurst, an amateur sailor, endangers the fate of his family and business, and his own life, blinded by his ambition to compete in the Sunday Times Golden Globe Race, attempting to become the first person in history to single-handedly circumnavigate the world without making any stopover.",Based on the true story,['James Marsh'],"['Colin Firth', 'Rachel Weisz', 'David Thewlis', 'Mark Gatiss', 'Genevieve Gaunt', 'Jonathan Bailey', 'Andrew Buchan', 'Simon McBurney', 'Eleanor Stagg', 'Ken Stott', 'Finn Elliot', 'Kit Connor', 'Oliver Maltman', 'Sam Hoare', 'Avye Leventis', 'Anna Madeley', 'Adrian Schiller', 'Simon Chandler', 'Alexia Traverse-Healy', 'Dorothy Atkinson', 'Sebastian Armesto', 'Martin Marquez', 'Mark Davison', 'Bruce Mackinnon', 'Richard Teverson', 'Kerry Godliman', 'Laurence Spellman', 'Greg Hicks', 'Richard Blaine', 'Geoff Bladon', 'Maynard Crowe', 'Paul Thornley', 'Stuart Davidson', 'Robert Elphick', 'Tim Downie', 'Ray Burnet', 'Zara Prassinot', 'Jefferson King']","['BBC Films', 'Blueprint Pictures', 'StudioCanal UK']",1,['GB'],"['en', 'es']",tt3319730,5.924,230
1,2017-08-04,Columbus,700000,1015744,104,['Drama'],"When a renowned architecture scholar falls suddenly ill during a speaking tour, his son Jin finds himself stranded in Columbus, Indiana - a small Midwestern city celebrated for its many significant modernist buildings. Jin strikes up a friendship with Casey, a young architecture enthusiast who works at the local library.",In the middle of all the mess... there was this.,['Kogonada'],"['John Cho', 'Haley Lu Richardson', 'Michelle Forbes', 'Rory Culkin', 'Parker Posey', 'Erin Allegretti', 'Shani Salyers Stiles', 'Reen Vogel', 'Rosalyn R. Ross', 'Lindsey Shope', 'Jem Cohen', 'Caitlin Ewald', 'Jim Dougherty', 'Joseph Anthony Foronda', 'Alphaeus Green, Jr.', 'Wynn Reichert']","['Depth of Field', 'Nonetheless Productions', 'Superlative Films']",1,['US'],"['en', 'ko']",tt5990474,7.046,293
2,1971-01-01,Hot Stuff,101250,101250,9,"['Animation', 'Comedy']","This tongue-in-cheek cautionary tale by Croatian director Zlatko Grgic traces man's checkered history with fire, and shows how growing carelessness in the form of overloaded sockets, smoldering cigarettes and other fire hazards can have highly undesirable consequences.",,['Zlatko Grgić'],"['Gerald Budner', 'John Howe']",['ONF | NFB'],1,['CA'],['en'],tt0179223,6.0,2
3,,Mental,100,50,140,[],mental mental mental,metal,[],[],[],1,[],[],,0.0,0
4,2022-03-01,The Batman,185000000,770836163,177,"['Crime', 'Mystery', 'Thriller']","In his second year of fighting crime, Batman uncovers corruption in Gotham City that connects to his own family while facing a serial killer known as the Riddler.",Unmask the truth.,['Matt Reeves'],"['Robert Pattinson', 'Zoë Kravitz', 'Paul Dano', 'Jeffrey Wright', 'John Turturro', 'Peter Sarsgaard', 'Andy Serkis', 'Colin Farrell', 'Jayme Lawson', 'Gil Perez-Abraham', 'Peter McDonald', ""Con O'Neill"", 'Alex Ferns', 'Rupert Penry-Jones', 'Charlie Carver', 'Max Carver', 'Barry Keoghan', 'Kosha Engler', 'Archie Barnes', 'Janine Harouni', 'Hana Hrzic', 'Joseph Walker', 'Luke Roberts', 'Oscar Novak', 'Stella Stocker', 'Sandra Dickinson', 'Jack Bennett', 'Andre Nightingale', 'Richard James-Neale', 'Lorraine Tai', 'Joseph Balderrama', 'James Eeles', 'Dave Simon', 'Angela Yeoh', 'Leemore Marrett Jr.', 'Ezra Elliott', 'Itoya Osagiede', 'Stewart Alexander', 'Adam Rojko Vega', 'Heider Ali', 'Marcus Onilude', 'Elena Saurel', 'Ed Kear', 'Sid Sagar', 'Amanda Blake', 'Todd Boyce', 'Brandon Bassir', 'Will Austin', 'Chabris Napier-Lawrence', 'Douglas Russell', 'Phil Aizlewood', 'Mark Killeen', 'Philip Shaun McGuinness', 'Lorna Brown', 'Elliot Warren', 'Jay Lycurgo', 'Stefan Race', 'Elijah Baker', 'Craige Middleburg', 'Akie Kotabe', 'Spike Fearn', 'Urielle Klein-Mekongo', 'Bronson Webb', 'Madeleine Gray', 'Ste Johnston', 'Arthur Lee', 'Parry Glasspool', 'Jordan Coulson', 'Hadas Gold', 'Pat Battle', 'Bobby Cuza', 'Dean Meminger', 'Roma Torre', 'Mike Capozzola', 'Amanda Hurwitz', 'Joshua Eldridge-Smith', 'Daniel Rainford', 'Nathalie Armin', 'Jose Palma', 'Kazeem Tosin Amore', 'Rodrig Andrisan', 'Craig Douglas']","['Warner Bros. Pictures', '6th & Idaho', 'Dylan Clark Productions', 'DC Films']",1,['US'],['en'],tt1877830,7.715,6679
