,date,titre,budget,recette,duree,genres,synopsis,tagline,realisateur,casting,compagnies_production,suite,production_countries,langues,imdb_id,vote_average,vote_count
0,2016-09-09,رفتن,10000,10000,78,"['Romance', 'Drama']","Two young Afghans, Fereshteh and Nabi, are in love, but Fereshteh has to follow her parents and leave Afghanistan to find refuge in Iran. Nabi decides to illegally cross the border, find Fereshteh and take her through Turkey towards Europe and a better life.",,['Navid Mahmoudi'],"['Reza Ahmadi', 'Fereshteh Hosseini', 'Behrang Alavi', 'Nazanin Bayati', 'Shams Langroudi']",['Aseman Parvaz Film'],1,"['IR', 'AF']",['fa'],tt5742306,6.4,5
1,2016-09-30,湄公河行動,30200000,173000000,124,"['Action', 'Adventure', 'Crime', 'War']",Chinese narco-cops take their mission to the Golden Triangle following the Mekong River massacre of innocent fishermen by the region's drug lord.,,['Dante Lam'],"['Zhang Hanyu', 'Eddie Peng', 'Joyce Feng', 'Chen Baoguo', 'Ken Lo', 'Carl Ng', 'Mandy Wei', 'Vithaya Pansringarm', 'Pavarit Mongkolpisit', 'Jonathan Wu', 'Wu Xu-Dong', 'Zhang Guoli', 'Liu Xian-Da', 'Zhao Jian', 'Sun Chun']",['Film Fireworks Production'],1,"['HK', 'CN']","['en', 'my', 'cn', 'zh', 'th']",tt6044910,7.045,202
2,2016-09-16,पिंक,75000000,15020702,136,"['Drama', 'Thriller']","A sexual assault victim, unjustly tried for the attempted murder of her attacker, is defended by a retired lawyer who challenges India's rape culture.",,['Aniruddha Roy Chowdhury'],"['Amitabh Bachchan', 'Taapsee Pannu', 'Kirti Kulhari', 'Andrea Tariang', 'Angad Bedi', 'Dhritiman Chatterjee', 'Piyush Mishra', 'Vijay Varma', 'Mamta Malik', 'Swaroopa Ghosh']","['Rising Sun Films', 'Saraswati Entertainment Creations Limited']",1,['IN'],"['en', 'hi']",tt5571734,7.456,171
3,2017-11-30,Легенда о Коловрате,5610000,10657499,117,"['Fantasy', 'Action', 'Adventure']","A story of a legendary battle, where seventeen fearless warriors defend their land against an army of thousands well-trained soldiers. In 13th-century Mongol warrior hordes and their leader, Batu Khan, control most of the known world. As the Mongols move towards Europe they invade the last Russian principality standing in their way. Little do they know, their plans are about to be ruined by a small detachment of heroic strong men led by a mysterious brave warrior. This is a story about courage, endurance and self-sacrifice for the sake of one's country. This is the story of Evpaty the Furious.",,"['Dzhanik Fayziev', 'Ivan Shurkhovetskiy']","['Ilya Malakov', 'Aleksandr Tsoy', 'Andrey Burkovskiy', 'Aleksandr Ilin', 'Aleksey Serebryakov', 'Timofey Tribuntsev', 'Viktor Proskurin', 'Aleksandr Ilin', 'Valeriya Shkirando', 'Marta Timofeeva', 'Igor Savochkin', 'Yuliya Khlynina', 'Artemiy Padalka', 'Dariya Yartseva', 'Polina Chernyshova', 'Matvey Sivakovsky', 'David Melkonyan', 'Ilya Antonenko', 'Georgi Pitskhelauri', 'Olga Drozdova', 'Mariya Fomina', 'Sergey Koltakov', 'Evgeny Kononov', 'Alexandr Tsema', 'Anton Shpinkov', 'Kirill Snegiryov', 'Denis Sladkov', 'Nikolay Shrayber', 'Marina Kolomina', 'Andrey Sviridov', 'Alexandr Kononets', 'Aleksey Vertkov', 'Semyon Morozov', 'Daulet Abdygaparov', 'Gennadiy Solovyov', 'Artyom Bordovskiy', 'Fyodor Lavrov', 'Vasilisa Savkina', 'Vladimir Ivaniy', 'Arseniy Sidorov', 'Vladimir Lyubimtsev', 'Artyom Gaydukov']",['Central Partnership'],1,['RU'],"['ru', 'tt']",tt6054874,6.297,116
4,2017-09-14,American Assassin,33000000,67200000,112,"['Action', 'Thriller']","Following the murder of his fiancée, Mitch Rapp trains under the instruction of Cold War veteran Stan Hurley. The pair then is enlisted to investigate a wave of apparently random attacks on military and civilian targets.",Assassins aren't born. They're made.,['Michael Cuesta'],"[""Dylan O'Brien"", 'Michael Keaton', 'Taylor Kitsch', 'Shiva Negar', 'Sanaa Lathan', 'Scott Adkins', 'David Suchet', 'Navid Negahban', 'Joseph Long', 'Mohammad Bakri', 'Charlotte Vega', 'Andrew Pleavin', 'Shahid Ahmed', 'Joost Janssen', 'Adam Collins', 'Christopher Bomford', 'Stephen Shafer', 'Vladimir Fridman', 'Nick Cavaliere', 'Adam Robertson', 'Trevor White', 'Josh Danford', 'JF Davis', 'Bentley Kalu', 'Sydney White', 'Shani Erez', 'Martina Brusco', 'Sharif Dorani', 'Alaa Safi', 'Tolga Safer', 'Bruno Bilotta', 'Yousef Sweid', 'Chris Webster', 'Buster Reeves', 'Simon Connolly', 'Michael Wildman', 'Alexis Barron', 'Khalid Laith', 'Göksun Çam', 'Roberto Sgarbi', 'Aso Sherabayani', 'Nej Adamson', 'Ronan Summers', 'Matt Rippy', 'Gjevat Kelmendi', 'Damian Dudkiewicz', 'Jake Mann', 'Jorge Leon Martinez', 'Dacio Caballero', 'Kamil Lemieszewski', 'Kola Bokinni', 'Garreth Hadfield', 'Alexander Winters']","['Di Bonaventura Pictures', 'Lionsgate', 'CBS Films', 'Nick Wechsler Productions', 'TIK Films']",1,"['CN', 'US']","['ar', 'en', 'it', 'fa', 'pl', 'es', 'tr']",tt1961175,6.374,2576
