,date,titre,budget,recette,duree,genres,synopsis,tagline,realisateur,casting,compagnies_production,suite,production_countries,langues,imdb_id,vote_average,vote_count,status
28,1992-08-21,The Gun in Betty Lou's Handbag,13000000,3721911,89,"['Comedy', 'Thriller', 'Mystery']",A Southern librarian puts excitement in her life with a found murder weapon and a false confession.,She was a nobody until someone found...,['Allan Moyle'],"['Penelope Ann Miller', 'Eric Thal', 'Alfre Woodard', 'Julianne Moore', 'Andy Romano', 'Ray McKinnon', 'William Forsythe', 'Xander Berkeley', ""Michael O'Neill"", 'Christopher John Fields', 'Cathy Moriarty', 'Billie Neal', 'Gale Mayron', 'Faye Grant', 'Reathel Bean', 'Marian Seldes', 'Ellen McElduff', 'Marisa Miller', 'Paul Bates', 'Bill Mullen', 'Meat Loaf', 'Catherine Keener', 'Cordell Jackson', 'Bernard Canepari', 'Deborah Spector', 'Barry Hannah', 'Red West', 'Lida Burris Gibson', 'Ralph Braseth', 'M.J. Etua', 'Christine Joyce', 'Mark Magill', 'Merrill Healy', 'Don Keith Opper', 'Jane Smithwick', ""Jeff O'Haco"", 'Ruddy L. Garner', 'Laura Boenheim', 'Suzanne Kent', 'Nash Germany', 'Lesha Campbell', 'Robert Jackson', 'Ann Fisher-Wirth', 'Kay McDuffie', 'Margaret Graham', 'Billy Holcomb', 'John McCauley', 'Charles Treas', 'Dianna Miranda', 'Frank Welker', 'Barton Segal', 'Stanley Tucci']","['Touchstone Pictures', 'Interscope Communications', 'Nomura Babcock & Brown', 'In The Bag Productions']",1,['US'],['en'],tt0104376,5.05,20,Released
29,2010-09-21,Hors-la-loi,30000000,3470487,137,"['Action', 'Drama', 'History', 'War']","After losing their family home in Algeria in the 1920s, three brothers and their mother are scattered across the globe. Messaoud joins the French army fighting in Indochina; Abdelkader becomes a leader of the Algerian independence movement in France and Saïd moves to Paris to make his fortune in the shady clubs and boxing halls of Pigalle.",Three brothers. One destiny. Freedom at all costs.,['Rachid Bouchareb'],"['Jamel Debbouze', 'Roschdy Zem', 'Sami Bouajila', 'Chafia Boudraa', 'Bernard Blancan', 'Sabrina Seyvecou', 'Assaad Bouab', 'Thibault de Montalembert', 'Samir Guesmi', 'Jean-Pierre Lorit', 'Ahmed Benaissa', 'Larbi Zekkal', 'Louisa Nehar', 'Mourad Khen', 'Mohamed Djouhari', 'Mostefa Djadjam', 'Damien Bonnard']","['France 3 Cinéma', 'StudioCanal', 'RTBF', 'Agence Algérienne pour le Rayonnement Culturel (AARC)', 'EPTV', 'Kiss Films', 'Novak Prod']",1,"['DZ', 'BE', 'FR']","['ar', 'fr']",tt1229381,6.555,168,Released
30,1996-01-24,The Spitfire Grill,6000000,12643776,117,"['Comedy', 'Drama']","Percy, upon being released from prison, goes to the small town of Gillead, to find a place where she can start over again. She is taken in by Hannah, to help out at her place, the Spitfire Grill. Percy brings change to the small town, stirring resentment and fear in some, and growth in others.","To a town with no future, comes a girl with a past.",[],"['Alison Elliott', 'Ellen Burstyn', 'Marcia Gay Harden', 'Will Patton', 'Kieran Mulroney', 'Gailard Sartain', 'John M. Jackson']",['Castle Rock Entertainment'],1,['US'],['en'],tt0117718,6.633,49,Released
31,2016-06-22,Independence Day: Resurgence,165000000,389681935,120,"['Action', 'Adventure', 'Science Fiction']","We always knew they were coming back. Using recovered alien technology, the nations of Earth have collaborated on an immense defense program to protect the planet. But nothing can prepare us for the aliens’ advanced and unprecedented force. Only the ingenuity of a few brave men and women can bring our world back from the brink of extinction.",We had twenty years to prepare. So did they.,['Roland Emmerich'],"['Liam Hemsworth', 'Jeff Goldblum', 'Jessie T. Usher', 'Bill Pullman', 'Maika Monroe', 'Sela Ward', 'Judd Hirsch', 'William Fichtner', 'Brent Spiner', 'Patrick St. Esprit', 'Vivica A. Fox', 'AngelaBaby', 'Charlotte Gainsbourg', 'Deobia Oparei', 'Nicolas Wright', 'Travis Tope', 'Chin Han', 'Gbenga Akinnagbe', 'Robert Loggia', 'John Storey', 'Joey King', 'Jenna Purdy', 'Garrett Wareing', 'Hays Wellford', 'Mckenna Grace', 'James A. Woods', 'Robert Neary', 'Joshua Mikel', 'Joel Virgel', 'Arturo del Puerto', 'Matthew Munroe', 'Jacob Browne', 'Ryan Cartwright', 'Travis Hammer', 'Lance Lim', 'Zeb Sanders', 'Donovan Tyee Smith', 'Stafford Douglas', 'Jade Scott Lewis', 'Beth Bailey', 'Mona Malec', 'Omar Diop', 'Ron Yuan', 'Grace Huang', 'Stephen Oyoung', 'J.P. Murrieta', 'Casey Messer', 'Ben Wang', 'Nicholas Ballas', ""Ivan G'Vera"", 'Sam Quinn', 'Richard Beal', 'Alice Rietveld', 'Alma Sisneros', 'Kenny Leu', 'Monique Candelaria', 'Ava Del Cielo', 'Diana Gaitirira', 'Evan Bryn Graves', 'Jason E. Hill', 'Catharine E. Jones', 'Tyler Kurtz', 'Aaron Tyler', 'Michael Davis', 'Johnny Otto', 'John Christian Love']","['20th Century Fox', 'Centropolis Entertainment', 'TSG Entertainment', 'Stereo D']",2,['US'],['en'],tt1628841,5.259,5367,Released
32,1995-10-27,Three Wishes,10000000,7027000,115,"['Fantasy', 'Family', 'Drama']","While Jane Holman is driving with her two sons, she accidentally runs into a drifter, Jack McCloud, who breaks his leg. Being responsible, Jane invites Jack, and his dog, to stay at her home until his leg has healed. Jack struggles to adapt their lifestyle, and finds himself loved by the family.","If you really believe, magic will find you",['Martha Coolidge'],"['Patrick Swayze', 'Mary Elizabeth Mastrantonio', 'Joseph Mazzello', 'David Marshall Grant', 'Jay O. Sanders', ""Michael O'Keefe"", 'John Diehl', 'Diane Venora', 'Brock Pierce', 'David Hart', 'Scott Patterson', 'Michael Laskin', 'Annabelle Gurwitch', 'Moira Sinise', 'Neal McDonough', 'Bill Mumy', 'Colleen Camp', 'Garette Ratliff Henson', 'Michael Wong Man-Tak', 'Brandon La Croix']","['Savoy Pictures', 'Rysher Entertainment']",1,['US'],['en'],tt0114663,6.2,62,Released
33,1981-07-31,Under the Rainbow,20000000,2297493,98,['Comedy'],"In World War II era Los Angeles, the manager of the Culver Hotel leaves his nephew in charge for a weekend. The nephew changes the name to the Hotel Rainbow and overbooks with royalty, assassins, secret agents, Japanese tourists, and munchkins. Secret Service agent Bruce Thorpe and casting director Annie Clark find romance amidst the intrigue and confusion.",Who knew so many little people would throw such a huge party?,['Steve Rash'],"['Chevy Chase', 'Carrie Fisher', 'Eve Arden', 'Joseph Maher', 'Robert Donner', 'Billy Barty', 'Mako', 'Cork Hubbert', 'Pat McCormick', 'Adam Arkin', 'Richard Stahl', 'Peter Isacksen', 'Jack Kruschen', 'Bennett Ohta', 'Jerry Maren', 'Ray Armstrong', 'Daniel Frishman', 'Gary Friedkin', 'Zelda Rubinstein']","['Orion Pictures', 'Warner Bros. Pictures']",1,['US'],['en'],tt0083254,5.095,21,Released
34,1980-03-28,When Time Ran Out...,20000000,3763988,121,"['Action', 'Adventure', 'Drama', 'Thriller']",An active volcano threatens a south Pacific island resort and its guests as a power struggle ensues between the property's developer and a drilling foreman.,Caught in a game of power. Playing time: 24 hours. Prizes: Untold wealth. Rules: None.,['James Goldstone'],"['Paul Newman', 'Jacqueline Bisset', 'William Holden', 'James Franciscus', 'Ernest Borgnine', 'Edward Albert', 'Red Buttons', 'Barbara Carrera', 'Valentina Cortese', 'Veronica Hamel', 'Alex Karras', 'Burgess Meredith', 'John Considine', 'Sheila Allen', 'Pat Morita', 'Lonny Chapman', 'Darrell Larson', 'Barbara Costello', 'Alex Karras', 'John Considine']","['Warner Bros. Pictures', 'International Cinema']",1,['US'],['en'],tt0081747,5.719,48,Released
35,1986-06-27,子猫物語,7520000,13299749,76,"['Adventure', 'Drama', 'Family']","When Milo the cat and Otis the dog are separated, they each set off on an adventurous and often perilous quest across mountains, plains, and snow-covered lands to reunite with one another.",Milo is one lucky cat. He's got nine lives and a best friend.,['Masanori Hata'],"['Dudley Moore', 'Kyoko Koizumi', 'Milo', 'Otis', 'Shigeru Tsuyuki']",['Fuji Television Network'],1,['JP'],['ja'],tt0097050,6.46,164,Released
36,1982-07-07,White Dog,8000000,46509,90,"['Drama', 'Horror']",A trainer attempts to retrain a vicious dog that’s been raised to kill black people.,When man’s best friend becomes his fiercest enemy…,[],"['Kristy McNichol', 'Paul Winfield', 'Burl Ives', 'Jameson Parker', 'Christa Lang', 'Vernon Weddle', 'Karrie Emerson', 'Helen Siff', 'Glen Garner', 'Terrence Beasor', 'Tony Brubaker', 'Marshall Thompson', 'Paul Bartel', 'Dick Miller', 'Richard Monahan', 'Neyle Morrow', 'Lynne Moody', 'Hubert Wells', 'Martine Dawson', 'Bob Minor', 'Robert Ritchie', 'Alex Brown', 'Clifford A. Pellow', 'Sam Laws', 'Parley Baer', 'Samantha Fuller', 'Jamie Crowe', 'Joseph R. Hornok', 'Lisette Kremer']",['Paramount'],1,['US'],['en'],tt0084899,6.716,208,Released
37,2013-02-06,A Good Day to Die Hard,92000000,304654182,98,"['Action', 'Thriller']","Iconoclastic, take-no-prisoners cop John McClane, finds himself for the first time on foreign soil after traveling to Moscow to help his wayward son Jack - unaware that Jack is really a highly-trained CIA operative out to stop a nuclear weapons heist. With the Russian underworld in pursuit, and battling a countdown to war, the two McClanes discover that their opposing methods make them unstoppable heroes.",Yippee Ki-Yay Mother Russia,['John Moore'],"['Bruce Willis', 'Jai Courtney', 'Sebastian Koch', 'Yuliya Snigir', 'Cole Hauser', 'Radivoje Bukvić', 'Amaury Nolasco', 'Sergey Kolesnikov', 'Roman Luknár', 'Zolee Ganxsta', 'Péter Takátsy', 'Pasha D. Lychnikoff', 'Megalyn Echikunwoke', 'Melissa Tang', 'Attila Árpa', 'Norbert Növényi', 'Martin Hindy', 'Rico Simonini', 'Aldis Hodge', 'April Grace', 'Anne Vyalitsyna', 'Mary Elizabeth Winstead']","['20th Century Fox', 'Ingenious Media', 'Dune Entertainment', 'Mid Atlantic Films', 'Big Screen Productions', 'Temple Hill Entertainment', 'TSG Entertainment', 'Giant Pictures', 'Origo Film Group']",5,['US'],"['en', 'ru']",tt1606378,5.296,5688,Released
38,2017-01-13,xXx: Return of Xander Cage,85000000,346147658,107,"['Action', 'Adventure', 'Crime']","Extreme athlete turned government operative Xander Cage comes out of self-imposed exile, thought to be long dead, and is set on a collision course with deadly alpha warrior Xiang and his team in a race to recover a sinister and seemingly unstoppable weapon known as Pandora's Box. Recruiting an all-new group of thrill-seeking cohorts, Xander finds himself enmeshed in a deadly conspiracy that points to collusion at the highest levels of world governments.","There are no more patriots, just rebels and tyrants.",['D. J. Caruso'],"['Vin Diesel', 'Donnie Yen', 'Deepika Padukone', 'Kris Wu', 'Ruby Rose', 'Tony Jaa', 'Nina Dobrev', 'Rory McCann', 'Toni Collette', 'Samuel L. Jackson', 'Ice Cube', 'Hermione Corfield', 'Michael Bisping', 'Shawn Roberts', 'Tony Gonzalez', 'Ariadna Gutiérrez', 'Andrey Ivchenko', 'Nicky Jam', 'Neymar Jr', 'Al Sapienza', 'Helena-Alexis Seymour', 'Megan Soo', 'Kristen Kurnik', 'Bailey Rose King', 'Pilar Cruz', 'Charles Carroll', 'Héctor Aníbal', 'Curtis Fletcher', 'Terry Chen', 'Jenny Itwaru', 'Julie Abcede', 'Josh Pagcaliwangan', 'Nyjah Huston', 'Roberta Mancino', 'Nina Buitrago', 'Dani Lightningbolt', 'Courtney Friel', 'Jelena Savić']","['Paramount', 'Revolution Studios', 'One Race', 'Shanghai Film Group', 'Huahua Media', 'Rox Productions', 'Maple Cage Productions', 'Roth-Kirschenbaum Films']",3,"['CA', 'CN', 'US']",['en'],tt1293847,6.044,7016,Released
