,date,titre,budget,recette,duree,genres,synopsis,tagline,realisateur,casting,compagnies_production,suite,production_countries,langues,imdb_id,vote_average,vote_count
0,2016-08-17,هفت ماهگی,80000,80000,90,['Drama'],Revenge may have irreversible consequences.,,['Hatef Alimardani'],"['Pegah Ahangarani', 'Hamed Behdad', 'Baran Kosari', 'Ahmad Mehranfar', 'Reza Behboudi', 'Behnaz Jafari', 'Hanie Tavassoli', 'Fereshteh Sadr Orafaee']",[],1,['IR'],['fa'],tt6211418,8.0,7
1,2018-01-12,Batman: Gotham by Gaslight,1000000,3469151,78,"['Thriller', 'Action', 'Animation', 'Science Fiction']","In an alternative Victorian Age Gotham City, Batman begins his war on crime while he investigates a new series of murders by Jack the Ripper.","As the Ripper stalks Gotham City, the Dark Knight reveals the face of terror.",['Sam Liu'],"['Bruce Greenwood', 'Jennifer Carpenter', 'Anthony Stewart Head', 'Scott Patterson', 'John DiMaggio', 'Yuri Lowenthal', 'Grey DeLisle', 'William Salyers', 'Bob Joles', 'Tara Strong', 'Kari Wuhrer', 'Lincoln Melcher', 'David Forseth', 'Chris Cox']","['Warner Bros. Animation', 'DC Entertainment']",1,['US'],['en'],tt7167630,6.707,582
2,2017-08-31,शुभ मंगल सावधान,3425875,8838757,105,"['Romance', 'Comedy']",A couple fall in love but then the groom discovers that he suffers from erectile dysfunction.,Stand Up For Love,['R. S. Prasanna'],"['Ayushmann Khurrana', 'Bhumi Pednekar', 'Seema Pahwa', 'Brijendra Kala', 'Neeraj Sood', 'Gopal Datt', 'Jimmy Shergill', 'Supriya Shukla', 'Anshul Chauhan', 'Chittaranjan Tripathy']","['Eros International', 'Colour Yellow Productions']",1,[],['hi'],tt6971752,6.75,56
3,2017-09-08,पोस्टरब्वॉयज,2360586,3540879,128,['Comedy'],Life of three men comes in trouble when their photos appear on advertisement for sterilization.,,['Shreyas Talpade'],"['Sunny Deol', 'Bobby Deol', 'Shreyas Talpade', 'Randheer Rai', 'Sonali Kulkarni', 'Somesh Agarwal', 'Tasha Bhambra', 'Samrat Raichand', 'Tripti Dimri']",[],1,['IN'],['hi'],tt6352548,5.7,15
4,2017-10-19,Последний богатырь,8250000,30060061,120,"['Fantasy', 'Family', 'Adventure', 'Action', 'Comedy']","Ivan is an ordinary guy who is transferred from modern Moscow to the fantasy world Belogorye. In this parallel universe where characters of Russian fairy tales live, magic is an integral part of daily life, and arguments are settled with the help of sword . Unexpectedly, Ivan finds himself in the middle of a battle between good and evil, and he must discover why everyone thinks that he must play the main role in upcoming events...",,['Dmitriy Dyachenko'],"['Viktor Horinyak', 'Mila Syvatska', 'Ekaterina Vilkova', 'Konstantin Lavronenko', 'Sergey Burunov', 'Elena Yakovleva', 'Svetlana Kolpakova', 'Aleksandr Semchev', 'Evgeniy Dyatlov', 'Wolfgang Cerny', 'Andrey Trushin', 'Stepan Sereda', 'Marina Kaletskaya', 'Ruslan Dzhaybekov', 'Aleksey Onezhen', 'Kseniya Samoylova', 'Igor Yashanin', 'Nikolay Shrayber', 'Timofey Tribuntsev', 'Oleg Chevelyov', 'Igor Shternberg', 'Karina Zvereva', 'Elena Valyushkina', 'Yuriy Tsurilo', 'Vladimir Ivaniy', 'Denis Bespalyy', 'Alexandr Seteykin', 'Olga Venikova', 'Andrey Rebenkov', 'Anna Galinova']","['Walt Disney Pictures', 'The Walt Disney Company CIS']",1,['RU'],['ru'],tt6175394,6.936,125
