,date,titre,budget,recette,duree,genres,synopsis,tagline,realisateur,casting,compagnies_production,suite,production_countries,langues,imdb_id,vote_average,vote_count,status
0,1992-09-18,Claire of the Moon,130000,799674,105,"['Drama', 'Romance']","Claire of the Moon is set in the 1990s in the Pacific Northwest. Claire Jabrowski, a famous heterosexual author, decides to attend a retreat for all-female writers. Claire's rommate at the retreat is Dr. Noel Benedict, author of a book called The Naked Truth. The movie culminates in a sexual encounter between the two authors.",One woman's journey into her sexual identity.,['Nicole Conn'],"['Trisha Todd', 'Karen Trumbo', 'Faith McDevitt', 'Craig Damen', 'Leslie Hidula', 'Caren Graham', 'Sheila Dickenson', 'Patricia Blem', 'Melissa Mitchell', 'Gathering Marbet', 'Sherilyn Lawson', 'Misti Cooper', 'Doug Rouhier']",['Demi-Monde Productions'],1,['US'],['en'],tt0103977,5.357,28,Released
1,1989-05-05,C.H.U.D. II: Bud the Chud,49200000,62405000,85,"['Horror', 'Comedy', 'Science Fiction']","A military experiment to create a race of super-warriors goes awry, as legions of murderous zombies are unleashed upon a suburban neighborhood.",This C.H.U.D.'s for you!,['David Irving'],"['Bill Calvert', 'Tricia Leigh Fisher', 'Gerrit Graham', 'Robert Vaughn', 'Larry Cedar', 'Bianca Jagger', 'Larry Linville', 'Judd Omen', 'Jack Riley', 'Sandra Kerns', 'Norman Fell', 'June Lockhart', 'Rich Hall', 'Robert Symonds', 'Priscilla Pointer', 'Frank Birney', 'Clive Revill', 'Sarah Berry', 'Mary Margaret Patts', 'Gregg Binkley', 'Warren Selko', 'Andy Steinlen', 'Robert Englund']","['Management Company Entertainment Group (MCEG)', 'Vestron Pictures']",2,['US'],"['en', 'pt']",tt0097001,4.3,55,Released
2,2010-01-14,Henry's Crime,12000000,204940,108,"['Crime', 'Comedy']","An aimless man is sent to prison for a crime he did not commit, an ex-con targets the same bank he was sent away for robbing.",The real crime is not committing to your dreams.,['Malcolm Venville'],"['Keanu Reeves', 'Vera Farmiga', 'James Caan', 'Judy Greer', 'Fisher Stevens', 'Danny Hoch', 'Bill Duke', 'Peter Stormare', 'Currie Graham', 'David Costabile', 'Jordan Gelber', 'Audrey Lynn Weston', 'Julie Ordon', 'Guy Boyd', 'Peter Appel', 'David Bishins', 'Drew McVety', 'Tim Snay', 'Carlos Pizarro', 'Chris Cardona', 'Mark R. Anthony', 'Brian Rogalski', 'Steve Beauchamp', 'Allel Aimiche', 'Ken Marks', 'Gideon Banner', 'James Hindman', 'Joseph Basile', 'Rosemary Howard', 'Jason Fisher', 'Glenn Fleshler', 'Angelo Mercado Jr', 'Nicholas Cocchetto', ""Paul O'Brien""]",['Company Films'],1,['US'],['en'],tt1220888,5.767,276,Released
3,2011-02-03,Kokowääh,5650000,43000000,115,['Comedy'],"Henry is a playboy who has no idea that he is the father of a beautiful, cute girl out of a One-night-Stand. Her mother left the daughter in front of Henry door after her husband realized after 8 years of marriage that he is not the father so their relationship now is breaking up... By the way: Kokowääh, is how a German (in this case an 8 Year old child) that has never heard the dish before - would pronounce ""Coq Au Vin"" (chicken in a wine sauce).",,[],"['Til Schweiger', 'Emma Schweiger', 'Jasmin Gerat', 'Samuel Finzi', 'Sanny van Heteren', 'Birthe Wolter', 'Friederike Kempter', 'Sönke Möhring', 'Katharina Thalbach', 'Meret Becker', 'Luna Schweiger', 'Numan Acar', 'Mišel Matičević', 'Fahri Yardım', 'Anne-Sophie Briest', 'Anna Julia Antonucci', 'Johann von Bülow', 'Mimi Fiedler', 'Ulrich Wickert', 'Jessica Richter', 'Jahmar Walker', 'Genoveva Mayer', 'Richard von Groeling', 'Yannick Pudlorz']","['Sat.1', 'Barefoot Films', 'Béla Jarzyk Production']",1,['DE'],['de'],tt1700258,6.246,237,Released
4,2014-03-05,300: Rise of an Empire,110000000,337580051,102,"['Action', 'Drama', 'War']","Greek general Themistokles attempts to unite all of Greece by leading the charge that will change the course of the war. Themistokles faces the massive invading Persian forces led by mortal-turned-god, Xerxes and Artemesia, the vengeful commander of the Persian navy.",Seize your glory!,['Noam Murro'],"['Sullivan Stapleton', 'Eva Green', 'Lena Headey', 'Callan Mulvey', 'David Wenham', 'Rodrigo Santoro', ""Jack O'Connell"", 'Andrew Tiernan', 'Ashraf Barhom', 'Andrew Pleavin', 'Hans Matheson', 'Peter Mensah', 'Ben Turner', 'Christopher Boyer', 'Fred Ochs', 'Price Carson', 'John Michael Herndon', 'David Pevsner', 'Peter Ferdinando', 'Igal Naor', 'Luke Roberts', 'George Georgiou', 'Farshad Farahat', 'Christopher Sciueref', 'Steven Cree', 'Caitlin Carmichael', 'Jade Chynoweth', 'Kevin Fry', 'David Sterne', 'Gregor Truter', 'Vincent Walsh', 'Nick Court', 'Mark Killeen', 'Stefan Ivanov', 'Atanas Srebrev', 'Bo Roberts', 'Gregory Shelby', 'Wayne Dalglish', 'Velimir Velev', 'Dimo Alexiev', 'Dimiter Doichinov', 'Velizar Peev', 'Aleksandar Belovski']","['Warner Bros. Pictures', 'Legendary Pictures', 'Hollywood Gang Productions', 'Atmosphere Entertainment MM', 'Nimar Studios', 'Cruel & Unusual Films']",2,['US'],['en'],tt1253863,6.088,5701,Released
5,1991-10-04,The Super,22000000,11000863,84,['Comedy'],Louie Kritski is a heartless landlord who has been so negligent in keeping up his ghetto apartment that he is threatened with jail time. The judge gives him another option -- he must live in his rat-infested hell hole until he brings it up to liveable standards.,The best way to punish a slumlord is to make him a tenant.,['Rod Daniel'],"['Joe Pesci', 'Vincent Gardenia', 'Madolyn Smith Osborne', 'Stacey Travis', 'Carole Shelley', 'Eileen Galindo', 'Daniel Margotta', 'Olga Merediz', 'Pepe Douglas', 'Daniel Hagen', 'Anthony Caso', 'Rubén Blades', 'Todd Monteiro']","['JVC', 'Largo Entertainment']",1,"['JP', 'US']","['en', 'es']",tt0103007,5.976,85,Released
6,2010-09-16,Elle s'appelait Sarah,10000000,17511906,111,"['Drama', 'War']","On the night of 16 July 1942, ten year old Sarah and her parents are being arrested and transported to the Velodrome d'Hiver in Paris where thousands of other jews are being sent to get deported. Sarah however managed to lock her little brother in a closet just before the police entered their apartment. Sixty years later, Julia Jarmond, an American journalist in Paris, gets the assignment to write an article about this raid, a black page in the history of France. She starts digging archives and through Sarah's file discovers a well kept secret about her own in-laws.",Uncover the mystery.,['Gilles Paquet-Brenner'],"['Kristin Scott Thomas', 'Mélusine Mayance', 'Niels Arestrup', 'Frédéric Pierrot', 'Michel Duchaussoy', 'Dominique Frot', 'Natasha Mashkevich', 'Gisèle Casadesus', 'Aidan Quinn', 'Sarah Ber', 'Arben Bajraktaraj', 'James Gerard', 'Joseph Rezwin', 'Kate Moran', 'Paul Mercier', 'Alexandre Le Provost', 'Serpentine Teyssier', 'Simon Eine', 'Julie Fournier', 'Paige Barr', 'Joanna Merlin', 'George Birt', 'Vinciane Millereau', 'Sylviane Fraval', 'Dan Herzberg', 'Nancy Tate', 'Frédérick Guillaud', 'Maurice Lustyk', 'Charlotte Poutrel', 'Maxim Driesen', 'Xavier Beja', 'Jacqueline Noëlle', 'Jean-Pierre Hutinet', 'Jonathan Kerr', 'Matthias Kress', 'Franck Beckmann', 'Nicolas Seconda', ""François d'Aubigny"", 'Stéphane Charond', 'José Fumanal', 'Gilles Louzon', 'Pierre Nahori', 'Yasmine Ghazarian', 'Naëva Lissonnet', 'Céline Caussimon', 'Claudine Acs', 'Viktoria Li', 'Loïc Risser', 'Franck Chilly', 'Marco Florio', 'Alice St. Clair', 'Stéphanie Gesnel', 'Gérard Couchet', 'Mark Fairchild', 'Melinda Wade', 'Kiley Liddell', 'Brooke Liddell', 'Sophie Bacry Picciotto', 'Christian Vurpillot', 'Robert Rotsztein', 'Ludovic Louis', 'Eric Moreau', 'Anoushka Rava', 'Jacques Chirac']","['France 2 Cinéma', 'Canal+', 'Studio 37', 'TPS Star', 'France Télévisions', 'TF1 Droits Audiovisuels', 'La Région Île-de-France', 'Hugo Productions', 'A Plus Image']",1,['FR'],"['de', 'fr', 'yi', 'en', 'it']",tt1668200,7.308,613,Released
7,2011-08-24,This Must Be the Place,25000000,11790979,118,['Drama'],"A bored, retired rock star sets out to find his father's executioner, an ex-Nazi war criminal who is a refugee in the U.S.",Never for money. Always for love.,['Paolo Sorrentino'],"['Sean Penn', 'Olwen Fouéré', 'Eve Hewson', 'Johnny Ward', 'Sam Keeley', ""Danielle O'Brien"", ""Margaret O'Reilly"", 'Frances McDormand', ""Mairin O'Donovan"", 'Simon Delaney', ""Jer O'Leary"", 'Master Deng', 'Jane Myers', 'Heather Fedyk', 'Iris Frank', 'Andrea Mellos', 'Sarab Kamoo', 'Sarah Carroll', 'Liron Levo', 'Bill Hoffinger', 'David Byrne', 'Fritz Weaver', 'Judd Hirsch', 'Bern Cohen', 'Shea Whigham', 'Nana Ansah', 'Patricia Hicok', 'Gordon Michaels', 'Joyce Van Patten', 'Madge Levinson', 'Frank Adakai', 'Kerry Condon', 'Seth Adkins', 'Stafford Douglas', 'Grant Goodman', 'Suzanne Enslen', 'Boots Southerland', 'Davis Gloff', 'Ron Coden', 'Harry Dean Stanton', 'Heinz Lieven', 'Greg Trzaskoma']","['France 2 Cinéma', 'Canal+', 'ARP Sélection', 'Lucky Red', 'Eurimages', 'MEDIA Programme of the European Union', 'Indigo Film', 'Screen Ireland', 'Element Pictures', 'Medusa Film', 'CinéCinéma', 'France Télévisions', 'Pathé', 'Section 481', 'Intesa San Paolo']",1,"['FR', 'IE', 'IT']","['he', 'en']",tt1440345,7.024,1071,Released
8,1929-10-12,Welcome Danger,979828,3000000,115,['Comedy'],A gentle botany student has to toughen up to replace his father as chief of police.,HEAR the smile that makes millions laugh!,['Malcolm St. Clair'],"['Harold Lloyd', 'Barbara Kent', 'Noah Young', 'Charles Middleton', 'Will Walling', 'Grady Sutton', 'Brooks Benedict', 'Eddy Chandler', 'Rae Daggett', 'Douglas Haig', 'Edgar Kennedy', 'Tetsu Komai', 'James B. Leong', 'Jim Mason', 'Nelson McDowell', 'James Wang', 'Blue Washington', 'Leo Willis']",['The Harold Lloyd Corporation'],1,['US'],['en'],tt0020572,5.2,13,Released
9,2006-10-23,Deadlands: The Rising,10847,2025,64,"['Action', 'Adventure', 'Horror', 'Thriller']",October 2008. A biochemical weapon explosion causes a freak chain of events and brings the dead back to life. It is up to five people to make a stand for survival against an ever growing army of the Living Dead.,The world as we know it... Is coming to an end!,[],"['Dave Cooperman', 'Gary Ugarek', 'Michelle Wright', 'Brian Wright', 'Connor Brandt', 'Melisa Breiner-Sanders', 'Josh Davidson', 'Jeremy Paris', 'Chris L. Clark', 'Nathan Rosen', 'Brian Marinelli', 'Bruce Morgan', 'Tom Gambrill']",[],1,[],[],tt0861701,2.9,7,Released
10,1996-11-29,Monopol,1917,724379,106,"['Comedy', 'Music']","Egil (Knut Agnred) is just an ordinary painter. But one day, when he's about to paint a fence, incredible stuff starts to happen!",,[],"['Peter Rangmar', 'Knut Agnred', 'Kerstin Granlund', 'Anders Eriksson', 'Per Fritzell', 'Jan Rippe', 'Claes Eriksson', 'Lisa Alvgrim', 'Olof Thunberg', 'Dan Ekborg', 'Mats Bergman', 'Jörgen Mörnbäck', 'Jan Nygren', 'Olle Sarri', 'Stefan Ljungqvist', 'Maria Lundqvist', 'Christina Stenius', 'Ulf Dohlsten', 'Charlott Strandberg', 'Mi Ridell', 'Håkan Johannesson']","['SF Studios', 'Kulturtuben']",1,['SE'],['sv'],tt0117078,5.409,11,Released
11,1990-12-23,Macken - Roy's & Roger's Bilservice,1497520,6137054,92,['Comedy'],"Roy and Roger decide to close their gasstation for the summer, to try to find where, what and how their lost father is. Roger also falls in love and much more.",,[],"['Anders Eriksson', 'Jan Rippe', 'Kerstin Granlund', 'Per Fritzell', 'Peter Rangmar', 'Knut Agnred', 'Claes Eriksson', 'Sven Melander', 'Magnus Härenstam', 'Charlott Strandberg', 'Håkan Johannesson', 'Hans Alfredson', 'Laila Westersund', 'Folke Lindh', 'Gösta Krantz', 'Wallis Grahn', 'Berit Hallén', 'Tintin Anderzon', 'Fia Håkanson', 'Marcus Ekbom', 'Mikael Lindgren', 'Magnus Norén', 'Christopher Rosén', 'Christoffer Schoug', 'Per Strandberg']","['FilmTeknik', 'SF Studios', 'Kulturtuben']",1,['SE'],"['da', 'sv']",tt0100083,5.542,12,Released
12,1929-09-15,Rio Rita,678000,2400000,140,"['Romance', 'Western', 'Music']","Capt. James Stewart pursues the bandit ""The Kinkajou"" over the Mexican border and falls in love with Rita. He suspects, that her brother is the bandit.","Ziegfeld's fabulous all-talking, all-singing super screen spectacle",[],"['Bebe Daniels', 'John Boles', 'Bert Wheeler', 'Robert Woolsey', 'Dorothy Lee', 'Don Alvarado', 'Georges Renavent', 'Helen Kaiser', 'Lita Chevret']",['RKO Radio Pictures'],1,['US'],['en'],tt0020332,8.5,2,Released
13,1935-04-19,Star of Midnight,280000,831000,90,"['Comedy', 'Mystery', 'Romance']","When a dancer disappears from a theater,  Clay Dalzell is asked to investigate, leading him on a trail of murder and deception.","The titian-haired star of ""Gay Divorcee"" and ""Roberta"" joins hands with the master of all screen sleuths in a sparkling, mystery drama breathless with thrills...",['Stephen Roberts'],"['William Powell', 'Ginger Rogers', 'Paul Kelly', 'Gene Lockhart', 'Ralph Morgan', 'Leslie Fenton', 'J. Farrell MacDonald', 'Russell Hopton', 'Vivien Oakland', ""Robert Emmett O'Connor"", 'George Chandler', 'Spencer Charters', 'Billy Dooley', 'Bess Flowers', 'Frank Reicher']",['RKO Radio Pictures'],1,['US'],['en'],tt0027040,6.333,15,Released
14,1934-02-14,Fashions of 1934,317000,965000,78,"['Comedy', 'Drama', 'Music']","When the Manhattan investment firm of Sherwood Nash goes broke, he joins forces with his partner Snap and fashion designer Lynn Mason to provide discount shops with cheap copies of Paris couture dresses.",A new style in entertainment! Entirely different...sumptuous...magnificent!,"['William Dieterle', 'Busby Berkeley']","['William Powell', 'Bette Davis', 'Frank McHugh', 'Hugh Herbert', 'Verree Teasdale', 'Reginald Owen', ""Henry O'Neill"", 'Phillip Reed', 'Dorothy Burgess', 'Nella Walker', 'Etienne Girardot', 'Hobart Cavanaugh', 'Jane Darwell', 'Arthur Treacher', 'Sam McDaniel']",['First National Pictures'],1,['US'],"['en', 'fr']",tt0025101,6.8,11,Released
15,2008-08-01,குசேலன்,9900000,1000000,160,['Drama'],"Balakrishnan and Ashok are two childhood friends who lose touch with each other. One of them goes on to become a national figure and the other, a village barber.",,['P. Vasu'],"['Rajinikanth', 'Nayanthara', 'Pasupathy Masilamani', 'Meena', 'Vadivelu', 'Livingston', 'Santhanam', 'Sona Heiden', 'Suriya', 'Dhanush', 'Khushboo', 'Sneha', 'Brahmanandam', 'Suja Varunee', 'Prabhu', 'Thalapathi Dinesh', 'Madhan Bob', 'Vaiyapuri', 'O. A. K. Sundar', 'Santhana Bharathi', 'M. S. Bhaskar', 'Thiyagu', 'Mayilsamy', 'Kavithalaya Krishnan', 'Ambani Shankar', 'Singamuthu', 'Bonda Mani', 'Mamta Mohandas', 'Vijayakumar', 'Nizhalgal Ravi', 'R. Sundarrajan', 'Manobala', 'Chinni Jayanth', 'Tanikella Bharani', 'Mohan Raman', 'Geetha', 'Fathima Babu']","['Kavithalayaa Productions', 'Seven Arts International']",1,['IN'],['ta'],tt1273218,6.3,8,Released
16,1981-08-06,Carbon Copy,6000000,9566593,92,"['Comedy', 'Drama']","A middle-aged married wealthy white corporate executive is surprised to discover that he has a working-class black teen-age son who wants to be adopted into the almost-exclusively-white upper-middle-class community of San Marino, California.","I lost my job, my house and my Rolls Royce; My family left me...What else can possibly go wrong?",['Michael Schultz'],"['Denzel Washington', 'George Segal', 'Susan Saint James', 'Jack Warden', 'Paul Winfield', 'Macon McCalman', 'Vicky Dawson', 'Parley Baer', 'Dick Martin', 'Carmen Filpi', 'Warren Munson', 'Tom Poston', 'Lee Garlington']","['Hemdale', 'RKO Pictures LLC', 'First City Features Ltd.']",1,"['GB', 'US']",['en'],tt0082138,5.8,36,Released
