,date,titre,budget,recette,duree,genres,synopsis,tagline,realisateur,casting,compagnies_production,suite,production_countries,langues,imdb_id,vote_average,vote_count
0,2018-10-10,L'Amour flou,495343,1399479,97,['Comedy'],"Romane and Philippe separate. After 10 years together, two children and a dog, they do not love each other anymore. They give birth to a ""separation"": two separate apartments, communicating only through the room of their children.",,"['Romane Bohringer', 'Philippe Rebbot']","['Romane Bohringer', 'Philippe Rebbot', 'Rose Rebbot-Bohringer', 'Raoul Rebbot-Bohringer', 'Reda Kateb', 'Clémentine Autain', 'Pierre Berriau', 'Vincent Berger', 'Delphine Berger Cogniard', 'Astrid Bohringer', 'Lou Bohringer', 'Richard Bohringer']",['Escazal Films'],1,['FR'],['fr'],tt8792898,6.028,90
1,1965-09-23,Khandan,204099,408198,158,[],"An ancestral property is distributed between two brothers, then a couple of years later, bitterness divides their families. An outsider in the younger brother's family tries to kill the others, which is resisted in time, and they reunite.",Khandan,[],"['Om Prakash', 'Lalita Pawar', 'Manmohan Krishna', 'Pran', 'Nutan', 'Sunil Dutt']",[],1,[],['hi'],tt0059354,0.0,0
2,2020-02-12,Fantasy Island,7000000,47078545,109,"['Horror', 'Fantasy', 'Adventure', 'Mystery']","A group of contest winners arrive at an island hotel to live out their dreams, only to find themselves trapped in nightmare scenarios.",Never coming home,['Jeff Wadlow'],"['Michael Peña', 'Maggie Q', 'Lucy Hale', 'Michael Rooker', 'Austin Stowell', 'Jimmy O. Yang', 'Portia Doubleday', 'Ryan Hansen', 'Mike Vogel', 'Parisa Fitz-Henley', 'Kim Coates', 'Robbie Jones', 'Jeriya Benn', 'Charlotte McKinney', 'Josh McConville', 'Tane Williams-Accra', 'Edmund Lembke-Hogan', 'Ian Roberts', 'Evan Evagora', 'Goran D. Kleut', 'Josh Randall', 'Joshua Diaz', 'Andrew Lees', 'Nick Slater', 'Steven A. Davis', 'Renée Murden', 'Mark Weinhandl']","['Columbia Pictures', 'Blumhouse Productions', 'Tower of Babble']",1,['US'],['en'],tt0983946,5.91,2033
3,2020-01-24,Zola,5000000,3500000,86,"['Comedy', 'Crime']","A waitress agrees to accompany an exotic dancer, her put-upon boyfriend, and her mysterious and domineering roommate on a road trip to Florida to seek their fortune at a high-end strip club.",Y'all wanna hear a story?,['Janicza Bravo'],"['Taylour Paige', 'Riley Keough', 'Colman Domingo', 'Nicholas Braun', ""Ari'el Stachel"", 'Nelcie Souffrant', 'Nasir Rahim', 'Jason Mitchell', 'Ts Madison', 'Latasha Glenn', 'Kalesha Johnson', 'Natalie Mimms', 'Shadae Mitchell', 'Oleika Redd', 'Tommy Foxhill', 'Ben Bladon', 'Tony DeMil', 'Ernest Emmanuel Peeples', 'Joseph Sanders', 'Brett Chesebro', 'Carl Collanus', 'Jay Dersahagian', 'Rusty Dumhoff', 'Mark Fiedler', 'Alex Flash', 'Matt Harding', 'Richard Lariviere', 'Bob Lawton', 'Ernest Lee Wilson, Jr.', 'Josh Locy', 'Pedro Armando Medina', 'Thomas Nash', 'Bill Pierce', 'Michael Worden', 'Kyle Williams', 'Andrew Romano', 'Sophie Hall', 'Angelo Diaz', 'Rico Paris', 'Michael Aceveda', 'Anibal Echevarria Bonet', 'Max Guevara', 'Harold Hernandez', 'David Rodriguez', 'Bernard Lyght', 'Michael Opal', 'Doug Walker', 'Jarquale Stewart', 'Drew Rin Varick', 'Megan Hayes']","['Killer Films', 'Gigi Films', 'Ramona Films']",1,['US'],"['en', 'es']",tt5439812,6.167,153
4,2022-07-27,DC League of Super-Pets,90000000,193000000,105,"['Animation', 'Action', 'Family', 'Comedy', 'Science Fiction']","When Superman and the rest of the Justice League are kidnapped, Krypto the Super-Dog must convince a rag-tag shelter pack - Ace the hound, PB the potbellied pig, Merton the turtle and Chip the squirrel - to master their own newfound powers and help him rescue the superheroes.","Sit, stay, save the world.",['Jared Stern'],"['Dwayne Johnson', 'Kevin Hart', 'John Krasinski', 'Keanu Reeves', 'Kate McKinnon', 'Vanessa Bayer', 'Natasha Lyonne', 'Diego Luna', 'Jameela Jamil', 'Marc Maron', 'Dascha Polanco', 'Olivia Wilde', 'Jemaine Clement', 'Daveed Diggs', 'John Early', 'Ben Schwartz', 'Thomas Middleditch', 'Maya Erskine', 'Yvette Nicole Brown', 'Alfred Molina', 'Lena Headey', 'Keith David', 'Busy Philipps', 'Dan Fogler', 'Winona Bradshaw', 'David Pressman', 'Sam Levine', 'Michelle Morgan', 'Amanda Ames', 'Gavin McCrillis']","['Warner Bros. Pictures', 'Animal Logic', 'DC Entertainment', 'Warner Animation Group', 'Seven Bucks Productions']",1,['US'],['en'],tt8912936,7.482,904
