,date,titre,budget,recette,duree,genres,synopsis,tagline,realisateur,casting,compagnies_production,suite,production_countries,langues,imdb_id,vote_average,vote_count
0,2002-11-13,Одиночество крови,1500000,139622,96,['Thriller'],"The life of the main character Maria, a talented scientist-pharmacist, abruptly changes the chain of mysterious events. First, the husband goes missing, and then the murders begin in the city. Three weeks later, the heroine finds her husband, but, alas, it is not so pleased with her — she recognizes a loved one in the sketch of a homicidal maniac. Despite the support of friends, Mary is on the verge of despair…",,['Roman Prygunov'],"['Ingeborga Dapkūnaitė', 'Gosha Kutsenko', 'Vyacheslav Razbegaev', 'Oksana Fandera', 'Lev Prygunov', 'Roman Radov', 'Elvira Bolgova', 'Mariya Semkina', 'Natalya Rogozhkina', 'Filipp Yankovsky', 'Lyudmila Arinina', 'Irina Grigoryeva', 'Vera Ivanko']",['Национальный фонд возрждения кино'],1,['RU'],['ru'],tt0327067,0.0,0
1,2006-11-01,Vaghti hame Khab boodand,10000,100000,104,['Drama'],"'When Everybody was Asleep' is the story of Bibi, a well loved, elderly midwife in a small village. When Bibi married, her husband promised to take her on a pilgrimage to Mecca, and, although he never forgot his promise, he passed away before he could keep it. After years of waiting, Bibi finally has the chance to make the pilgrimage, but her advanced age makes the journey more difficult than it ever was before",Vaghti hame Khab boodand,['Fereidoun Hasanpour'],"['Mohammad Reza Foroutan', 'Golab Adine', 'Ghazal Shakeri', 'Nazanin Farahani']",[],1,['IR'],['fa'],tt0841186,0.0,0
2,2023-08-04,"Safornication, la película",69000,690000,0,"['Action', 'Adventure', 'Comedy', 'Science Fiction']",,,[],[],[],1,[],[],,0.0,0
3,2011-01-01,The Gatling Gun: Changing the World One Bullet at a Time,10,100,10,['Documentary'],"During the American Civil War the worlds first effective machine gun. The Gatling Gun fired five bullets at a time, and while never gaining traction during the war, went on to be a major mile stone in weaponry.",,['Mackenzie Criswell'],[],['CineGenie MPC'],1,[],[],tt5275096,0.0,0
4,2015-12-02,Hostility,10,100,1,"['Action', 'Comedy', 'Crime']",Two overweight brothers get into a fight over a cookie that ends in blood.,,['Mackenzie Criswell'],['Fredrick Criswell'],['CineGenie MPC'],1,[],[],tt9223370,7.0,1
