,date,titre,budget,recette,duree,genres,synopsis,tagline,realisateur,casting,compagnies_production,suite,production_countries,langues,imdb_id,vote_average,vote_count,status
0,2011-04-22,दम मारो दम,4800000,8400000,130,"['Drama', 'Action', 'Crime']","ACP Vishnu is sent on a mission to investigate and clean the underbelly of Goa. During his investigation, he uncovers a huge racket and discovers the involvement of various politicians.",Every Paradise Has a Few Snakes,['Rohan Sippy'],"['Abhishek Bachchan', 'Bipasha Basu', 'Rana Daggubati', 'Prateik Babbar', 'Aditya Pancholi', 'Anaitha Nair', 'Govind Namdeo', 'Vidya Balan', 'Gulshan Devaiah', 'Deepika Padukone']","['Cheyenne Enterprises', 'Louverture Films', 'Star Studios', 'Ramesh Sippy Enterprises']",1,['IN'],"['en', 'hi']",tt1618430,5.696,23,Released
1,1995-05-12,The Perez Family,11000000,2832826,113,"['Comedy', 'Drama', 'Romance']","In the midst of the Mariel boat lift -- a hurried exodus of refugees from Cuba going to America -- an immigration clerk accidentally presumes that dissident Juan Raul Perez and Dorita Evita Perez are married. United by their last name and a mutual resolve to emigrate, Dorita and Juan agree to play along. But it gets complicated when the two begin falling for each other just as Juan reunites with his wife, Carmela, whom he hasn't seen in decades.","On the way to finding a family, she found love.",['Mira Nair'],"['Marisa Tomei', 'Alfred Molina', 'Anjelica Huston', 'Chazz Palminteri', 'Trini Alvarado', 'Ruben Rabasa', 'Luis Raúl', 'Vincent Gallo', 'Celia Cruz', 'Diego Wallraff', 'Ellen Cleghorne', 'Angela Lanza', 'Bill Sage', 'Gustavo Laborie', 'Roberto Escobar', 'Sarita Choudhury', 'Glenda Díaz Rigau', 'Melissa Hickey', 'Antoni Corone', 'Mel Gorham', 'Sheila Korsi']",['Samuel Goldwyn Company'],1,['US'],['en'],tt0114113,6.517,29,Released
2,2011-09-12,Intruders,13000000,3012210,100,"['Thriller', 'Horror', 'Fantasy']","Though no one can see him, Hollow Face lurks in the corners, desperately desiring love but only knowing how to spread fear and hate. He creeps into the life of John Farrow after Farrow’s beloved 13-year-old daughter Mia is assaulted in their home. The line between the real and the imaginary blurs as fissures start to open within the family unit. It seems that no security measure can keep Hollow Face out.",The Nightmare is Real.,['Juan Carlos Fresnadillo'],"['Clive Owen', 'Carice van Houten', 'Ella Purnell', 'Adrian Rawlins', 'Daniel Brühl', 'Ella Hunt', 'Kerry Fox', 'Pilar López de Ayala', 'Izán Corchero', 'Imogen Gray', 'Michael Nardone', 'Mark Wingett', 'Natasha Dosanjh', 'Héctor Alterio', 'Ralph Ineson']","['Universal Pictures International (UPI)', 'Apaches Entertainment', 'Canal+ España', 'Ministerio de Cultura', 'Atresmedia']",1,"['US', 'ES', 'GB']","['en', 'fr', 'it', 'es']",tt1634121,5.446,420,Released
3,2002-05-31,El último tren,2500000,481199,94,"['Drama', 'Action', 'Western', 'Adventure', 'Comedy']","Three old man, a little boy training to protect an old patrimony, La ""33"", the last train.",Do not forget. Do not sell yourself. Do not give up.,['Diego Arsuaga'],"['Héctor Alterio', 'Federico Luppi', 'Pepe Soriano', 'Gastón Pauls', 'Elisa Contreras', 'Balaram Dinard', 'Eduardo Miglionico', 'Saturnino García', 'Jenny Goldstein', 'Fred Deakin']","['Patagonik', 'Tornasol Films', 'Telefe', 'Taxi Films', 'OK Films', 'Rambla Producciones']",1,"['UY', 'AR', 'ES']",['es'],tt0303267,6.056,9,Released
4,2010-09-30,Про любоff,2000000,1268793,107,"['Romance', 'Drama']","У девушки Даши, приехавшей с подругой «покорять» Москву, редкая специальность — преподаватель техники речи, а жизнь — самая обыкновенная: съемная квартира, невысокие гонорары и занятия с утра до вечера. Однажды Даша получает выгодное предложение — дать уроки преуспевающему бизнесмену Владу, участвующему в политических выборах. У героев начинается бурный роман. Но случайная встреча с женой Влада заставляет Дашу взглянуть на происходящее совсем с другой стороны. И Влад оказывается совсем не героем романа и вовсе не мужчиной мечты…",,['Olga Subbotina'],"['Oksana Fandera', 'Juozas Budraitis', 'Maria Mashkova', 'Anna Starshenbaum', 'Evgeniy Stychkin', 'Olga Sutulova', 'Alisa Priznyakova', 'Andrey Kuzichyov', 'Ekaterina Vulichenko', 'Vitaliy Alshanskiy', 'Galina Kuznetsova', 'Sergey Vesnin', 'Aleksandr Pugachev', 'Mariya Kunakh']",['Profit'],1,['RU'],['ru'],tt1718881,4.4,5,Released
5,2009-12-03,Пикап: Съем без правил,2000000,2238101,81,"['Comedy', 'Romance']",Three young guys are spending their days and nights trying to pick up as many girls as possible.,,['Feliks Gerchikov'],"['Konstantin Kryukov', 'Shamil Khamatov', 'Vadim Utenkov', 'Tatyana Lyutaeva', 'Katya Gordon', 'Ekaterina Semenova', 'Pavel Syroezhkin', 'Elmira Metreveli', 'Alisa Starovoitova', 'Mikhail Pavlik', 'Alexandr Davydov', 'Nikolai Solovyov', 'Kseniya Radchenko', 'Polina Askeri', 'Ekaterina Astakhova', 'Dmitry Gotsdiner', 'Dmitry Lyamochkin', 'Elena Volkhonskaya', 'Aleksandr Revenko', 'Elena Starostina']","['Krasnaya Strela', 'Rekun - Cinema']",1,['RU'],['ru'],tt1548624,4.4,5,Released
6,2011-08-17,La piel que habito,13000000,33750478,120,"['Thriller', 'Drama', 'Horror']",A brilliant plastic surgeon creates a synthetic skin that withstands any kind of damage. His guinea pig: a mysterious and volatile woman who holds the key to his obsession.,,['Pedro Almodóvar'],"['Antonio Banderas', 'Elena Anaya', 'Marisa Paredes', 'Jan Cornet', 'Roberto Álamo', 'Eduard Fernández', 'José Luis Gómez', 'Blanca Suárez', 'Susi Sánchez', 'Bárbara Lennie', 'Fernando Cayo', 'Chema Ruiz', 'Buika', 'Ana Mena', 'Teresa Manresa', 'Gabriel Barbosa', 'Miguel Almodóvar', 'Marta R. Mahou', 'Fernando Iglesias']","['El Deseo', 'TVE', 'FilmNation Entertainment', 'Canal+ España', 'ICAA', 'Blue Haze Entertainment']",1,['ES'],"['pt', 'es']",tt1189073,7.532,3615,Released
7,2010-12-23,婚前試愛,283096,1029455,86,['Romance'],"Kiki, a sexy and charming OL, will be married to her cop boyfriend Sean in a week. During the hen night, Kiki encounters a handsome photographer named Jack and falls head over heels for him.",,[],"['Chrissie Chau', 'Him Law', ""Jacquelin Ch'ng"", 'Charmaine Fong', 'Timmy Hung', 'Jin Gang', 'Carol Yeung', 'Chen Zhi-Ming', 'Anjaylia Chan', 'Mak Cheung-Ching', 'Gill Mohindepaul Singh', 'Chan Lai-wan', 'DaDa Lo', 'Eddy Law']",[],1,[],[],tt1810618,5.3,5,Released
8,2010-02-26,ఏ మాయ చేసావే,1700000,2800000,162,"['Romance', 'Drama']",An aspiring Hindu director falls in love with a Christian girl whose parents disapprove of their impending relationship.,"A Different Love Story, Yet Again",['Gautham Vasudev Menon'],"['Naga Chaitanya Akkineni', 'Samantha Ruth Prabhu', 'Krishnudu', 'Sapan Saran', 'Sanjay Swaroop', 'Sudheer Babu', 'Surekha Vani', 'Devan', 'Lakshmi Ramakrishnan', 'Silambarasan', 'Trisha Krishnan', 'VTV Ganesh', 'Subbalakshmi', 'Leo Sivadass']",['Indira Productions'],1,['IN'],['te'],tt1602585,6.594,16,Released
9,1997-08-02,Telling Lies in America,4000000,318809,101,['Drama'],"A 17-year-old boy becomes friends with Billy Magic, the radio DJ he idolizes, and eventually slips into the payola and corruption of the entertainment world.",Just don't get caught.,['Guy Ferland'],"['Kevin Bacon', 'Brad Renfro', 'Maximilian Schell', 'Calista Flockhart', 'Paul Dooley', 'Jonathan Rhys Meyers', 'Luke Wilson', 'Tony Devon', 'Damen Fletcher', 'Jerry Swindall', 'K.K. Dodds', 'Tuesday Knight', 'James Kisicki', 'Ben Saypol', 'Rohn Thomas', 'Joe Baka', 'Dave Buckel', 'Jack Skelly', 'Matt Miller']","['Kuzui Enterprises', 'Banner Entertainment', 'Ben Myron Productions']",1,['US'],['en'],tt0120303,5.9,25,Released
10,2011-09-30,What's Your Number?,20000000,30426096,106,"['Comedy', 'Romance']","Ally Darling is realizing she's a little lost in life. Her latest romance has just fizzled out, and she's just been fired from her marketing job. Then she reads an eye-opening magazine article that warns that 96 percent of women who've been with 20 or more lovers are unlikely to find a husband. Determined to turn her life around and prove the article wrong, Ally embarks on a mission to find the perfect mate from among her numerous ex-boyfriends.",Ally's looking for the best ex of her life.,['Mark Mylod'],"['Anna Faris', 'Chris Evans', 'Ari Graynor', 'Blythe Danner', 'Ed Begley Jr.', 'Oliver Jackson-Cohen', 'Heather Burns', 'Eliza Coupe', 'Kate Simses', 'Tika Sumpter', 'Joel McHale', 'Jacquelyn Doucette', 'Chris Pratt', 'Denise Vasi', 'Martin Freeman', 'Dave Annable', 'Zachary Quinto', 'Mike Vogel', 'Andy Samberg', 'Thomas Lennon', 'Anthony Mackie', 'Jackson Nicoll', 'Ivana Miličević', 'Jason Bowen', 'Tyler Peck', 'Sondra James', 'Nadine Jacobson', 'Colby Parsons', 'Aziz Ansari', 'Ed Jewett', 'Lonnie Farmer', 'Dale Place', 'Bronwen Booth', 'John Franchi', 'Dan Marshall', 'Stephanie Atkinson']","['Regency Enterprises', 'Contrafilm', 'New Regency Pictures']",1,['US'],['en'],tt0770703,6.505,2067,Released
11,2011-05-06,The Ledge,10000000,610986,101,"['Drama', 'Thriller']",A thriller in which a battle of philosophies between a fundamentalist Christian and an atheist escalates into a lethal battle of wills.,One life. One chance. One step.,[],"['Charlie Hunnam', 'Liv Tyler', 'Terrence Howard', 'Patrick Wilson', 'Jaqueline Fleming', 'Mike Pniewski', 'Jillian Batherson', 'Dean J. West', 'Amber Gaiennie', 'Katia Gomez', 'Christopher Gorham', 'Maxine Greco', 'Geraldine Singer', 'Tyler Humphrey']","['Rising Star', 'Foresight Unlimited', 'VIP Media Group', 'Michael Mailer Films', 'Ledge Productions']",1,"['US', 'DE']",['en'],tt1535970,6.083,289,Released
12,1955-09-02,The Left Hand of God,1785000,4000000,87,"['Adventure', 'Drama', 'Western']","A man in priestly robes, seemingly the long-awaited Father O'Shea, arrives at a little-frequented Catholic mission in 1947 China. Though the man seems curiously uncomfortable with his priestly duties, his tough tactics prove very successful in the Seven Villages, as around them China disintegrates in civil war and revolution. But he has a secret, and his friendship with mission nurse Anne (an attractive war widow) seems to be taking on an unpriestly tone.",THE STRANGEST COVENANT BETWEEN GOD AND MAN EVER MADE!,['Edward Dmytryk'],"['Humphrey Bogart', 'Gene Tierney', 'Lee J. Cobb', 'Agnes Moorehead', 'E.G. Marshall', 'Jean Porter', 'Carl Benton Reid', 'Victor Sen Yung', 'Philip Ahn', 'Benson Fong', 'Robert Burton', 'Walter Soo Hoo']",['20th Century Fox'],1,['US'],['en'],tt0048291,6.2,28,Released
13,2005-06-18,The Ape,225000,225000,90,"['Drama', 'Comedy']","A young writer, nearing a mental breakdown caused by his family and boss, moves into an apartment occupied by a walking, talking, foul-mouthed ape in a Hawaiian shirt and Converse High Tops.",Harry Walker's life just got a little hairier.,[],"['James Franco', 'Brian Lally', 'Allison Bibicoff', 'Nori Jill Phillips', 'Danny Molina', 'David Markey', 'Sydney DeMarco']",['Rabbit Bandini Productions'],1,['US'],['en'],tt0403848,4.7,13,Released
14,2010-07-23,தில்லாலங்கடி,3300000,10000000,180,"['Comedy', 'Action', 'Drama']","Nisha leaves Krishna because of his easy-going attitude towards his life and career. Soon, her parents arrange her marriage with an NRI and she reluctantly agrees, but things do not go as planned.",Kicko......Kick,['Mohan Raja'],"['Jayam Ravi', 'Tamannaah Bhatia', 'Shaam', 'Vadivelu', 'Prabhu', 'Santhanam', 'Vijayalakshmi', 'Sanchita Shetty', 'Krishnakumar Ramakumar', 'Suhasini Maniratnam', 'Radha Ravi', 'Mansoor Ali Khan', 'Livingston', 'Manivannan', 'Sathyan Sivakumar', 'Nalini', 'Mayilsamy', 'John Vijay', 'Kadhal Thandapani', 'Manobala', 'Yogi Babu', 'Chandra Lakshman', 'Latha Rao', 'Krishna Kumar', 'Jayaprakash', 'Lakshmi', 'L. Raja']",['Jayam Company'],1,['IN'],['ta'],tt1503179,5.3,9,Released
15,2006-02-17,பட்டியல்,1000000,3700000,140,['Crime'],"Two contract killers, who wish to leave the crime world, are betrayed by their boss.",,['Vishnuvardhan'],"['Arya', 'Bharath Srinivasan', 'Pooja Umashankar', 'Padmapriya Janakiraman', 'Santhana Bharathi', 'Cochin Haneefa', 'Krishnakumar Ramakumar', 'Aarthi', 'Vatsala Rajagopal', 'Gowtham Sundararajan']",['SG Films'],1,['IN'],['ta'],tt1034402,7.2,5,Released
16,2006-10-12,Меченосец,5000000,3919731,108,"['Action', 'Romance', 'Thriller', 'Science Fiction']","A young boy's dreams of glory and war turn into a bitter nightmare as his father's kingdom is overrun by an invading army. Lost and alone in the woods, he finds an ancient sword that promises him the ability to claim his vengeance.",,[],"['Artyom Tkachenko', 'Chulpan Khamatova', 'Leonid Gromov', 'Aleksei Zharkov', 'Nadezhda Markina', 'Aleksandr Soldatov', 'Aleksey Gorbunov', 'Tatyana Lyutaeva', 'Nikolay Shatokhin', 'Aleksandr Tyutryumov', 'Egor Pazenko', 'Anna Slynko', 'Andrei Bilanov', 'Pavel Badyrov', 'Igor Sergeev', 'Konstantin Shelestun', 'Angelina Mirimskaya', 'Dmitriy Mukhamadeev', 'Alexander Notkin', 'Vladimir Sorokolita', 'Dmitriy Poddubniy', 'Ivan Kolesnikov', 'Lidiya Dorotenko', 'Denis Kirillov', 'Sergey Kudryavtsev', 'Tatyana Sharkova', 'Elena Bushueva', 'Yuriy Tomoshevskiy']",['CTB Film Company'],1,['RU'],['ru'],tt0477337,5.469,16,Released
17,2007-09-06,Антидурь,5000000,1413000,91,"['Action', 'Comedy', 'Crime']","Failing to complete an important assignment without casualties, fearless crime fighters from an elite special service agency, masters of disguise and simply fun guys ""Velik"" and ""Koshka"" were demoted to serve in a department of a Drug Enforcement Agency...",,['Vladimir Shchegolkov'],"['Vladimir Turchinsky', 'Dmitriy Dyuzhev', 'Tatyana Dogileva', 'Aleksandr Bashirov', 'Igor Mirkurbanov', 'Vladimir Simonov', 'Mariya Semkina', 'Igor Yatsko', 'Vladimir Vinogradov', 'Natalya Pozdnyakova', 'Grigory Perel', 'Светлана Малюкова', 'Roman Kryukov', 'Oleg Sheremet', 'Олег Сорокин', 'Vasily Strelnikov', 'Adam Bulguchev', 'Gabriella Mariani', 'Mariya Chernova']",['RWS'],1,['RU'],['ru'],tt1110037,2.2,4,Released
18,2003-01-24,Stealing Sinatra,10000000,10,96,"['History', 'Crime', 'Drama']","In need of a grubstake, a young man convinces a couple of friends to help him kidnap Frank Sinatra Jr. It's a true story",What's a little kidnapping among friends?,['Ron Underwood'],"['David Arquette', 'William H. Macy', 'Thomas Ian Nicholas', 'Matthew Bennett', 'Deanna Milligan', 'Desiree Zurowski', 'Sam McMurray', 'Eric Johnson', 'Ryan Browning', 'Michael Coristine', 'Gillian Barber', 'Kevin McNulty', 'Colin Cunningham', 'Ron Chartier', 'James Russo', 'Evangeline Lilly']",[],1,[],['en'],tt0311863,5.1,13,Released
19,2010-10-19,West Is West,3837625,3867000,103,['Comedy'],"Manchester, North of England, 1975. The now much diminished, but still dysfunctional, Khan family continues to struggle for survival. Sajid, the youngest Khan is deep in pubescent crisis under heavy assault both from his father's tyrannical insistence on Pakistani tradition, and from the fierce bullies in the schoolyard. So, in a last, desperate attempt to 'sort him out', his father decides to pack him off to Mrs Khan No 1 and family in the Punjab, the wife and daughters he had abandoned 35 years earlier.",Same family. Different country. A lot more baggage.,['Andy de Emmony'],"['Aqib Khan', 'Om Puri', 'Linda Bassett', 'Robert Pugh', 'Jimi Mistry', 'Vanessa Hehir', 'Lesley Nicol', 'Zita Sattar', 'Ila Arun', 'Vijay Raaz', 'Emil Marwa', 'Nadim Sawalha', 'Thomas Russell']","['BBC Films', 'Assassin Films']",2,['GB'],"['en', 'pa']",tt1441956,6.606,33,Released
20,2011-03-10,Gooische Vrouwen,3500000,18000000,105,['Drama'],"Gooische Vrouwen (Vipers Nest) is based on a very popular Dutch TV series and can be described as a Dutch variation of Sex and the City and Desperate Housewives. The film tells the story of four girlfriends who live in the bourgeois area ‘t Gooi, where life always seems to run smoothly, but dark clouds are gathering on the horizon. A flight seems the only way out…",,['Will Koopman'],"['Linda de Mol', 'Susan Visser', 'Tjitske Reidinga', 'Lies Visschedijk', 'Peter Paul Muller', 'Derek de Lint', 'Leopold Witte', 'Daniël Boissevain']",['Independent Films'],2,"['NL', 'FR']",['nl'],tt1700423,6.022,44,Released
