,date,titre,budget,recette,duree,genres,synopsis,tagline,realisateur,casting,compagnies_production,suite,production_countries,langues,imdb_id,vote_average,vote_count,status
31,2010-10-05,வ,300000,1500000,159,"['Action', 'Comedy', 'Drama']","Sundararajan comes to Chennai from Coimbatore on his way to Saudi Arabia. He is received by Marthandam, a veterinary doctor, who is going to marry his sister soon. After the travel agent informs Sura that he cannot taste liquor or women in Saudi, he, along with Marthandam, goes to a wine shop to have the last gulp. It’s a dry day thanks to elections. Though disappointed, Sura is determined to taste the ‘quarter’ and starts his journey to various places in Chennai where he is told that liquor would be available. He goes to a politico who supplies wine for votes, a star hotel, an Anglo-Indian group of youngsters, a fish market, a gambling den, a kulfi shop and a brothel house among other places, all in search of ‘quarter’.",Va Quarter Cutting,"['Pushkar', 'Gayathri']","['Shiva', 'Lekha Washington', 'John Vijay', 'Abhinaya Sri', 'Arya']","['Cloud Nine Movies', 'Y NOT Studios']",1,['IN'],['ta'],tt1735932,5.5,2,Released
32,2007-11-08,பொல்லாதவன்,1600000,7600000,150,"['Action', 'Drama']","Prabhu is dejected when he learns that his bike has been stolen. He decides to find the people who stole the bike, but lands in trouble when he realises that his bike has been used to transport drugs.",,['Vetrimaaran'],"['Dhanush', 'Kishore', 'Divya Spandana', 'Daniel Balaji', 'Sentrayan', 'Karunas', 'Daniel Annie Pope', 'Chetan', 'Pawan', 'Bhanupriya', 'Santhanam', 'Anju Prabhakar', 'Brinda Parekh']",['Group Company'],1,['IN'],['ta'],tt2355791,7.368,19,Released
33,2006-05-26,புதுப்பேட்டை,3400000,5000000,179,"['Action', 'Drama', 'Crime']","After seeing his mother dead, a young boy runs away and is later recruited by a gangster. After becoming the right hand man of his employer, he makes serious enemies and everyone starts targeting him.",Survival Of The Fittest.,['Selvaraghavan'],"['Dhanush', 'Sneha', 'N. Azhagamperumal', 'Sonia Agarwal', 'Nithish Veera', 'Prudhviraj', 'Bala Singh', 'Thennavan', 'Aadukalam Murugadoss', 'Boxer Dheena', 'Munnar Ramesh', 'Vijay Sethupathi', 'Aadukalam Murugadoss', 'Pudhupettai suresh', 'Jai', 'Pasi Sathya']",['Lakshmi Movie Makers'],1,['IN'],['ta'],tt0459516,7.7,20,Released
34,2010-01-14,ஆயிரத்தில் ஒருவன்,7500000,20000000,182,"['Action', 'Adventure']","Anitha, a government official, embarks on a journey to find Chandramouli, an archaeologist, who went to Vietnam to search for any existence of the prince of the Chola dynasty.",,['Selvaraghavan'],"['Karthi', 'R. Parthiban', 'Reema Sen', 'Andrea Jeremiah', 'Prathap Pothan', 'N. Azhagamperumal', 'Abhinaya', 'Crane Manohar']",['Dream Valley Corporation'],1,['IN'],['ta'],tt1512888,6.286,28,Released
35,2011-09-29,Dream House,50000000,38502340,84,"['Drama', 'Thriller', 'Mystery']","Publisher Will Atenton quits a lucrative job in New York to relocate his wife, Libby, and their daughters to a quaint town in New England. However, as they settle into their home the Atentons discover that a woman and her children were murdered there, and the surviving husband is the town's prime suspect. With help from a neighbor who was close to the murdered family, Will pieces together a horrifying chain of events.","Once upon a time, there were two little girls who lived in a house.",['Jim Sheridan'],"['Daniel Craig', 'Naomi Watts', 'Rachel Weisz', 'Marton Csokas', 'Elias Koteas', 'Taylor Geare', 'Claire Geare', 'Rachel G. Fox', 'Jane Alexander', 'Brian Murray', 'Bernadette Quigley', 'Sarah Gadon', 'Gregory Smith', 'David Huband', 'Martin Roach', 'Lynne Griffin', 'Jonathan Potts', 'Joe Pingue', 'Jean Yoon', 'Marley Otto', 'Nigel Henry', 'Bryon Mumford', 'Ryan Blakely', 'Karen Glave', 'David Fox', 'Adam Chuckryk', 'James Collins', 'Kevin Hanchard', 'Kevin B Hartley', 'Yulia Lukin', 'Douglas Nyback', 'Chris Owens', 'Robert J. Tavenor', 'Mark Wilson']","['Cliffjack Motion Pictures', 'Morgan Creek Productions']",1,"['CA', 'US']",['en'],tt1462041,6.138,1196,Released
36,2006-12-07,Cicakman,492,1,107,"['Action', 'Science Fiction', 'Comedy']","Hairi (Saiful Apek) is a loser who lives in Metrofulus. While working in the lab, he accidentally drinks coffee that has been contaminated by a virus-infected gecko. He soon finds himself doing the most insane things, such as sticking to walls, making chirping cicak noises and adding bugs to his menu. He turns to his best friend and apartment mate, Danny (Yusry Abdul Halim), and begs him to find the reason behind his strange antics. Meanwhile, the people of Metrofulus are constantly being infected by new strains of viruses, and the only cure seems to come only from Professor Klon's (Aznil Nawawi) lab. Suspecting something amiss, Hairi and Danny launch their own investigation and discover that Professor Klon is not only the creator of such viruses, but also has a more sinister plan up his sleeve, backed by his business partners, the Ginger Boys Ramlie and AC Mizal, who first tend to take revenge on Professor Klon's failed experiment on them; making their senses turn abnormal.",,[],"['Saiful Apek', 'Fasha Sandha', 'Aznil Hj Nawawi', 'Yasmin Hani', 'Jalaluddin Hassan', 'Yusry Abdul Halim', 'Aziz Sattar']",[],1,['MY'],['ms'],tt1123372,4.5,4,Released
37,2011-06-01,शैतान,1700000,6100000,126,"['Action', 'Crime', 'Drama', 'Thriller']",Five substance-abusing friends decide to fake a kidnapping in order to bribe a police constable for covering-up a hit-and-run accident.,Free Your Inner Shaitan,['Bejoy Nambiar'],"['Rajeev Khandelwal', 'Kalki Koechlin', 'Shiv Panditt', 'Neil Bhoopalam', 'Gulshan Devaiah', 'Kirti Kulhari', 'Rajit Kapoor', 'Rajat Barmecha', 'Shivani Tanksale', 'Nikhil Chinapa', 'Pavan Malhotra', 'Rajkummar Rao', 'Rukhsar Rehman']","['Viacom18 Studios', 'Anurag Kashyap Films', 'Getaway Films Private Limited', 'Bohra Bros Productions']",1,['IN'],['hi'],tt1836912,6.4,39,Released
38,2011-08-19,The Inbetweeners Movie,4478250,88823111,97,['Comedy'],"High school graduation just wouldn’t be complete without an un-chaperoned, uninhibited and unforgettable final holiday. At least that’s what Will, Jay, Simon and Neil think when they book a two-week stay on an exotic Greek island. As their dreams of sun-drenched days and booze-filled nights are left hopelessly unfulfilled, the lads fight their way into the party scene with hilariously humiliating results in this smash hit UK raunchy comedy.",Out of school. Out of their league.,['Ben Palmer'],"['Simon Bird', 'James Buckley', 'Blake Harrison', 'Joe Thomas', 'Emily Head', 'Lydia Rose Bewley', 'Laura Haddock', 'Tamla Kari', 'Jessica Knappett', 'Theo Barklem-Biggs', 'Theo James', 'Anthony Stewart Head', 'Victoria Willing', 'Greg Davies', 'Henry Lloyd-Hughes', 'Belinda Stewart-Wilson', 'Robin Weaver', 'Martin Trenaman', 'Alex MacQueen', 'David Schaal', 'Sophie Colquhoun', 'Carolin Stoltz', 'Etalia Turnbull', ""Lauren O'Rourke"", 'Dominic Frisby', 'Lily Lovett', 'Cush Jumbo', 'Bobby Hirston', 'Tracey Temperton', 'Jimmy Roussounis', 'Matthew Wilson', 'Eloise Joseph', 'Andrew Spiers', 'Catherine Breeze', 'Christopher Miltiadou', 'Malcolm Scates', 'David Mumeni', 'Storme Toolis', 'Fernando Lopez', 'David Avery', 'Katarina Gellin', 'Shane Heron', 'Christie Aaria Emby', 'Emma Louise Cargill', 'Donna Combe', 'James Lee Hunt', 'Tyrone Jeffers', 'Aimee Kelly', 'TJ Nelson', 'Miltos Yerolemou']","['Channel 4 Television', 'Film4 Productions']",1,['GB'],['en'],tt1716772,6.145,764,Released
39,1983-12-18,The Man Who Loved Women,19000000,11000000,110,"['Comedy', 'Drama', 'Romance']",A womanizing sculptor seeks help from a psychiatrist to cure him of his obsession with women.,Deciding which woman in the world he loves most is driving him out of his mind.,[],"['Burt Reynolds', 'Julie Andrews', 'Kim Basinger', 'Marilu Henner', 'Cynthia Sikes', 'Jennifer Edwards', 'Sela Ward', 'Ellen Bauer', 'Denise Crosby', 'Tracy Vaccaro', 'Barry Corbin', 'Shelly Manne', 'Don Menza', 'Jimmy Rowles', 'Andrew Simpkins', 'Jill Carroll', 'Herb Tanney', 'Regis Philbin', 'Joseph Bernard', 'John J. Flynn Jr.', 'Jim Knaub', 'James C. Lewis', 'Roger Rose', 'Jennifer Ashley', 'Tony Brown', 'Philip Alexander', 'Jonathan Rogal', 'Jerry Martin', 'Sharon Hughes', 'Nanci Rogers', 'Kai J. Wong', 'Walter Soo Hoo', 'Marilyn Child', 'Cindi Dietrich', 'Arnie Moore', 'Lisa Blake Richards', 'Lynn Webb', 'Jason Ross', 'Alisa Lee', 'Cis Rundle', 'Judy Balduzzi', 'Marcheline Bertrand', 'Suzanne Kent', 'Cathy St. George', 'Mary Lynne Gehr', 'Ola Ray', 'Cindy Landis', 'Sheila Ryan', 'Lori Scott', 'Susan Mechsner', 'Mayra Fornos', 'Jeri Gaile', 'Mary Steele', 'Chanelle Lea', 'Paula Jones', ""Maureen O'Connor"", 'Ellyn Stern', 'Sondra Theodore', 'Tamara Barkley', 'Ben Powers']","['Columbia Pictures', 'Delphi Films']",1,['US'],['en'],tt0085891,4.719,32,Released
40,2011-07-08,Cilada.com,1483515,7586448,95,"['Comedy', 'Romance']","Exposed by his girlfriend through a video on the Internet, Bruno tries to revive his reputation, but all he can do is get into a series of traps (Cilada, in Portuguese). Cilada.com is a comedy about love and betrayal that shows the power of the Internet to transform small intimacies and slips in fame and constraints globalized.",,['José Alvarenga Jr.'],"['Bruno Mazzeo', 'Fernanda Paes Leme', 'Carol Castro', 'Fabiula Nascimento', 'Luis Miranda', 'Serjão Loroza', 'Augusto Madeira', 'Fúlvio Stefanini', 'Thelmo Fernandes', 'Marcos Caruso', 'Luis Miranda', 'Alexandre Nero', 'Karla Karenina', 'Dani Calabresa', 'Ana Paula Bouzas', 'Rita Elmôr', 'Milhem Cortaz', 'Maíra Charken', 'Miá Mello', 'Rafaela Amado', 'Débora Lamm', 'Letícia Isnard', 'Anna Lima', 'Aramis Trindade', 'Eliane Narducci', 'Fernando Caruso', 'Leandro da Matta', 'Tatsu Carvalho', 'Hannah Zeitoune']","['Casé Filmes', 'Multishow', 'Telecine', 'Teleimage']",1,['BR'],['pt'],tt1988573,5.085,130,Released
41,2010-05-06,Glukhar v kino,2500000,1477030,0,[],,,[],"['Maksim Averin', 'Denis Rozhkov', 'Aleksey Serebryakov', 'Viktoriya Tarasova', 'Boris Khimichev', 'Yuriy Chursin', 'Ravshana Kurkova', 'Vladimir Feklenko', 'Mariya Rasskazova', 'Vladimir Tsarulkov', 'Vyacheslav Manucharov', 'Pavel Basov', 'Vladislav Kotlyarskiy', 'Mariya Boltneva', 'Aleksandr Bobrov', 'Boris Pokrovskiy', 'Yuri Makeev', 'Maksim Maltsev', 'Lyubava Aristarkhova', 'Mikhail Pavlik', 'Vladimir Lyubovsky', 'Tatyana Lyannik', 'Svetlana Frolova', 'Nazar As-Samarray', 'Andrey Sorokin', 'Gleb Ivanov', 'Sergey Belov', 'Fedor Rumyantsev', 'Dmitriy Blokhin', 'Svetlana Kolomatskaya']",['DixiMedia'],1,['RU'],['ru'],tt1620464,4.2,7,Released
42,,Oerend Heerschend,500,500,93,[],De avonturen van de Heerschers op Wacken.,De avonturen van de Heerschers op Wacken.,[],[],[],1,[],[],,6.5,1,Released
