,date,titre,budget,recette,duree,genres,synopsis,tagline,realisateur,casting,compagnies_production,suite,production_countries,langues,imdb_id,vote_average,vote_count,status
0,2012-01-18,Benvenuti al Nord,6000000,35000000,105,['Comedy'],"Now in the Far North (i.e. Milan!), Alberto has accepted to manage a program for efficiency improvement in the Italian Post. He devotes all his time and all his energy to this noble task and neglects his wife Silvia, which of course annoys her beyond limits. Things do not fare much better in Castellabate where it is rather Maria, Matta's wife, who gets on his nerves by always blaming him for his lack of ambition. One day, due to a misunderstanding, Mattia is transferred to... Milan! And on whose doorstep does he land? Alberto's of course!",,['Luca Miniero'],"['Alessandro Siani', 'Claudio Bisio', 'Angela Finocchiaro', 'Valentina Lodovini', 'Paolo Rossi', 'Nando Paone', 'Giacomo Rizzo', 'Nunzia Schiano', 'Salvatore Misticone', 'Gianmarco Pozzoli', 'Carlo Giuseppe Gabardini', 'Alessandro Vighi', 'Fulvio Falzarano', 'Ippolita Baldini', 'Francesco Brandi', 'Francesco Migliaccio', 'Katia Follesa', 'Teco Celio', 'Emma Marrone']","['Medusa Film', 'Cattleya', 'Sky Cinema', 'Mediaset Premium']",2,['IT'],['it'],tt1756415,5.8,1202,Released
1,2012-04-05,हाउसफुल २,6071922,25097277,145,"['Action', 'Comedy', 'Music', 'Romance']",A comedy of errors wherein four men help each other to fool their prospective father-in-laws creating a cascade of confusion and mayhem.,,['Sajid Khan'],"['Akshay Kumar', 'John Abraham', 'Ritesh Deshmukh', 'Asin Thottumkal', 'Rishi Kapoor', 'Randhir Kapoor', 'Shreyas Talpade', 'Zareen Khan', 'Shazahn Padamsee', 'Boman Irani', 'Mithun Chakraborty', 'Chunky Pandey', 'Malaika Arora', 'Jacqueline Fernandez']","['Nadiadwala Grandson Entertainment', 'Eros Worldwide']",2,['IN'],['hi'],tt1980986,5.512,84,Released
2,2006-12-14,'N Beetje Verliefd,800000,966214,83,"['Comedy', 'Romance']","Thijs is a ripe-age Dutch tomato grower. His adult daughters plan to have him move in a skyscraper-flat, leaving home and professional life, but he takes his adolescent (half-)Moroccon grandson Omar's advice to refuse and keep living. Thijs even lets the cheerful rascal coach his love-life, which lands him on a blind date with Jacky, an energetic Flemish woman, who won't take no for an answer but turns up at his door-step till he consents, and soon drags him into evening life, preparing for a dance contest. Soon after Omar turns up, listless and lazier then ever, runaway from school and home. The obvious reason for the horny hound's hanging head is a girl: Mergal is foxy, Turkish and as smitten as he, but her burly big brother Erhan will only allow a boy to go steady with her who has proven himself his better on the field in the traditional manly sport of oil-wrestling. Now Thijs...",,['Martin Koolhoven'],"['Ad van Kempen', 'Geert de Jong', 'Yes-R', 'Tjitske Reidinga', 'Plien van Bennekom', 'Sabri Saad El-Hamus', 'Fatma Genç', 'Sadik Eksi', ""Luk D'Heu"", 'Frieda Pittoors', 'Gene Bervoets', 'Helmert Woudenberg', 'Yahya Gaier', 'Sedat Mert', 'Juliette de Wijn', 'Jos van der Donk', 'Koen van der Donk', 'Micha Hulshof', 'Sanne Vogel', 'Judith Bovenberg', ""Jacques D'Ancona""]","['Revolver Film', 'Waterland Film', 'Max TV']",1,['NL'],['nl'],tt0800164,5.3,6,Released
3,2014-06-05,Boyhood,4000000,48137666,166,['Drama'],"The film tells a story of a divorced couple trying to raise their young son. The story follows the boy for twelve years, from first grade at age 6 through 12th grade at age 17-18, and examines his relationship with his parents as he grows.",12 years in the making.,['Richard Linklater'],"['Ellar Coltrane', 'Patricia Arquette', 'Ethan Hawke', 'Lorelei Linklater', 'Libby Villari', 'Marco Perella', 'Brad Hawkins', 'Jamie Howard', 'Andrew Villarreal', 'Jenni Tooley', 'Zoe Graham', 'Charlie Sexton', 'Elijah Smith', 'Steven Chester Prince', 'Bonnie Cross', 'Sydney Orta', 'Shane Graham', 'Tess Allen', 'Ryan Power', 'Sharee Fowler', 'Mark Finn', 'Byron Jenkins', 'Holly Moore', 'David Blackwell', 'Barbara Chisholm', 'Matthew Martinez-Arndt', 'Cassidy Johnson', 'Cambell Westmoreland', 'Jennifer Griffin', 'Garry Peters', 'Merrilee McCommas', 'Tamara Jolaine', 'Jordan Howard', 'Andrew Bunten', 'Tyler Strother', 'Evie Thompson', 'Savannah Welch', 'Mika Odom', 'Sinjin Venegas', 'Nick Krause', 'Derek Chase Hickey', 'Angela Rawna', 'Megan Devine', 'Landon Collier', 'Roland Ruiz', 'Richard Jones', 'Karen Jones', 'Gordon Friday', 'Tom McTigue', 'Sam Dillon', 'Martel Summers', 'David Clark', 'Jessie Tilton', 'Richard Robichaux', 'Will Harris', 'Indica Shaw', 'Bruce Salmon', 'Wayne Sutton', 'Joe Sundell', 'Sean Tracey', 'Ben Hodges', 'Daniel Zeh', 'Chris Doubek', 'Andrea Chen', 'Mona Lee Fultz', 'Maximillian McNamara', 'Taylor Weaver', 'Jessi Mechler', 'Bill Wise', 'Alina Linklater', 'Charlotte Linklater', 'Genevieve Kinney', 'Elijah Ford', 'Kyle Crusham', 'Conrad Choucroun', 'Deanna Brochin', 'Stephen Latham', 'Heather Materne', 'Johnny Walter', 'Natalie Makenna', 'Ken Edwards']","['IFC Films', 'Detour Filmproduction']",1,['US'],"['es', 'en']",tt1065073,7.511,4558,Released
4,2011-10-14,A Few Best Men,12468389,29007412,97,['Comedy'],A comedy about a groom and his three best men who travel to the Australian outback for a wedding.,You are cordially invited to absolute mayhem,['Stephan Elliott'],"['Rebel Wilson', 'Xavier Samuel', 'Olivia Newton-John', 'Kris Marshall', 'Kevin Bishop', 'Laura Brent', 'Tim Draxl', 'Solveig Walking', 'Elizabeth Debicki', 'Jonathan Biggins', 'Oliver Torr', 'Steve Le Marquand', 'Angela Bishop', 'Alan Cinis']","['Parabolic Pictures', 'Stable Way Entertainment', 'Quickfire Films', 'Screen Australia', 'Screen NSW', 'Ingenious Broadcasting', 'Unthank Films', 'Story Bridge Films', 'Auburn Entertainment']",1,"['AU', 'GB']",['en'],tt1640711,5.755,392,Released
5,2012-07-26,Step Up Revolution,33000000,140470746,99,"['Music', 'Drama', 'Romance']","Emily arrives in Miami with aspirations to become a professional dancer. She sparks with Sean, the leader of a dance crew whose neighborhood is threatened by Emily's father's development plans.",One Step Can Change Your World,['Scott Speer'],"['Mia Michaels', 'Megan Boone', 'Kathryn McCormick', 'Jessica Guadix', 'Cleopatra Coleman', 'Zoe Aggeliki', 'Ryan Guzman', 'Tommy Dewey', 'Jordana DePaula', 'Celestina Aladekoba', 'Adam Sevani', 'Peter Gallagher', 'Angeline Appel', 'Misha Gabriel', 'Mario Ernesto Sánchez', 'Christopher Scott', 'Stephen Boss', 'Chadd Smith', 'Phillip Chbeeb', 'Emiliano Díez', 'Claudia Rocafort', 'Marc Inniss', 'Mari Koda', 'Steve Zurk', 'Kevin A. Walton', 'Tiger Kirchharz']",['Summit Entertainment'],4,['US'],['en'],tt1800741,6.924,1857,Released
6,2011-11-10,Портрет в сумерках,20000,154098,105,['Drama'],"Marina, an upper-crust social worker with a doting husband and an enviable downtown apartment, is suddenly transformed into a bizarre twilight version of herself when she is raped by three policemen.",,['Angelina Nikonova'],"['Sergey Borisov', 'Olga Dihovichnaya', 'Sergei Golyudov', 'Roman Merinov', 'Vsevolod Voronov', 'Anna Ageeva']",['Baraban Films'],1,['RU'],['ru'],tt2043962,6.6,38,Released
7,2011-09-09,Elles,4000000,911466,96,['Drama'],A journalist tries to balance the duties of marriage and motherhood while researching a piece on college women who work as prostitutes to pay their tuition.,The world's oldest profession still has its secrets.,['Małgorzata Szumowska'],"['Juliette Binoche', 'Anaïs Demoustier', 'Joanna Kulig', 'Louis-Do de Lencquesaing', 'Krystyna Janda', 'Andrzej Chyra', 'Ali Marhyar', 'François Civil', 'Jean-Marie Binoche', 'Pablo Beugnet', 'Valérie Dréville', ""Jean-Louis Coulloc'h"", 'Arthur Moncla', 'Scali Delpeyrat', 'Laurence Ragon', 'Alain Libolt', 'Swann Arlaud', 'Nicolas Layani', 'Laurent Jumeaucourt', 'José Fumanal', 'Martine Vandeville', 'Jenny Bellay', 'Tom Hénin', 'Anaïs Fabre', 'Mateusz Kościukiewicz']","['Canal+ Polska', 'ZDF', 'Slot Machine', 'Zentropa International Köln', 'Zentropa International France', 'Liberator Productions', 'Shot - Szumowski']",1,"['FR', 'DE', 'PL']","['pl', 'fr', 'en']",tt1549589,5.42,138,Released
8,1944-07-24,The Seventh Cross,1300000,3600000,110,"['Drama', 'Thriller', 'War']","In Nazi Germany in 1936 seven men escape from a concentration camp. The camp commander puts up seven crosses and, as the Gestapo returns each escapee he is put to death on a cross. The seventh cross is still empty as George Heisler seeks freedom in Holland.",His greatest role!,['Fred Zinnemann'],"['Spencer Tracy', 'Signe Hasso', 'Hume Cronyn', 'Jessica Tandy', 'Agnes Moorehead', 'Herbert Rudley', 'Felix Bressart', 'Ray Collins', 'Alexander Granach', 'Katherine Locke', 'George Macready', 'Paul Guilfoyle', 'Steven Geray', 'Kurt Katch', 'Kaaren Verne', 'Konstantin Shayne', 'George Suzanne', 'John Wengraf', 'George Zucco', 'Steven Muller', 'Eily Malyon', 'Hugh Beaumont']",['Metro-Goldwyn-Mayer'],1,['US'],"['en', 'es']",tt0037263,6.946,28,Released
9,2011-08-25,Muži v naději,1130710,6638849,115,"['Comedy', 'Romance']","Charming bon vivant Rudolf is convinced that infidelity is the basis for a happy marriage, since, after all, a woman does not want to be bored with her partner.",,['Jiří Vejdělek'],"['Bolek Polívka', 'Jiří Macháček', 'Petra Hřebíčková', 'Simona Stašová', 'Vica Kerekes', 'Lukáš Langmajer', 'Hynek Čermák', 'Filip Antonio', 'Michal Novotný', 'Jitka Čvančarová', 'Eliška Křenková', 'Emma Smetana', 'Berenika Kohoutová', 'Václav Jílek', 'Zuzana Onufráková', 'Ester Kočičková', 'Nastasja Gospičová']","['Infinity', 'RWE']",1,['CZ'],['cs'],tt2051941,7.564,141,Released
10,2011-10-15,電人ザボーガー,3000000,162288,114,"['Action', 'Science Fiction']",An evil criminal organisation called Sigma kidnap prominment business leaders to harvest their DNA and only Karate-Robo Zaborgar can save them.,"In 2011, A Robo Legend Will Rise Again",['Noboru Iguchi'],"['Yasuhisa Furuhara', 'Itsuji Itao', 'Naoto Takenaka', 'Mami Yamasaki', 'Hiroyuki Watanabe', 'Akira Emoto', 'Asami', 'Yûya Ishikawa', 'Cay Izumi', 'Yuya Miyashita', 'Yui Murata', 'Aimi Satsukawa', 'Sakichi Satō', 'Kentarô Shimazu', 'Demo Tanaka']","['Nikkatsu Corporation', 'King Record Co.', 'T-JOY', 'Denjin Zaborger Film Partners', 'Sushi Typhoon']",1,['JP'],['ja'],tt1645048,6.0,14,Released
11,2011-12-20,Мой парень - Ангел,2700000,2372984,97,"['Comedy', 'Romance', 'Fantasy', 'Adventure']","Sasha, a young student falls in love with... an angel.",,['Vera Storozheva'],"['Artur Smolyaninov', 'Anna Starshenbaum', 'Sergey Puskepalis', 'Olga Popova', 'Nikita Efremov', 'Ivan Makarevich', 'Sergey Bystrov', 'Boris Shilmansky', 'Ramil Mubinov', 'Kristina Babushkina', 'Ivan Okhlobystin', 'Gosha Kutsenko', 'Vladimir Dovzhik', 'Pavel Chukreev', 'Vasily Stepanov', 'Irina Khakamada', 'Vadim Tsallati', 'Andrey Leonov', 'Alla Meshcheryakova', 'Yanina Kogut', 'Maxim Kostromykin', 'Aleksey Maslodudov', 'Sergej Kolesnikov', 'Olga Lapshina', 'Darina Ponomaryova', 'Valery Gorin', 'Ivan Porodnov', 'Olga Dymskaya', 'Alena Yakimova', 'Olga Dvornikova', 'Galina Fyodorova', 'Darya Dolgova', 'Yan Romanov', 'Yuliana Borisova', 'Ilya Zamchalov', 'Serafima Nechaeva', 'Alexey Ovsyannikov', 'Mariya Seryogina', 'Mila Bedunkevich', 'Polina Shulika', 'Ekaterina Vulichenko']",['Paradise Production Center'],1,['RU'],"['en', 'ru']",tt2158649,7.1,17,Released
12,2012-01-27,ACAB : All Cops Are Bastards,5000000,3300000,105,"['Action', 'Drama', 'Crime']","A look at the controversial riot cops unit, told through the stories of three veteran cops and a young recruit.",,['Stefano Sollima'],"['Pierfrancesco Favino', 'Filippo Nigro', 'Marco Giallini', 'Andrea Sartoretti', 'Domenico Diele', 'Roberta Spagnuolo', 'Eugenio Mastrandrea', 'Eradis Josende Oberto', 'Carlo Marino Altomonte', 'Riccardo Angelini', 'Alessandra Antinori', 'Livio Beshir', 'Stefania Bogo', 'Antonio Brundu', 'Sebastiano Colla', 'Fabio De Caro', 'Paolo Giovannucci', 'Hope Johns', 'Balkissa Souley Maiga', 'Giorgio Marchesi', 'Gabriele Mira Rossi', 'Roberto Negri', 'Nick Nicolosi', 'Fiodor Passeo', 'Lucio Patané', 'Stefano Patti', 'Lucrezia Piaggio', 'Francesco Prando', 'Alessandro Procoli', 'Marco Rea', 'Alessandro Sanguigni', 'Giulia Smaldone', 'Souleymane Sow', 'Josafat Vagni', 'Faustino Vargas Morales', 'Ilir Jacellari']","['Babe Films', 'Cattleya', 'Fast Film', 'RAI Cinema']",1,"['FR', 'IT']",['it'],tt1893195,6.995,727,Released
13,2012-03-14,Cloclo,27563396,29193330,148,['Drama'],"A biopic of French pop star Claude Francois, most famous for co-writing the song 'My Way'. Tracing his life from his childhood in Egypt through his success in France to his untimely death in Paris in 1978.",,['Florent-Emilio Siri'],"['Jérémie Renier', 'Benoît Magimel', 'Monica Scattini', 'Sabrina Seyvecou', 'Ana Girardot', 'Joséphine Japy', 'Maud Jurez', 'Marc Barbé', 'Eric Savin', 'Sophie Meister', 'Janicke Askevold', 'Edouard Giard', 'Jérémy Charbonnel', 'Robert Knepper', 'Alison Wheeler', 'Alban Aumard', 'Fleur Lise Heuet', 'Bruno Flender', 'Shane Woodward', 'Thomas Jouannet', 'Laetitia Colombani', 'Bertrand Nadler', 'Bertrand Constant', 'Julie Boulanger', 'Alexandre Guansé', 'Michelangelo Marchese', 'Benoît Boucherifi', 'Ivan Sellier', 'Franck Gourlat', 'Laura Boujenah', 'Paul Périer', 'Vincent Nemeth', 'Xavier Mussel', 'Émilie Caen', 'Arthur Defays', 'Pascal Aubert', 'Mathieu Lagarrigue', 'Maxime Donnay', 'Philippe Naman', 'Jonathan Brecher', 'Pierre Diot', 'Michel Scotto di Carlo', 'Anna Orso', 'Célia Pilastre', 'Cécile Delberghe', 'Cosima Bevernaege', 'Gabriella Ostier', 'Frédéric Imberty', 'Aude Pépin', 'Laurent Pons', 'Bertrand Delaude', 'John Flanders', 'Christian Ameri', 'François Bureloup', 'Pierre Lucas', 'Jérémie Petrus', 'Julie Cavanna', 'Mona Walravens', 'Valériane de Villeneuve', 'Walter Shnorkell', 'Julie Nicolet', 'Marie Legault', 'Cyril Aubin', 'Bruno Paviot', 'Adrien Cauchetier', 'Jean-Marc Lallement', 'Jean-Charles Delaume', 'Kimberly Zakine', 'Julie Chevallier', 'Sacha Storto', 'Laurianne Mortureux', 'Marie Sergeant', 'Deborah Domínguez', 'Lidia Aviles', 'Julianne Binard', 'Andrew Blumenthal', 'Lucille Bobet', 'Jean-Claude Boni', 'Sarah Bonrepaux', 'Amandine Boulet', 'Marie Coulonjou', 'Lauriane de Savigny', 'Mia Frye', 'Aline Gaillot', 'Pierre-Alexandre Kabalan', 'Maxence Kouzoubachian', 'Lorianne Krieger', 'Philippe Legros', 'Thomas Lemoine', 'Pierre Lucat', 'Isabel McCann', 'July Morel', 'Gilles Nuytens', 'Marion Ossent', 'Philippe Pasquini', 'Lisette Pires', 'Gérald Raynaud', 'Laura Scibona']","['StudioCanal', 'LGM Productions']",1,['FR'],"['fr', 'it', 'ar', 'en']",tt2076176,6.43,250,Released
14,2013-09-23,Filth,5000000,9114264,97,"['Crime', 'Drama', 'Comedy']",A bigoted junkie cop suffering from bipolar disorder and drug addiction manipulates and hallucinates his way through the festive season in a bid to secure promotion and win back his wife and daughter.,"It's a filthy job getting to the top, but someone's got to do it.",['Jon S. Baird'],"['James McAvoy', 'Jamie Bell', 'Eddie Marsan', 'Imogen Poots', 'Joanne Froggatt', 'Jim Broadbent', 'Brian McCardie', 'Emun Elliott', 'Gary Lewis', 'John Sessions', 'Shauna Macdonald', 'Kate Dickie', 'Martin Compston', 'Iain De Caestecker', 'Shirley Henderson', 'Pollyanna McIntosh', 'Joy McAvoy', 'Jordan Young', 'Bobby Rainsbury', 'Therese Bradley', 'Ron Donachie', 'Tracy-Ann Oberman', 'Mitchell Mullen', 'Jake Wilson', 'Luke MacDonald', 'David Soul', ""Natasha O'Keeffe"", 'Robin Laing', 'Chidi Chickwe', 'Sanjeev Kohli', ""Neil D'Souza"", 'Megan Finn', 'Franziska Altmeyer', 'Zack Eisaku Niizato', 'Jonathan Watson', 'Craig Garner', 'Jodie Mccallum', 'Emma Bryant']","['Egoli Tossell Film', 'Entre Chien et Loup', 'Steel Mill Pictures', 'Filmgate Films', 'Logie Pictures', 'Altitude Film Entertainment', 'Film House Germany', 'Maven Screen Media']",1,"['GB', 'US', 'DE', 'SE', 'BE']",['en'],tt1450321,6.861,1453,Released
15,1973-09-06,The Student Teachers,100000,1078000,90,"['Comedy', 'Thriller']",Sexy student teachers at Valley High School give private lessons while being terrorized by a mad rapist,They can teach you a lot...Enter their course!,['Jonathan Kaplan'],"['Susan Damante', 'Brooke Mills', 'Brenda Sutton', 'Johnny Ray McGhee', 'Bob Harris', 'John Kramer', 'Dick Miller', 'Chuck Norris', 'Richard Doran', 'Tara Strohmeier', 'Nora Heflin', 'Elyssa Davalos', 'Vincent Barbi', 'Marilyn Joi', 'Becky Sharpe', 'Charles Dierkop']",[],1,['US'],['en'],tt0070743,3.7,3,Released
16,2012-08-15,एक था टाइगर,12000000,51000000,133,"['Action', 'Romance', 'Thriller']",An Indian agent is sent to observe the actions of a scientist but the mission becomes complicated when he falls in love with the scientist's Pakistani caretaker.,"Once, there was a tiger.",['Kabir Khan'],"['Salman Khan', 'Katrina Kaif', 'Ranvir Shorey', 'Roshan Seth', 'Girish Karnad', 'Gavie Chahal', 'Rajendra Sethi']","['Yash Raj Films', 'Prime Focus', 'Fantastic Films']",1,"['HK', 'IN', 'IE', 'TR']",['hi'],tt2016894,6.197,142,Released
17,2012-04-27,तेज़,7500000,3800000,121,"['Drama', 'Action', 'Thriller']","To revenge his past, Aakash Rana plants bomb in a train endangering lives of 500 passengers.",,['Priyadarshan'],"['Ajay Devgn', 'Kangana Ranaut', 'Zayed Khan', 'Anil Kapoor', 'Sameera Reddy', 'Boman Irani', 'Kevin Moore', 'Bhavna Pani', 'Philip Martin Brown', 'Dominic Power', 'Manpreet Bambra', 'Avika Gor', 'Jing Lusi', 'Jamie Maclachlan', 'Mohanlal', 'Mallika Sherawat']",['Venus Records & Tapes'],1,[],"['en', 'hi']",tt1706317,4.2,21,Released
