,date,titre,budget,recette,duree,genres,synopsis,tagline,realisateur,casting,compagnies_production,suite,production_countries,langues,imdb_id,vote_average,vote_count
0,2022-07-02,Fred,60,100,49,"['Mystery', 'Comedy', 'Thriller', 'Drama']","When his long-time crush/obsession, Judy, disappears, Fred, a hyperactive, unstable kid goes looking for her, uncovering a conspiracy involving gods, cults, pig-Latin, aliens, sacrifices, blackmail, triangles, and Bertha.",,['Ryan Moat'],"['Ryan Moat', 'Greta Scuderi', 'Cayden Shannon', 'James Forbes', 'Ruben Christie', 'Kai Humphrey', 'Jasmine Bramley', 'Liam Thredgold', 'Liam Moat', 'Lauren Edwards']",['Moat And Thredgold Productions'],1,['AU'],['en'],,10.0,1
1,2022-04-15,Testvérháború,34,10,0,"['Crime', 'Action', 'Animation', 'TV Movie', 'War']",,,[],"['Németh (Barack 13) Bálint', 'Mr. Lóránd']","['Naplopó Productions', 'Barack Stúdió']",1,['US'],['hu'],,9.0,1
2,2022-06-18,Country Boys Make Two,6,1,21,['Comedy'],"The thrilling continuation of the renowned 2019 cult classic, 'Country Boys Make Do', the sequel sees the boys on the run, hiding out from the consequences of the last film. Haunted by their past, the cowboys embark on an adventure to set things right.",More Country. More Boy.,['Josh Martin'],"['Jack Fowler', 'Josh Pike', 'Dave Stroud']",[],1,[],['en'],,0.0,0
3,2022-04-17,Testvérháború: 2. Fejezet,34,10,0,[],,,[],"['Németh (Barack 13) Bálint', 'Mr. Lóránd']",[],1,[],[],,7.0,1
4,,The Land Of Skulls 2021,50,50,2,[],"This documentary/short film covers some stories that happened during the 100 days of the Rwandan genocide. The lead role is Liberal France's soldier. This documentary is based on the historical genocide in the African country Rwanda. In 1994, France turned the civil war into an inhumane genocide killing 1.1 million people. Other than this, more than 600,000 women were raped and thousands went missing. You can hear thousands of horrible stories that happened during the 100 days of the massacre",English,[],[],[],1,[],['en'],tt15793462,0.0,0
5,,Big Man in San Fran,100000,12,120,['Comedy'],Ed's beloved pet rat has been kidnapped by terrorists. Now he has to track them across San Francisco to save his best friend.,The rat is back,[],[],[],1,[],[],,0.0,0
6,2022-06-02,Flight Maayam,25593,5000,135,"['Drama', 'Thriller', 'Mystery']","scientific research and adventure movie, A young man graduated ,he would like achieve his hole, that is a mystery it is a real event harped between space and earth in 1955 one flight is takeoff from earth.",Kottha Lokaniki Prayanam,['Manisrinivassurya'],"['Surya', 'Radhaswamy', 'Chanti']",['Mani Srinivas Productions'],1,['IN'],['te'],,0.0,0
7,2009-02-27,Venalmaram,1000,1000,124,"['Drama', 'Romance']","Vinayakan, who has hearing and speech impairment, is in love with his childhood friend, Ammu. But Vasavan, a gangster, poses a threat to their relationship as he lusts after Ammu.",Venalmaram,['Mohana Krishnan'],"['Sona Heiden', 'Lakshana', 'Bala', 'Sona Nair', 'Suraj Venjaramoodu', 'Sathyapriya']",[],1,[],['ml'],tt12833012,9.0,1
